username;date;retweets;favorites;text;geo;mentions;hashtags;id;permalink
Newsweek;2014-12-30 15:57;27;10;"CDC and FDA warn Americans to stay away from certain caramel apples after dozens infected with listeria —http://bit.ly/1xoYzyA";;;;"550078128475746304";https://twitter.com/Newsweek/status/550078128475746304
mashable;2014-12-30 15:04;320;246;"Apple patents a smart pen that could copy your handwriting onto an iPad http://on.mash.to/1B2o3kN pic.twitter.com/NwFM9rperL";;;;"550064825968390144";https://twitter.com/mashable/status/550064825968390144
engadget;2014-12-30 15:01;86;45;"Samsung squeezed past Apple in consumer satisfaction for smartphones http://engt.co/1xwqmdv pic.twitter.com/4xHhWFTfSh";;;;"550064046469558272";https://twitter.com/engadget/status/550064046469558272
CNET;2014-12-30 14:45;41;27;"Never mind Apple. Samsung's true battle in 2015 lies in emerging markets http://cnet.co/1Bl42DR pic.twitter.com/GlYO52oQTn";;;;"550060044839321601";https://twitter.com/CNET/status/550060044839321601
Inc;2014-12-30 14:38;30;19;"Apple killed its competition this holiday season @ businessinsiderhttp://bit.ly/1Ag6ayO";;@;;"550058276944363521";https://twitter.com/Inc/status/550058276944363521
iA;2014-12-30 14:19;11;8;"European users of Apple’s iTunes stores can now return goods without giving a reason for up to 14 days after purchase http://www.theguardian.com/technology/2014/dec/30/apple-introduces-14-day-return-on-itunes-scaring-coders-and-musicians …";;;;"550053574701776896";https://twitter.com/iA/status/550053574701776896
jolshan;2014-12-30 13:51;76;53;"NYC issues 8 million parking tickets a year. But great news: You'll soon be able to pay by Apple Pay or bitcoin: http://on.mktw.net/1x1QJcC";;;;"550046547489357824";https://twitter.com/jolshan/status/550046547489357824
businessinsider;2014-12-30 13:34;97;56;"Apple won Christmas by a landslide this year http://read.bi/1vELuuV pic.twitter.com/9GNu1JZOi9";;;;"550042333115600897";https://twitter.com/businessinsider/status/550042333115600897
EPro;2014-12-30 12:36;150;86;"How Apple, Google, and Microsoft embrace (and ignore) each others' app stores, in one chart http://venturebeat.com/2014/12/30/how-apple-google-and-microsoft-embrace-and-ignore-each-others-app-stores/ …pic.twitter.com/QqOfkwyvcC";;;;"550027691324624898";https://twitter.com/EPro/status/550027691324624898
MightyText;2014-12-30 15:53;6;8;"Google’s Chromecast Overtakes Apple TV in Video Streaming http://buff.ly/1twwJPu pic.twitter.com/FhxZgcnJy3";;;;"550077124938584064";https://twitter.com/MightyText/status/550077124938584064
engadgetmobile;2014-12-30 15:13;14;6;"Samsung squeezed past Apple in consumer satisfaction for smartphones http://engt.co/174ov6U pic.twitter.com/8BxGNigi0A";;;;"550067094193057792";https://twitter.com/engadgetmobile/status/550067094193057792
WSJTech;2014-12-30 14:32;17;6;"See how tech companies like Apple, Twitter and Facebook rank in terms of diversity: http://on.wsj.com/1EFvZfB pic.twitter.com/1h9GSVIh0b";;;;"550056754403237891";https://twitter.com/WSJTech/status/550056754403237891
barrysilbert;2014-12-30 13:37;13;7;"NYC weighs bitcoin, Apple Pay for parking tickets http://on.mktw.net/1AgCaml  via @ MarketWatch @ jbooton";;@ @;;"550043075834171392";https://twitter.com/barrysilbert/status/550043075834171392
WSJ;2014-12-30 12:33;181;86;"See how tech companies like Apple, Twitter and Facebook rank in terms of diversity: http://on.wsj.com/1EFvZfB $ AAPL $ FBpic.twitter.com/h1j2SapYYw";;;;"550026965248638976";https://twitter.com/WSJ/status/550026965248638976
TechCrunch;2014-12-30 12:31;156;124;"Apple details a modular stylus that can capture handwriting on any surface http://tcrn.ch/1xvdAf6 pic.twitter.com/2a3pc1BZBs";;;;"550026322605776899";https://twitter.com/TechCrunch/status/550026322605776899
futureshift;2014-12-30 12:11;365;253;"Apple patents a smart pen that could digitize your handwritten notes from any surface: http://on.mash.to/1HfbmVm pic.twitter.com/HCpJXl3Rf4";;;;"550021287457091584";https://twitter.com/futureshift/status/550021287457091584
TechCrunch;2014-12-30 11:30;57;28;"Apple’s success over Christmas was driven by the iPhone 6, the number one device activated, and iPhone 6 Plus http://tcrn.ch/1B0Xn3K";;;;"550010978478612481";https://twitter.com/TechCrunch/status/550010978478612481
yourtake;2014-12-30 10:20;29;23;"People walk on the glass floor at New York City's Apple store. http://usat.ly/1txTgLS  (Photo by @ edivictor1)pic.twitter.com/4FZaSBFzW1";;@;;"549993384304476160";https://twitter.com/yourtake/status/549993384304476160
Estadao;2014-12-30 10:04;48;68;"Apple obtém patente para produzir caneta inteligente http://oesta.do/1EFCqiY pic.twitter.com/UxXvXbqhAi";;;;"549989353624465409";https://twitter.com/Estadao/status/549989353624465409
CHIP_online;2014-12-30 10:00;3;4;"Aktienmarkt 2014: # Facebook-Aktien gewinnen, # Apple auch, # Amazon sackt ab: http://chip.biz/1A7yqlR pic.twitter.com/u3p46JNtEg";;;# # #;"549988372299939840";https://twitter.com/CHIP_online/status/549988372299939840
VentureBeat;2014-12-30 09:48;9;8;"How Apple, Google, and Microsoft embrace (and ignore) each others' app stores http://wp.me/p5hvhT-6QP0  by @ epro";;@;;"549985473150869504";https://twitter.com/VentureBeat/status/549985473150869504
NBCNightlyNews;2014-12-30 09:20;29;5;"Third company recalls caramel apples for possible listeria contamination http://nbcnews.to/1CRz22q pic.twitter.com/1bJvCEdhsE";;;;"549978465735553025";https://twitter.com/NBCNightlyNews/status/549978465735553025
2morrowknight;2014-12-30 08:54;28;17;"Apple accounted for 51% of all # smartphones and # tablets activated the week of Christmas http://on.wsj.com/1A5U0Hn $ AAPLpic.twitter.com/1wsdQ8MO0s";;;# #;"549971863649017856";https://twitter.com/2morrowknight/status/549971863649017856
svenstein;2014-12-30 08:44;1;2;"Drittgrößter Handy-Hersteller der Welt? Xiaomi! Die Produkte sehen irgendwie nach # Apple aus… http://goo.gl/ckNBFo pic.twitter.com/H27co4W5TX";;;#;"549969166565113856";https://twitter.com/svenstein/status/549969166565113856
TechCrunch;2014-12-30 08:38;43;30;"You Could Fill Up At The Pump With Apple Pay Starting Next Year http://tcrn.ch/1EFpIAH  by @ drizzled";;@;;"549967770276728832";https://twitter.com/TechCrunch/status/549967770276728832
qz;2014-12-30 08:30;12;9;"Apple’s big-screen iPhones won Christmas http://qz.com/319439 pic.twitter.com/3EWblPXP90";;;;"549965643013844992";https://twitter.com/qz/status/549965643013844992
NBCNews;2014-12-30 08:17;160;45;"Another caramel apple recall related to Listeria outbreak that's killed 5 across 10 states http://nbcnews.to/1x0XJXd pic.twitter.com/k9gJDI2L07";;;;"549962458543456256";https://twitter.com/NBCNews/status/549962458543456256
waltmossberg;2014-12-30 08:15;20;17;"Re/code’s Year in Reviews: Readers Loved Apple, Google and GoPro http://on.recode.net/1EDPaqj  via @ LaurenGoodepic.twitter.com/M22NID5eH6";;@;;"549962054040555523";https://twitter.com/waltmossberg/status/549962054040555523
YahooFinance;2014-12-30 07:44;38;15;"Apple won Christmas as 51% of new device activations were gadgets out of Cupertino http://yhoo.it/1BkSd0k $ AAPL";;;;"549954243730608128";https://twitter.com/YahooFinance/status/549954243730608128
CHIP_iOS;2014-12-30 07:30;5;4;"# Apple ist der absolute Sieger unterm Weihnachtsbaum 2014: http://chip.biz/1twM9DC  (Grafik: Flurry)pic.twitter.com/f3LLIrMmXg";;;#;"549950581423734784";https://twitter.com/CHIP_iOS/status/549950581423734784
engadget;2014-12-30 07:27;25;15;"Apple offers two week window for iTunes refunds... in Europe http://engt.co/1D4a3Gr pic.twitter.com/Cn4f9h9cWZ";;;;"549949794714935296";https://twitter.com/engadget/status/549949794714935296
guardian;2014-12-30 07:07;51;30;"Apple introduces 14-day return on iTunes, scaring coders and musicians http://trib.al/b6oqwv4";;;;"549944998616379392";https://twitter.com/guardian/status/549944998616379392
businessinsider;2014-12-30 06:29;26;13;"Apple Pay is coming to gas pumps http://read.bi/1zNShsC";;;;"549935366267240449";https://twitter.com/businessinsider/status/549935366267240449
timoschca;2014-12-30 04:36;0;0;"Thunderstrike greift MacBooks über Thunderbolt an. http://www.heise.de/mac-and-i/meldung/31C3-Thunderstrike-greift-MacBooks-ueber-Thunderbolt-an-2506839.html … # 31C3 # CCC # Apple pic.twitter.com/mdynYuYoFZ";;;# # #;"549906860476997634";https://twitter.com/timoschca/status/549906860476997634
BILD_Digital;2014-12-29 22:39;1;0;"Gute Nachricht für # Apple: Der # iPhone-Konzern dominierte Weihnachten. # BILDnerd http://www.bild.de/digital/bildnerd-ticker/digitalticker/bild-nerd-nachrichten-aus-dem-internet-39095120.bild.html …pic.twitter.com/J3l3S21HLN";;;# # #;"549816937518485504";https://twitter.com/BILD_Digital/status/549816937518485504
CNNMoney;2014-12-29 22:31;67;30;"Top smartphone makers in the world: 1. @ samsung 2. # Apple 3. # Xiaomi http://cnnmon.ie/1rvKvAQ pic.twitter.com/Zs8dYYDe0J";;@;# #;"549814949116014594";https://twitter.com/CNNMoney/status/549814949116014594
Independent;2014-12-29 22:30;27;18;"Apple Pay is on its way in 2015 — if the banks can be convinced http://ind.pn/1vmJYMM pic.twitter.com/vQ2ynDwo8G";;;;"549814679015415808";https://twitter.com/Independent/status/549814679015415808
WSJ;2014-12-29 22:27;409;155;"Apple accounted for 51% of all smartphones and tablets activated the week of Christmas: http://on.wsj.com/1A5U0Hn $ AAPLpic.twitter.com/HfNDCLydka";;;;"549814093247684608";https://twitter.com/WSJ/status/549814093247684608
TechCrunch;2014-12-29 21:28;42;25;"Flurry Finds That Apple Devices And Phablets Scored Big On Christmas http://tcrn.ch/1D3E7SI  by @ catherineshu";;@;;"549799285814865921";https://twitter.com/TechCrunch/status/549799285814865921
ACInvestorBlog;2014-12-29 19:36;8;5;"$ BBRY BlackBerry's Stock Outperformed Apple, Samsung, LG, HTC And Microsoft http://seekingalpha.com/article/2786535-blackberrys-stock-outperformed-apple-samsung-lg-htc-and-microsoft … $ AAPL $ MSFT $ SNE";;;;"549770889865474051";https://twitter.com/ACInvestorBlog/status/549770889865474051
WSJTech;2014-12-29 19:10;10;5;"Apple had a merry Christmas this year, according to a report from app analytics provider Flurry. http://on.wsj.com/1zrWv45";;;;"549764357458890754";https://twitter.com/WSJTech/status/549764357458890754
machikomemo;2014-12-29 18:53;2;4;"今日マチ子「ヒカリとツエのうた」も入ってます。この機会にぜひ！Appleが「Best of 2014」を発表 スタッフが選んだ2014年のベスト小説・マンガは？ - ITmedia eBook USER http://ebook.itmedia.co.jp/ebook/articles/1412/09/news114.html …";;;;"549760110835146752";https://twitter.com/machikomemo/status/549760110835146752
CBCNews;2014-12-29 18:30;30;34;"Our top 10 tech stories of 2014 include a futuristic hover bike and the new Apple Watch http://www.cbc.ca/1.2861850 pic.twitter.com/c47yr8YYf4";;;;"549754270556618752";https://twitter.com/CBCNews/status/549754270556618752
ForbesTech;2014-12-29 18:30;42;26;"Apple Pay is successfully bringing mobile payment to the masses: http://onforb.es/1H9oyvc";;;;"549754244375789568";https://twitter.com/ForbesTech/status/549754244375789568
MarketWatch;2014-12-29 18:22;29;16;"Here's why retail investors love Apple stock: http://on.mktw.net/1rvWleb $ AAPLpic.twitter.com/lmhM8ly1A6";;;;"549752317831311360";https://twitter.com/MarketWatch/status/549752317831311360
ClayMJohnson;2014-12-29 18:09;0;1;"Apple accounted for 51.3% of all smartphones and tablets activated. http://on.wsj.com/1zrWv45  via @ WSJD @ apple";;@ @;;"549749083351429122";https://twitter.com/ClayMJohnson/status/549749083351429122
CNNEE;2014-12-29 17:59;191;155;"Una marca de smartphones quizá desconocida para muchos le pisa los talones a Samsung y Apple en el mercado http://cnn.it/1HX3Kp0";;;;"549746460644745216";https://twitter.com/CNNEE/status/549746460644745216
CBCNews;2014-12-29 17:45;25;17;"Biggest marketing fails of 2014: Apple, Coors and more http://www.cbc.ca/1.2877875 pic.twitter.com/tO5DBojnKF";;;;"549742965087014912";https://twitter.com/CBCNews/status/549742965087014912
emrecelikrumi;2014-12-29 17:42;2;4;"Stop tweeting,FBing &read this! NEW NoPhone will replave the # iPhone6 http://www.independent.co.uk/life-style/gadgets-and-tech/news/nophone-is-the-iphone-6-alternative-that-is-just-a-cuboid-of-smooth-cold-plastic-9820224.html … # apple # android # googlepic.twitter.com/nMXFkvtfYs";;;# # # #;"549742348759207937";https://twitter.com/emrecelikrumi/status/549742348759207937
shin_R25;2014-12-29 17:00;22;10;"ダイソーありがとう！Appleの特許を回避し、遂に100均で充電ケーブルを販売 http://buff.ly/1ttGyha pic.twitter.com/tti0zt2NKL";;;;"549731768128266240";https://twitter.com/shin_R25/status/549731768128266240
mattmday;2014-12-29 16:03;3;2;"When is 6% market share & a dominant Apple Inc. OK news for Microsoft? In tablets, smartphones. New @ SeaTimesBiz-->http://blogs.seattletimes.com/microsoftpri0/2014/12/29/apple-trounces-samsung-microsoft-in-christmas-smartphone-tablet-activations/#.VKHrIWJn0Oo.twitter …";;@;#;"549717493866967042";https://twitter.com/mattmday/status/549717493866967042
SeekingAlpha;2014-12-29 16:03;5;4;"BlackBerry's Stock Outperformed Apple, Samsung, LG, HTC And Microsoft http://seekingalpha.com/article/2786535-blackberrys-stock-outperformed-apple-samsung-lg-htc-and-microsoft?source=feed_f … $ AAPL # APPLE $ LGEAF $ MSFT $ SNE $ SSNLF $ BBRY";;;#;"549717288857784320";https://twitter.com/SeekingAlpha/status/549717288857784320
LouzWate;2014-12-29 16:02;0;0;"iPhones and iPads made up over half of devices activated on Christmas http://www.engadget.com/2014/12/29/iphones-and-ipads-made-up-over-half-of-devices-activated-on-chri/?ncid=rss_truncated … Apple's still the ... pic.twitter.com/fcsQRwP5WI";;;;"549717200727453696";https://twitter.com/LouzWate/status/549717200727453696
Aaron_Lyon;2014-12-29 16:00;0;0;"Please! - Apple May Release iPhone 6S Mini http://finance.yahoo.com/news/apple-may-release-iphone-6s-190556021.html … @ WarrenGCann";;@;;"549716715341230083";https://twitter.com/Aaron_Lyon/status/549716715341230083