username;date;retweets;favorites;text;geo;mentions;hashtags;id;permalink
ForbesTech;2014-05-25 16:31;23;12;"Why might Apple be interested in Beats? For the cool factor .... and the tax factor. http://onforb.es/1jSwKHs";;;;"470708652786327552";https://twitter.com/ForbesTech/status/470708652786327552
YahooSG;2014-05-25 16:14;396;101;"# iPhone6 Details: Release Date, Sapphire Crystal Displays, Specs, Improved Camera # apple http://sg.news.yahoo.com/iphone-6-details-release-date-sapphire-crystal-displays-091948287.html …pic.twitter.com/iCAM7NGOmP";;;# #;"470704422834540545";https://twitter.com/YahooSG/status/470704422834540545
WIRED;2014-05-25 14:28;142;110;"Want a job at Google or Apple straight out of college? These are the schools where they get their peons http://wrd.cm/S184Rd";;;;"470677716501823488";https://twitter.com/WIRED/status/470677716501823488
TechCrunch;2014-05-25 13:12;44;17;"Apple's Expanded ‘Your Verse' Campaign Pitches iPad As Mobile Creation Tool http://bit.ly/1nJ712z  by @ panzer";;@;;"470658665960071168";https://twitter.com/TechCrunch/status/470658665960071168
CNET;2014-05-25 12:53;31;36;"iPad globe-trots, gets symphonic in new Apple ads http://cnet.co/TKU8wd pic.twitter.com/IHXg6UlagB";;;;"470653920176771072";https://twitter.com/CNET/status/470653920176771072