username;date;retweets;favorites;text;geo;mentions;hashtags;id;permalink
BostonGlobe;2015-12-10 15:56;26;53;"How do you like them apples? Matt Damon to deliver commencement speech at MIT http://bos.gl/YHXt8Qm pic.twitter.com/8lO6qCdqdM";;;;"675101705218969600";https://twitter.com/BostonGlobe/status/675101705218969600
FoxBusiness;2015-12-10 15:46;17;9;". @ Facebook, Apple and the FBI walk fine line over privacy & war on terror http://fxn.ws/1IIidLQ pic.twitter.com/BrZJS3Gris";;@;;"675099266138902528";https://twitter.com/FoxBusiness/status/675099266138902528
businessinsider;2015-12-10 15:42;30;24;"One of the most troubled tech stocks jumped on speculation that Apple could buy it http://read.bi/1NQsG44 pic.twitter.com/PqYZhWtT67";;;;"675098365785415680";https://twitter.com/businessinsider/status/675098365785415680
500Nordics;2015-12-10 15:40;2;5;"Congrats to @ 500Nordics investment @ Pacemaker for being named one of the top 25 apps of the year from Apple! http://time.com/4143145/best-iphone-apps-2015/ …";;@ @;;"675097688703164416";https://twitter.com/500Nordics/status/675097688703164416
ForbesTech;2015-12-10 15:40;26;10;"Microsoft follows in Apple's footsteps with carrier billing integration: http://onforb.es/1Z2cyV7 pic.twitter.com/yL1Xs2GbmQ";;;;"675097664543936512";https://twitter.com/ForbesTech/status/675097664543936512
FastCompany;2015-12-10 15:31;20;14;"Walmart is launching its own Apple Pay competitor http://buff.ly/1Rd8uQw pic.twitter.com/84OafTaoRN";;;;"675095497904926720";https://twitter.com/FastCompany/status/675095497904926720
HuffPostTech;2015-12-10 15:30;16;12;"Apple could trap you forever with its "upgrade program" http://huff.to/1SQSd1h";;;;"675095231713419264";https://twitter.com/HuffPostTech/status/675095231713419264
portalR7;2015-12-10 15:15;2;19;"Aplicativo do @ portalR7 é destaque na lista de melhores do ano da Apple http://r7.com/4ZZC pic.twitter.com/9N3uY6TXkT";;@;;"675091383586304000";https://twitter.com/portalR7/status/675091383586304000
NewGround_LLC;2015-12-10 15:01;2;2;"GoPro adds new capture features to its mobile apps and support for Apple Watch http://ow.ly/VImPi # watch # gopropic.twitter.com/QSXOYpb5Fk";;;# #;"675088005913313280";https://twitter.com/NewGround_LLC/status/675088005913313280
briantong;2015-12-10 14:51;4;18;"NEW APPLEBYTE! Apple's fugliest iPhone case we've ever seen & Apple Live TV on hold. C:http://cnet.co/1IIbCRG  YT:https://youtu.be/qGAxdmp4EYk";;;;"675085532116987905";https://twitter.com/briantong/status/675085532116987905
Slate;2015-12-10 14:25;6;6;"You can't use Apple Pay at Walmart, but you can now use "Walmart Pay": http://slate.me/1QyYwYd pic.twitter.com/cBBYfe3rPt";;;;"675078825118666752";https://twitter.com/Slate/status/675078825118666752
cnntech;2015-12-10 14:20;20;10;"Mark Cuban says Apple should ban Twitter http://money.cnn.com/2015/12/10/technology/mark-cuban-apple-twitter-criticism/index.html … by @ lisahopeking";;@;;"675077568408756224";https://twitter.com/cnntech/status/675077568408756224
qz;2015-12-10 14:05;23;31;"Almost half of Apple Watch owners have used their nose to operate the device http://qz.com/571237";;;;"675073763726204928";https://twitter.com/qz/status/675073763726204928
jptechcrunch;2015-12-10 14:02;3;9;"Apple TVの登録アプリ、早くも2600本―最大のジャンルはゲーム http://tcrn.ch/1lSGkgn pic.twitter.com/Jsyh8QuLJY";;;;"675073135734104071";https://twitter.com/jptechcrunch/status/675073135734104071
businessinsider;2015-12-10 13:57;32;32;"Wall Street still thinks Apple should buy Tesla http://read.bi/1OVPqD1 pic.twitter.com/VmpBEYQquD";;;;"675071825437675523";https://twitter.com/businessinsider/status/675071825437675523
Reporte_Indigo;2015-12-10 13:40;8;6;"Lanza Apple carcasa para extender la batería del iPhone 6 y 6S http://indiga.cc/MjDisno pic.twitter.com/CSeL9YJZTW";;;;"675067568571461632";https://twitter.com/Reporte_Indigo/status/675067568571461632
CNBCFastMoney;2015-12-10 15:54;4;4;"What should be #1 on Apple's shopping list: FBR Analyst Dan Ives http://cnb.cx/1U9L65b $ AAPL";;;#1;"675101312128798721";https://twitter.com/CNBCFastMoney/status/675101312128798721
SAI;2015-12-10 15:42;7;3;"One of the most troubled tech stocks jumped on speculation that Apple could buy it http://read.bi/1NQsG44 pic.twitter.com/MytlvYTjGf";;;;"675098365693173761";https://twitter.com/SAI/status/675098365693173761
Gadgets360;2015-12-10 15:40;3;2;"Apple TV to Get Siri Remote App for iPhone in First Half of 2016 http://gadgets.ndtv.com/apps/news/apple-tv-to-get-siri-remote-app-for-iphone-in-first-half-of-2016-776259 …pic.twitter.com/V9pa7Vebp5";;;;"675097695074181120";https://twitter.com/Gadgets360/status/675097695074181120
UOLTecnologia;2015-12-10 15:27;8;8;"Samsung e a sua aposta para bater a arquirrival Apple http://uol.com/btgvZl pic.twitter.com/VhpoGO0yI9";;;;"675094445126197248";https://twitter.com/UOLTecnologia/status/675094445126197248
farbodsaraf;2015-12-10 15:01;3;3;"2015: 14 companies dominate the global auto industry 2025: Google, Apple, Tesla, Uber http://read.bi/17ZWiyX pic.twitter.com/HvXEOWIRIk";;;;"675087935495106561";https://twitter.com/farbodsaraf/status/675087935495106561
NewsSciTech;2015-12-10 14:58;2;1;"「iOS 9.2」配信開始――Apple Musicの機能改善やiBooksでの3D Touchサポート… http://tinyurl.com/zkexajk  【科学技術ニュース http://w.rash.jp/?scitech&i=4144346 …】 # 科学技術 # ニュース";;;# #;"675087228243177473";https://twitter.com/NewsSciTech/status/675087228243177473
alicetruong;2015-12-10 14:07;5;7;"46% of Apple Watch owners have used their nose to interact with the device http://qz.com/571237/almost-half-of-apple-watch-owners-have-used-their-nose-to-operate-the-device/ … # Glanceconfpic.twitter.com/Oj0UezaMyF";;;#;"675074430712811522";https://twitter.com/alicetruong/status/675074430712811522
SAI;2015-12-10 13:57;18;9;"Wall Street still thinks Apple should buy Tesla http://read.bi/1OVPqD1 pic.twitter.com/4IR7DmKVAb";;;;"675071825458700291";https://twitter.com/SAI/status/675071825458700291
Fin__Tech;2015-12-10 13:45;2;1;"In Australia, banks disrupt Apple with mobile payments power http://buff.ly/1QycxFo pic.twitter.com/oM6QHDdheO";;;;"675068947193061376";https://twitter.com/Fin__Tech/status/675068947193061376
AlertTrade;2015-12-10 13:33;1;2;"Walmart is following… http://dlvr.it/CzCknP # FutureofFinance # androidpay # Apple # applepay # Business # TopNewspic.twitter.com/ODJjyySeeW";;;# # # # # #;"675065733592817664";https://twitter.com/AlertTrade/status/675065733592817664
Forbes;2015-12-10 13:08;41;40;"Walmart Pay isn't targeting Apple Pay http://onforb.es/1mdrz8m pic.twitter.com/76skvnSil5";;;;"675059418011148288";https://twitter.com/Forbes/status/675059418011148288
Forbes;2015-12-10 12:52;63;61;"The Apple TV store already has 2,624 apps http://onforb.es/1Z1Y4Vc pic.twitter.com/XYOgInRMOk";;;;"675055582471176193";https://twitter.com/Forbes/status/675055582471176193
lopezdoriga;2015-12-10 12:50;31;42;"Apple revela cuál fue la mejor aplicación del año http://bit.ly/1OkBz6g";;;;"675054896517767168";https://twitter.com/lopezdoriga/status/675054896517767168
GizmodoBR;2015-12-10 12:44;3;19;"Apple elege @ periscopeco como melhor app de 2015; no Brasil, @ nubankbrasil é destaque http://gizmodo.uol.com.br/apple-elege-periscope-como-melhor-aplicativo-de-2015/ …pic.twitter.com/9A5FHjjMM4";;@ @;;"675053488406192128";https://twitter.com/GizmodoBR/status/675053488406192128
el_pais;2015-12-10 12:33;20;27;"Esta es la mejor aplicación del año para Apple http://cort.as/a3vS pic.twitter.com/1BrhoYFGS2";;;;"675050844480528384";https://twitter.com/el_pais/status/675050844480528384
Slate;2015-12-10 12:21;5;6;"Apple's ugly new iPhone case is a horrible omen: http://slate.me/1NeAqQ2 pic.twitter.com/PAAgP0U52i";;;;"675047618964271107";https://twitter.com/Slate/status/675047618964271107
MarketWatch;2015-12-10 12:16;49;37;"GoPro stock surges on talk Apple may buy the whole company http://on.mktw.net/1NPWWft";;;;"675046409536733191";https://twitter.com/MarketWatch/status/675046409536733191
TheNextWeb;2015-12-10 12:05;12;16;"GoPro adds new capture features to its mobile apps and support for Apple Watch http://tnw.me/aOBZRsi pic.twitter.com/pljq4s3sTI";;;;"675043724360065024";https://twitter.com/TheNextWeb/status/675043724360065024
elkepoley;2015-12-10 11:49;0;0;"Fernbedienung für Apple TV 4: Apple schiebt Update für Remote-App nach - http://goo.gl/alerts/4Nkv # GoogleAlerts";;;#;"675039704597794817";https://twitter.com/elkepoley/status/675039704597794817
ForbesTech;2015-12-10 11:20;27;12;"On the fence about Apple's iOS 9.2 upgrade? Here is what you need to know: http://onforb.es/1md3LBy pic.twitter.com/r6leRHKC7t";;;;"675032236564041732";https://twitter.com/ForbesTech/status/675032236564041732
ThomasBrodowski;2015-12-10 11:07;0;1;"„Apple wird Tesla schlucken“: 4 Thesen zur digitalen Zukunft [hub conference] http://buff.ly/1Z1mwpN pic.twitter.com/rakWf7JpVF";;;;"675029005372948481";https://twitter.com/ThomasBrodowski/status/675029005372948481
es_engadget;2015-12-10 10:50;13;6;"Las GoPro ahora también se controlan desde el Apple Watch - http://es.engadget.com/2015/12/10/gopro-controlan-apple-watch/ …pic.twitter.com/8JcUkPx7nb";;;;"675024694639247360";https://twitter.com/es_engadget/status/675024694639247360
TechCrunch;2015-12-10 10:47;49;53;"Apple TV Now Has Over 2,600 Apps, Largest Category Is Games http://tcrn.ch/1md9JT8  by @ sarahintampa";;@;;"675024106643972096";https://twitter.com/TechCrunch/status/675024106643972096
ForbesInvestor;2015-12-10 10:43;38;30;"Tim Cook's Christmas list? Analyst says Apple's shopping list includes GoPro, Box, Tesla. http://onforb.es/1md9kA2 pic.twitter.com/A4NZqzcw4I";;;;"675023041961791488";https://twitter.com/ForbesInvestor/status/675023041961791488
ForbesTech;2015-12-10 10:40;25;18;"Here's how the Apple TV App Store is faring since being open for little more than a month: http://onforb.es/1md4qmv pic.twitter.com/jbDVsDyCJz";;;;"675022168816664576";https://twitter.com/ForbesTech/status/675022168816664576
CBSNews;2015-12-10 10:36;33;46;"These are Apple's 10 best apps of 2015: http://cbsn.ws/1RH0pCT pic.twitter.com/SD3u3LLqmu";;;;"675021195738259456";https://twitter.com/CBSNews/status/675021195738259456
WSJ;2015-12-10 10:32;33;35;"As the holidays approach, one analyst is taking a stab at what might be on Tim Cook’s wish list for Apple http://on.wsj.com/1IXxvY6";;;;"675020160827281408";https://twitter.com/WSJ/status/675020160827281408
CNET;2015-12-10 10:16;20;9;"HeartWatch app makes sense of Apple Watch heart rate data http://cnet.co/1OTVa1R pic.twitter.com/6O3jAxT5C5";;;;"675016215446859776";https://twitter.com/CNET/status/675016215446859776
FT;2015-12-10 10:05;14;19;"Free to read: time is running out on the chances of the Apple Watch catching on http://on.ft.com/1U8wEub pic.twitter.com/HJVzWAVnZG";;;;"675013399022059520";https://twitter.com/FT/status/675013399022059520
aatilley;2015-12-10 10:03;8;19;"Here are the early numbers showing how new Apple TV apps are shaping up: http://www.forbes.com/sites/aarontilley/2015/12/10/apple-tv-apps-numbers/ …";;;;"675012936214032388";https://twitter.com/aatilley/status/675012936214032388
Recode;2015-12-10 09:48;15;9;"Apple, TV Networks Clash Over Size and Makeup of Web TV Bundle http://on.recode.net/1jQIJqD pic.twitter.com/w6hczJQbyo";;;;"675009323521597441";https://twitter.com/Recode/status/675009323521597441
t3n;2015-12-10 09:25;1;2;"Das sind die besten Apps des Jahres 2015: Apple kürt die Überflieger für # iPhone, iPad und Machttp://t3n.me/1OT5G9E";;;#;"675003446945255425";https://twitter.com/t3n/status/675003446945255425
olhardigital;2015-12-10 09:25;13;29;"Case de bateria extra da Apple vira piada entre concorrentes: http://bit.ly/1Z1mXjQ pic.twitter.com/Pkm6usfSqU";;;;"675003311955677184";https://twitter.com/olhardigital/status/675003311955677184
WSJ;2015-12-10 09:22;59;48;"Wal-Mart takes on Apple and other companies by offering its own smartphone payments in stores http://on.wsj.com/1U8fAVb";;;;"675002555164958720";https://twitter.com/WSJ/status/675002555164958720
ForbesTech;2015-12-10 09:10;30;13;"Microsoft follows Apple with carrier billing integration--rolling out on Windows 10 devices: http://onforb.es/1mcV1eQ pic.twitter.com/Du9b9agiXG";;;;"674999519726190592";https://twitter.com/ForbesTech/status/674999519726190592
TheNextWeb;2015-12-10 09:05;16;12;"This is Apple's weird new Smart Battery Case for the iPhone 6s http://tnw.me/WakSFxZ pic.twitter.com/HpZgc8AZ0K";;;;"674998363063001093";https://twitter.com/TheNextWeb/status/674998363063001093
jowens510;2015-12-10 08:47;19;26;"GoPro takes flight after drone, Apple Watch app news. http://on.mktw.net/1jQz2Zb $ GPRO up 8%+ now.pic.twitter.com/chCWgJ9Jzu";;;;"674993745583022081";https://twitter.com/jowens510/status/674993745583022081
Forbes;2015-12-10 08:46;38;49;"The iPhone has been Apple's biggest moneymaker for years, which amounts to a blessing and a curse for Tim Cook http://onforb.es/1mcQDMM";;;;"674993478095515648";https://twitter.com/Forbes/status/674993478095515648
mashable;2015-12-10 08:43;21;27;"Google Play Music's family plan could trump Apple Music http://on.mash.to/1Qy86dQ";;;;"674992742116802560";https://twitter.com/mashable/status/674992742116802560
pkafka;2015-12-10 08:11;9;7;"Will NFL sell its Thursday night games to Apple or other digital outlet instead of TV? Probably not. But... http://recode.net/2015/12/10/recode-decode-nfl-media-czar-suggests-thursday-night-football-wont-move-online/ …";;;;"674984886550331392";https://twitter.com/pkafka/status/674984886550331392
engadget;2015-12-10 07:45;17;29;"Engadget giveaway: Win an Apple Watch Sport and Aim fitness tracker courtesy of Skulpt! http://engt.co/1RGIw7f pic.twitter.com/OPVU96LXtz";;;;"674978141933277188";https://twitter.com/engadget/status/674978141933277188
CNET;2015-12-10 07:43;19;17;"Create a new Apple Music playlist the logical way. Like Mr Spock would. http://cnet.co/1NP8oIf pic.twitter.com/d6l4MFFqWh";;;;"674977632879026176";https://twitter.com/CNET/status/674977632879026176
mashable;2015-12-10 07:10;43;43;"See what's inside the 'hump' of Apple's iPhone Smart Battery Case http://on.mash.to/1U7JBo1 pic.twitter.com/DXMLG2OjEO";;;;"674969335069323266";https://twitter.com/mashable/status/674969335069323266
EdmundKorres;2015-12-10 07:02;0;0;"Apples Design-Strategie: Jony Ive, siehst Du schlecht!? http://j.mp/1TBBD5E pic.twitter.com/iCYVOYVtF2";;;;"674967360105816064";https://twitter.com/EdmundKorres/status/674967360105816064
TheNextWeb;2015-12-10 06:46;27;19;"GoPro adds new capture features to its mobile apps and support for Apple Watch http://tnw.me/jcjTqck pic.twitter.com/jcbXUMVONJ";;;;"674963287461728256";https://twitter.com/TheNextWeb/status/674963287461728256
Forbes;2015-12-10 06:46;97;98;"Does Apple truly deserve the top spot on this list of the world's most innovative companies? http://onforb.es/1mbrWAw pic.twitter.com/rl7k0EPT7n";;;;"674963279169626112";https://twitter.com/Forbes/status/674963279169626112
faznet;2015-12-10 06:22;5;4;"Wir freuen uns, dass „Der Tag“ zu Apples Bestenliste 2015 gehört http://www.faz.net/-gpc-85p5g # AppStore2015pic.twitter.com/3YPvBAjKlQ";;;#;"674957289372143616";https://twitter.com/faznet/status/674957289372143616
el_pais;2015-12-10 06:16;32;31;"Esta es la mejor aplicación del año para Apple http://cort.as/a3vS pic.twitter.com/1BrhoYFGS2";;;;"674955785336696832";https://twitter.com/el_pais/status/674955785336696832
mac_and_i;2015-12-10 06:06;0;0;"Fernbedienung für Apple TV 4: Apple schiebt Update für Remote-App nach http://www.heise.de/mac-and-i/meldung/Fernbedienung-fuer-Apple-TV-4-Apple-schiebt-Update-fuer-Remote-App-nach-3039889.html … # AppleTV # Apple";;;# #;"674953252484612096";https://twitter.com/mac_and_i/status/674953252484612096
t3n;2015-12-10 05:46;14;7;"„Apple wird Tesla schlucken“: 4 Thesen zur digitalen Zukunft # hub15 http://t3n.me/1lRxRu4 pic.twitter.com/BHXGkvo2if";;;#;"674948223367290880";https://twitter.com/t3n/status/674948223367290880
TransferWise_DE;2015-12-10 05:11;0;0;"Das Beste aus 2015: Apple ernennt Apps des Jahres-wir freuen uns, dass wir dabei sind http://www.heise.de/newsticker/meldung/Das-Beste-aus-2015-Apple-ernennt-die-Apps-des-Jahres-3038449.html …pic.twitter.com/KVYsPrbc7L";;;;"674939520857579520";https://twitter.com/TransferWise_DE/status/674939520857579520
t3n;2015-12-10 03:32;5;2;"„Das Beste aus 2015“: Apple kürt die # iOS- und Mac-Apps des Jahres http://t3n.me/1RGinW8 pic.twitter.com/cubSozRGV4";;;#;"674914575259705344";https://twitter.com/t3n/status/674914575259705344
mac_and_i;2015-12-10 00:56;1;2;"2000 tvOS-Apps für Apple TV 4 erhältlich http://www.heise.de/mac-and-i/meldung/2000-tvOS-Apps-fuer-Apple-TV-4-erhaeltlich-3038647.html … # AppleTV # Apple";;;# #;"674875235355779072";https://twitter.com/mac_and_i/status/674875235355779072
KOMPAKT_APP;2015-12-10 00:41;1;0;"Mit dem # iOS92-Update behebt # Apple endlich einige Fehler. Welche das sind, findet ihr hier: http://kompakt.welt.de/3VNAokDAbKuo4KSiWk6Ue8/update …pic.twitter.com/nqzeXVk3qU";;;# #;"674871520695554048";https://twitter.com/KOMPAKT_APP/status/674871520695554048
welt;2015-12-10 00:20;1;3;"Stilsicheres Gadget: Das hübsche Luxus-Tamagotchi von Hermès und Apple http://bit.ly/1QxrAz5 pic.twitter.com/6xkCUfvfgg";;;;"674866212371869696";https://twitter.com/welt/status/674866212371869696
giordanomat;2015-12-09 23:46;0;0;"In den Apple Store gehen und dabei Geld verdienen - ein britischer Rentner weiß, wie's geht: http://kompakt.welt.de/4l1wF9PEbSIWQawGQeGAkY/alle-fotos-weg …pic.twitter.com/IQVWZI5eDr";;;;"674857613763457024";https://twitter.com/giordanomat/status/674857613763457024
TheNextWeb;2015-12-09 23:41;20;21;"This is Apple's weird new Smart Battery Case for the iPhone 6s http://tnw.me/ogHvAi4 pic.twitter.com/OFm0MdXzKf";;;;"674856466927493120";https://twitter.com/TheNextWeb/status/674856466927493120
Milenio;2015-12-09 23:37;18;24;"Regalo para navidad: Apple lanza su primera funda con batería para el iPhone http://mile.io/1ICR4tL pic.twitter.com/CTXs0PtLN1";;;;"674855320980598784";https://twitter.com/Milenio/status/674855320980598784
ForbesTech;2015-12-09 23:30;31;25;"Apple is admitting to bug fixes in iOS 9.2 http://onforb.es/1mbq3DV pic.twitter.com/Aes3cxPtKU";;;;"674853559264002049";https://twitter.com/ForbesTech/status/674853559264002049
mashable;2015-12-09 23:15;83;86;"Apple names the best iOS apps of 2015: http://on.mash.to/1QxlaAe pic.twitter.com/TiRumOPJB8";;;;"674849849083318272";https://twitter.com/mashable/status/674849849083318272
TheNextWeb;2015-12-09 22:50;12;11;"Apple reportedly puts its plans for TV service on hold http://tnw.me/ztf9S0m pic.twitter.com/jiJygrP9bQ";;;;"674843714829877249";https://twitter.com/TheNextWeb/status/674843714829877249
engadgetjp;2015-12-09 22:30;19;27;"4人に1人がスマホで健康管理。連携デバイスではFitbitとApple Watchが人気　MMD研究所調べ - http://japanese.engadget.com/2015/12/10/4-1-fitbit-apple-watch-mmd/ …pic.twitter.com/sEOw9XvJ3o";;;;"674838464014245888";https://twitter.com/engadgetjp/status/674838464014245888
Milenio;2015-12-09 22:15;10;9;"# Entérate: Periscope, la mejor app de iOS según Apple http://mile.io/1Oj0ZBm pic.twitter.com/AWaYLrEHeW";;;#;"674834710334337024";https://twitter.com/Milenio/status/674834710334337024
BuzzFeedNews;2015-12-09 21:31;13;16;"Walmart Still Not Accepting Apple Pay, Launches Walmart Pay Instead http://www.buzzfeed.com/sapna/walmart-not-accepting-apple-pay-launches-walmart-pay-instead?bftwnews&utm_term=4ldqpgc#4ldqpgc …pic.twitter.com/UesG85zQO4";;;#4ldqpgc;"674823633085186048";https://twitter.com/BuzzFeedNews/status/674823633085186048
mashable;2015-12-09 21:24;37;30;"Walmart's Apple Pay competitor uses QR codes http://on.mash.to/1SPqM84";;;;"674821877139947520";https://twitter.com/mashable/status/674821877139947520
nachtnebel;2015-12-09 21:10;0;0;"# Startup: Während Du schliefst: Geheimnisvolles… http://bit.ly/1NNSuxA # Allgemein # Apple pic.twitter.com/j02jjLLnIG";;;# # #;"674818334899093504";https://twitter.com/nachtnebel/status/674818334899093504
Slate;2015-12-09 20:46;31;32;"Why the new iPhone battery case is a sign of deep trouble for Apple: http://slate.me/1RFLpVS pic.twitter.com/tu7sbRyzTQ";;;;"674812477952163840";https://twitter.com/Slate/status/674812477952163840
klerner;2015-12-09 20:18;5;4;"So Apple is finally editing its news app. But do we know who’s editing it yet? http://recode.net/2015/12/08/apple-updates-its-news-app-to-make-it-more-like-a-newspaper/ …";;;;"674805300092903424";https://twitter.com/klerner/status/674805300092903424
tech2eets;2015-12-09 20:09;8;5;"# Apple to launch Watch 2, 4-inch iPhone 6c at an event in March next year: Report http://buff.ly/1Z0hBFH pic.twitter.com/IyNM1o8DeF";;;#;"674803194250313728";https://twitter.com/tech2eets/status/674803194250313728
mileniotv;2015-12-09 19:38;4;7;"¿Cuál es la mejor app de iOS según Apple? http://mile.io/1Oj58VV pic.twitter.com/f11Rf7fjm8";;;;"674795182408118276";https://twitter.com/mileniotv/status/674795182408118276
TechCrunch;2015-12-09 19:15;129;143;"These are Apple’s top 25 favorite iOS apps of the year http://tcrn.ch/1QwtFvm";;;;"674789406612561920";https://twitter.com/TechCrunch/status/674789406612561920
gizmodojapan;2015-12-09 19:01;27;20;"4インチのiPhone 6cも…？ 来年3月にApple Watch 2の発表イベントがあるかも http://bit.ly/1RFJsJ6 pic.twitter.com/THwkqKGryE";;;;"674785986954571776";https://twitter.com/gizmodojapan/status/674785986954571776
BloombergTV;2015-12-09 19:00;7;2;"Why Apple may be putting its live-TV plans on hold http://bloom.bg/1HUV8FT pic.twitter.com/nWaEEebwWQ";;;;"674785729474650112";https://twitter.com/BloombergTV/status/674785729474650112
Slate;2015-12-09 18:50;14;27;"Why the new iPhone battery case is a sign of deep trouble for Apple: http://slate.me/1QwX8oO pic.twitter.com/AeHNJ7B56l";;;;"674783296077881344";https://twitter.com/Slate/status/674783296077881344
aljasngenietoo;2015-12-09 18:42;5;4;"Learning to code as important as learning language: Apple CEO via @ CTVNews # yrdsbcodehttp://www.ctvnews.ca/sci-tech/learning-to-code-as-important-as-learning-language-apple-ceo-1.2693765 …";;@;#;"674781190591799298";https://twitter.com/aljasngenietoo/status/674781190591799298
CNET;2015-12-09 18:36;30;38;"Create a new Apple Music playlist the logical way http://cnet.co/1Qwk73n pic.twitter.com/QNfnboTB9s";;;;"674779660090232832";https://twitter.com/CNET/status/674779660090232832
business;2015-12-09 18:30;57;24;"Apple has suspended plans to offer a live Internet-based television service http://bloom.bg/1HTDimA pic.twitter.com/tzISvB6SU9";;;;"674778295435698176";https://twitter.com/business/status/674778295435698176
USATODAY;2015-12-09 18:30;46;45;"Do you Periscope? Apple has named it App of the Year: http://usat.ly/1HVkHGT";;;;"674778184672534528";https://twitter.com/USATODAY/status/674778184672534528
Inspirationf;2015-12-09 18:00;3;3;"Photos of the 1st Apple Store Designed by Jony Ive http://buff.ly/1lHPzAk pic.twitter.com/L8PJcbbWia";;;;"674770670484635648";https://twitter.com/Inspirationf/status/674770670484635648
aegies;2015-12-09 17:19;1;5;"apple will never, ever get what it wants in this scenario. http://recode.net/2015/12/09/why-apple-walked-away-from-tv-for-now/ …";;;;"674760259634790400";https://twitter.com/aegies/status/674760259634790400
Milenio;2015-12-09 17:10;17;23;"Regalo para navidad: Apple lanza su primera funda con batería para el iPhone http://mile.io/1ICR4tL pic.twitter.com/WiUcUXFCcT";;;;"674757944328630272";https://twitter.com/Milenio/status/674757944328630272
CNBC;2015-12-09 17:01;14;10;"Apple's Smart Battery Case takes aim at a much-bemoaned issue. But is it the best solution? Reviewers are skeptical. http://cnb.cx/1TZMJSE";;;;"674755692100648961";https://twitter.com/CNBC/status/674755692100648961
hopper;2015-12-09 16:52;0;3;"Apple's 25 best iPhone apps of the year http://ti.me/1Q0dacm  via @ LisaEadicicco of @ TIME";;@ @;;"674753546726850560";https://twitter.com/hopper/status/674753546726850560
TheNextWeb;2015-12-09 16:46;13;14;"This is Apple's weird new Smart Battery Case for the iPhone 6s http://tnw.me/aRXfjOZ pic.twitter.com/qWd7AP2VCB";;;;"674751920599392256";https://twitter.com/TheNextWeb/status/674751920599392256
_DrDi;2015-12-09 16:40;5;4;"Sure is.Learning to code as important as learning language Apple CEO http://ctv.news/GzintHf # UOITBEd @ JanetteMHughes @LMo_Toronto @ kayuoit";;@ @LMo_Toronto @;#;"674750456820797440";https://twitter.com/_DrDi/status/674750456820797440
CTVNews;2015-12-09 16:37;27;28;"Learning to code as important as learning language: Apple CEO Tim Cook http://ow.ly/VGN5q pic.twitter.com/8QeHTz6k0N";;;;"674749708510896128";https://twitter.com/CTVNews/status/674749708510896128
FT;2015-12-09 16:35;17;25;"Free to read: time is running out on the chances of the Apple Watch catching on http://on.ft.com/1lvfawB pic.twitter.com/m9ifgjxfmI";;;;"674749151503106048";https://twitter.com/FT/status/674749151503106048
homeaway;2015-12-09 16:23;1;1;"New apps show off Apple TV's bigger potential, including @ homeaway http://on.mash.to/1NH4sxq  via @ mashablepic.twitter.com/L7aqQgOWuk";;@ @;;"674746113996546049";https://twitter.com/homeaway/status/674746113996546049
LanceUlanoff;2015-12-09 16:22;3;6;"Apple names the best iOS apps of 2015 http://mashable.com/2015/12/09/apple-best-ios-apps-2015/ …";;;;"674745984132505601";https://twitter.com/LanceUlanoff/status/674745984132505601
einfachbloggen;2015-12-09 16:10;0;0;"Gerüchte: # Apple legt # TV- # Streaming-Dienst angeblich auf Eis - http://www.heise.de/mac-and-i/meldung/Apple-legt-TV-Streaming-Dienst-angeblich-auf-Eis-3037386.html … # AppleTV # Video # cbs";;;# # # # # #;"674742949696114688";https://twitter.com/einfachbloggen/status/674742949696114688
