username;date;retweets;favorites;text;geo;mentions;hashtags;id;permalink
mashable;2016-10-14 16:53;13;44;"Enjoy autumn with a mesmerizing miniature caramel apples tutorial http://on.mash.to/2e7Cy05 pic.twitter.com/UFiHjGL56I";;;;"787078806733516800";https://twitter.com/mashable/status/787078806733516800
TechCrunch;2016-10-14 16:32;26;36;"That Nike-branded Apple Watch arrives October 28 http://tcrn.ch/2ezGzxJ";;;;"787073527883104256";https://twitter.com/TechCrunch/status/787073527883104256
ctvottawa;2016-10-14 16:27;7;11;"Apple Road Goat Milk Soap - @ JoelCTV visits a # Wakefield farm where goats are helping preserve a way of life. http://ottawa.ctvnews.ca/video?clipId=972931&binId=1.1164511&playlistPageNum=1 …pic.twitter.com/jibjHpjkha";;@;#;"787072412462481409";https://twitter.com/ctvottawa/status/787072412462481409
JohnLegere;2016-10-14 16:04;16;125;"Yep – I’m getting one, @ apple!! Can mine be # magenta, tho?http://tcrn.ch/2edC1Jp";;@;#;"787066536921935872";https://twitter.com/JohnLegere/status/787066536921935872
olhardigital;2016-10-14 15:00;17;34;"iPhone 4 e MacBook Air (2010) deixam de receber suporte da Apple http://bit.ly/2epEiWG pic.twitter.com/CtdcuzEnSN";;;;"787050357385932801";https://twitter.com/olhardigital/status/787050357385932801
TrixiMaus502;2016-10-14 14:24;0;0;"Sexismus: Apple-Store-Mitarbeiter sollen Kundinnen Fotos geklaut haben http://www.golem.de/news/sexismus-apple-store-mitarbeiter-sollen-kundinnen-fotos-geklaut-haben-1610-123818.html … via @ golem";;@;;"787041387057381376";https://twitter.com/TrixiMaus502/status/787041387057381376
ipb0nes;2016-10-14 14:05;0;0;"APPLE AKTIE | Aktienkurs | Nachrichten | Kurs | (865985,AAPL,US0378331005) | http://finanzen.net http://m.finanzen.net/aktien/Apple-Aktie …";;;;"787036527603965952";https://twitter.com/ipb0nes/status/787036527603965952
businessinsider;2016-10-14 13:07;9;9;"Apple is removing those clunky security cables from the iPhones in its stores http://read.bi/2dpW3CN pic.twitter.com/xoOyhlHk7I";;;;"787022099600859136";https://twitter.com/businessinsider/status/787022099600859136
Romeo_Cappu;2016-10-14 13:07;1;1;"Hinweis auf Apple-Website: Apple warnt: Darum sollten Sie Ihr iPhone beim Telefonieren nicht ans Ohr halten http://www.focus.de/6072580";;;;"787022063089451008";https://twitter.com/Romeo_Cappu/status/787022063089451008
WardenBear;2016-10-14 13:06;7;9;"Another example of the apple landing directly underneath the tree. # DonaldTrumphttp://m.huffpost.com/us/entry/us_5800b9bbe4b0162c043b532e …";;;#;"787021903395368960";https://twitter.com/WardenBear/status/787021903395368960
DRUDGE_REPORT;2016-10-14 12:39;212;123;"Govts giving billions in tax breaks to APPLE, AMAZON, other tech giants... http://on.mktw.net/2e4dFoR";;;;"787015068584030209";https://twitter.com/DRUDGE_REPORT/status/787015068584030209
CNET;2016-10-14 12:16;37;86;"10 must-have widgets for your iPhone's lock screen http://cnet.co/2eb85CT # Apple pic.twitter.com/cxL9wmZvX5";;;#;"787009079793385472";https://twitter.com/CNET/status/787009079793385472
DanielEran;2016-10-14 12:14;6;9;"US finally bans Samsung products for copying Apple (PowerBook 5300) Note: Galaxy now a nuisance/hassle brand https://www.bloomberg.com/news/articles/2016-10-14/samsung-note-7-phones-said-to-be-banned-on-u-s-airline-flights …";;;;"787008817829642241";https://twitter.com/DanielEran/status/787008817829642241
elkepoley;2016-10-14 12:14;0;0;"Apple Pay: Deutschland schon auf Apples Karte markiert - http://goo.gl/alerts/O8uNR # GoogleAlerts";;;#;"787008738251145216";https://twitter.com/elkepoley/status/787008738251145216
elkepoley;2016-10-14 12:13;0;0;"iPhone 4 und 2010er MacBook Air für Apple bald obsolet - http://goo.gl/alerts/DbXlC # GoogleAlerts";;;#;"787008569774379008";https://twitter.com/elkepoley/status/787008569774379008
CMSFreiberufler;2016-10-14 12:12;0;0;"Apple warnt Kunden ihr iPhone nicht ans Ohr zu halten: Das ist wirklich skurril: Der US-Konzern Apple hat ta... http://bit.ly/2egidWI";;;;"787008318988361728";https://twitter.com/CMSFreiberufler/status/787008318988361728
AppleWatchGuru;2016-10-14 12:03;25;33;"That Nike-branded Apple Watch Arrives October 28 -$369 for the 38mm & $399 for the 42mm http://10ng.co/AWNikeP # WearableTech # Wearablespic.twitter.com/n3I51UUuR5";;;# #;"787005824174555136";https://twitter.com/AppleWatchGuru/status/787005824174555136
klickwunder;2016-10-14 11:55;0;1;"Lohnt sich die neue Apple Watch? Finde es hier heraus: http://ow.ly/f0iY3057ys2 # tech # wearable # klickwunder @ t3nhttp://ow.ly/enVp3057yvd";;@;# # #;"787003894920511488";https://twitter.com/klickwunder/status/787003894920511488
business;2016-10-14 11:44;20;27;"On his first trip to Japan, Apple CEO Tim Cook meets with Shinzo Abe http://bloom.bg/2dcBZ8m pic.twitter.com/3Y3v0xFi4U";;;;"787001235299786752";https://twitter.com/business/status/787001235299786752
timo_media;2016-10-14 16:22;0;0;"Sexismus: Apple-Store-Mitarbeiter sollen Kundinnen Fotos geklaut haben http://www.golem.de/news/sexismus-apple-store-mitarbeiter-sollen-kundinnen-fotos-geklaut-haben-1610-123818.html …";;;;"787071050467139584";https://twitter.com/timo_media/status/787071050467139584
weathernetwork;2016-10-14 16:00;3;10;"Top Video of the Week: Family of 4 black bears go apple picking while listening to @ Beyonce http://ow.ly/r16h305cm3w # FridayFeelingpic.twitter.com/MxC7LOX9YZ";;@;#;"787065563369660416";https://twitter.com/weathernetwork/status/787065563369660416
Gadgets360;2016-10-14 15:30;5;10;"SIM-free and unlocked versions of # iPhone7 and # iPhone7Plus now available from Apple online store http://gadgets.ndtv.com/mobiles/news/iphone-7-iphone-7-plus-now-available-sim-free-and-unlocked-in-the-us-1474039 …";;;# #;"787057902594818048";https://twitter.com/Gadgets360/status/787057902594818048
thefootballgirl;2016-10-14 15:22;5;11;"Apple. Tree. Not falling. Trump Jr. Suggested Women Who Can't Take Harassment “Don’t Belong In The Workforce" https://www.buzzfeed.com/passantino/donald-trump-jr-suggested-women-who-cant-take-sexual-harassm?utm_term=.cl27e21g7 …";;;;"787055949416689665";https://twitter.com/thefootballgirl/status/787055949416689665
powerFPC;2016-10-14 15:16;2;8;"Would you spend half your annual salary on an iPhone? Apple’s hoping people in India willyeah right. @ Kristallklarthttp://www.cnbc.com/id/104000638?utm_source=&utm_medium=&utm_campaign=SCMPSocialNewsfeed …";;@;;"787054600780181504";https://twitter.com/powerFPC/status/787054600780181504
powerFPC;2016-10-14 14:42;1;15;"OPPO overtakes Apple by sales value in India  http://www.ecoti.in/3e1x4b";;;;"787045885175889920";https://twitter.com/powerFPC/status/787045885175889920
MyBlackMatters2;2016-10-14 14:28;3;3;"The Crab Apple does fall far from the Crap Tree... # TrumpJrhttp://linkis.com/huffingtonpost.com/i4jSP …";;;#;"787042327076286465";https://twitter.com/MyBlackMatters2/status/787042327076286465
goinvo;2016-10-14 14:03;4;1;"How a company that makes an iPhone-powered glucose monitor made a smart pivot before Apple killed the headphone jack http://buff.ly/2e4130U pic.twitter.com/ZcqdP2WdF5";;;;"787036032642453504";https://twitter.com/goinvo/status/787036032642453504
Robert_Schmidt_;2016-10-14 13:12;5;2;"Why governments are giving billions in tax breaks to Apple, Amazon and other tech giants # datacenters # datacenterhttp://buff.ly/2e7IlCK";;;# #;"787023169370591232";https://twitter.com/Robert_Schmidt_/status/787023169370591232
SAI;2016-10-14 13:07;3;3;"Apple is removing those clunky security cables from the iPhones in its stores http://read.bi/2dpW3CN pic.twitter.com/CB2uPvBygU";;;;"787022108002050048";https://twitter.com/SAI/status/787022108002050048
TheStreet;2016-10-14 11:47;3;3;"Amazon's gamble that its music streaming service can beat Apple, Spotify: http://trib.al/9Op2Ntb $ AMZN $ AAPLpic.twitter.com/UawQr95EW7";;;;"787001797781127168";https://twitter.com/TheStreet/status/787001797781127168
AndreaKollo;2016-10-14 11:32;1;2;"The apples are rotting on the ground next to the tree. http://fb.me/4OPc2tAFc";;;;"786998212045500416";https://twitter.com/AndreaKollo/status/786998212045500416
theGMIC;2016-10-14 11:22;2;1;"# Samsung finally pulling the plug on the # GalaxyNote7! http://mashable.com/2016/10/14/samsung-galaxy-note-7-nightmare-mashtalk/#P96mzzMSq05q … # IoT # Tech # AppDev # Innovation # Apple # Android";;;# # #P96mzzMSq05q # # # # # #;"786995657705869312";https://twitter.com/theGMIC/status/786995657705869312
retheauditors;2016-10-14 11:20;2;2;"Why governments are giving billions in tax breaks to Apple, Amazon... http://on.mktw.net/2dnMZ1k  Make-good on jobs for tax breaks rarely done.";;;;"786995125662707712";https://twitter.com/retheauditors/status/786995125662707712
t3n;2016-10-14 11:16;2;3;"Mac lass nach: Apples # Macbook-Absatz sinkt – woran liegts? [Analyse]http://t3n.de/news/apple-mac-macbook-absatz-sinkt-726118/ …";;;#;"786994178450423808";https://twitter.com/t3n/status/786994178450423808
TheNextWeb;2016-10-14 10:45;12;10;"Apple Watch could one day identify users via heartbeat http://tnw.me/DVBNtrl pic.twitter.com/FBK060ihOI";;;;"786986422196731904";https://twitter.com/TheNextWeb/status/786986422196731904
CNET;2016-10-14 10:45;12;12;"The Apple # iPhone7 and 7 Plus are now available sim-free http://cnet.co/2dhno6C # Apple pic.twitter.com/Py7qMvJnal";;;# #;"786986179635900416";https://twitter.com/CNET/status/786986179635900416
Italians4Trump;2016-10-14 10:44;21;11;"Govts giving billions in tax breaks to APPLE, AMAZON, other tech giants... http://www.marketwatch.com/story/why-governments-are-giving-billions-in-tax-breaks-to-apple-amazon-and-other-tech-giants-2016-10-13 …";;;;"786986118273232896";https://twitter.com/Italians4Trump/status/786986118273232896
TheNextWeb;2016-10-14 10:36;14;14;"Apple Stores tempt five-finger discount by removing iPhone tethers http://tnw.me/w1leXQv pic.twitter.com/jbOhPVQu2t";;;;"786983992763551744";https://twitter.com/TheNextWeb/status/786983992763551744
AlexEpstein;2016-10-14 10:33;33;34;"Why does Apple use the local grid if they produce solar power on their own sites? http://bit.ly/1V3QJp6";;;;"786983156150857728";https://twitter.com/AlexEpstein/status/786983156150857728
BBCR1;2016-10-14 10:30;672;1844;". @ thevampsbrad: ‘I’d go to hell for a bag of apples’ - @ thevampsband do our New Music Frid-eh? interview http://www.bbc.co.uk/programmes/articles/77430fa9-045d-4ffb-ad84-9793e8ab36df …pic.twitter.com/UfpJvaJgGG";;@ @;;"786982645423017984";https://twitter.com/BBCR1/status/786982645423017984
CNNPR;2016-10-14 10:20;6;5;"Thanks to you, @ CNNgo is the #1 app in the Apple TV store! http://cnn.it/2e6S7JS pic.twitter.com/y5K2eCNLvg";;@;#1;"786980103397990400";https://twitter.com/CNNPR/status/786980103397990400
businessinsider;2016-10-14 10:05;19;22;"An iPhone-powered glucose monitor made a smart pivot before Apple killed the headphone jack http://read.bi/2dPUVaN pic.twitter.com/iFGAikop1T";;;;"786976316407054336";https://twitter.com/businessinsider/status/786976316407054336
crypto_rss;2016-10-14 09:53;0;0;"Datenskandal in australischem Apple Store http://twib.in/l/r5aBLeR4ABGE # bitcoin # newspic.twitter.com/LTpQbnimhs";;;# #;"786973104685756417";https://twitter.com/crypto_rss/status/786973104685756417
guardian;2016-10-14 09:45;12;33;"The weekend cook: Thomasina Miers’ recipes for giant pork meatballs and apple eccles cakes http://trib.al/1BB9B3f";;;;"786971190350979072";https://twitter.com/guardian/status/786971190350979072
kentbye;2016-10-14 09:18;7;10;"Apple CEO Tim Cook signals that they're more likely working on AR than VR in an interview with Buzzfeed yesterday: https://www.buzzfeed.com/johnpaczkowski/apple-ceo-tim-cook-on-virtual-reality-theres-no-substitute-f?utm_term=.ouXJzQjNvY#.lmXywakxQL …";;;#;"786964476054548480";https://twitter.com/kentbye/status/786964476054548480
TheFoodLab;2016-10-14 09:17;25;90;"Hilary was wrong about another thing: Trump didn't do a great job of raising his kids. Apples trees etc etc. http://www.telegraph.co.uk/women/politics/donald-trump-jr-women-who-cant-handle-harassment-dont-belong-in/ …";;;;"786964124534136836";https://twitter.com/TheFoodLab/status/786964124534136836
BILD_Digital;2016-10-14 09:04;0;1;"Für Läufer - Apple Watch von Nike kommt Ende Oktober  http://www.bild.de/digital/smartphone-und-tablet/apple-watch/apple-watch-von-nike-kommt-ende-oktober-48284858.bild.html?utm_source=dlvr.it&utm_medium=twitter …pic.twitter.com/UhCxHGqBxV";;;;"786960944081408001";https://twitter.com/BILD_Digital/status/786960944081408001
techneave;2016-10-14 09:02;0;0;"# Apple contra Deutsche http://buff.ly/2dBJnGn";;;#;"786960322674429952";https://twitter.com/techneave/status/786960322674429952
TechCrunch;2016-10-14 09:01;27;34;"Apple will open another R&D center in Japan http://tcrn.ch/2dptwgF  by @ romaindillet";;@;;"786960187961794562";https://twitter.com/TechCrunch/status/786960187961794562
Leonid3r;2016-10-14 08:35;0;0;"iPhone 7 und iPhone 7 Plus: Lahmer Speicher im Einstiegsmodell - heise http://www.heise.de/newsticker/meldung/iPhone-7-und-iPhone-7-Plus-Lahmer-Speicher-im-Einstiegsmodell-3348751.html … # apple # iPhone7 # iPhone7Plus # Speicher # Speed";;;# # # # #;"786953492216815616";https://twitter.com/Leonid3r/status/786953492216815616
fwd;2016-10-14 08:29;14;25;"Apple CEO Tim Cook: Augmented Reality Should "Amplify" Human Experience https://www.buzzfeed.com/johnpaczkowski/apple-ceo-tim-cook-on-virtual-reality-theres-no-substitute-f?utm_term=.ch9xxwjGl … via @ johnpaczkowski @ buzzfeednewspic.twitter.com/z7rqCYUfdI";;@ @;;"786952143861272576";https://twitter.com/fwd/status/786952143861272576
joncoopertweets;2016-10-14 08:22;32;33;"The rotten apple certainly didn't fall far from the rotted tree. Donald Trump Jr is just as despicable as his dad!! http://m.huffpost.com/us/entry/us_5800b9bbe4b0162c043b532e?utm_content=buffer9a9cf&utm_medium=social&utm_source=twitter.com&utm_campaign=buffer …";;;;"786950268055351300";https://twitter.com/joncoopertweets/status/786950268055351300
mac_and_i;2016-10-14 08:06;2;1;"Apple Watch Nike+ ab dem 28. Oktober erhältlich https://www.heise.de/mac-and-i/meldung/Apple-Watch-Nike-ab-dem-28-Oktober-erhaeltlich-3350862.html … # AppleWatch # Apple";;;# #;"786946180924186624";https://twitter.com/mac_and_i/status/786946180924186624
Ethon_GmbH;2016-10-14 08:02;0;0;"Sexismus: @ Apple Store-Mitarbeiter sollen Kundinnen Fotos geklaut haben http://www.golem.de/news/sexismus-apple-store-mitarbeiter-sollen-kundinnen-fotos-geklaut-haben-1610-123818.html …";;@;;"786945291350056960";https://twitter.com/Ethon_GmbH/status/786945291350056960
YahooFinance;2016-10-14 08:02;7;12;"How Disneyland is taking cues from Uber and Apple to make sure everybody enjoys their vacation more http://yhoo.it/2daifSI pic.twitter.com/dvElBfBVA2";;;;"786945188014989312";https://twitter.com/YahooFinance/status/786945188014989312
Leonid3r;2016-10-14 07:44;0;0;"iOS 10 verhindert Screenshots von DRM-Videos - heise online http://www.heise.de/mac-and-i/meldung/iOS-10-verhindert-Screenshots-von-DRM-Videos-3348103.html … # apple # iOS10 # Screenshots # DRM # Videos";;;# # # # #;"786940640672223232";https://twitter.com/Leonid3r/status/786940640672223232
jimcramer;2016-10-14 07:36;50;74;"Apple CEO Tim Cook pours cold water on virtual reality: 'There's no substitute for human interaction' http://read.bi/2dSIEGs";;;;"786938707513315328";https://twitter.com/jimcramer/status/786938707513315328
JohnPaczkowski;2016-10-14 07:22;10;20;"Apple CEO @ tim_cook On The AR/VR Question: "There's No Substitute For Human Contact." https://www.buzzfeed.com/johnpaczkowski/apple-ceo-tim-cook-on-virtual-reality-theres-no-substitute-f …pic.twitter.com/WjS3qSbuHO";;@;;"786935294574505984";https://twitter.com/JohnPaczkowski/status/786935294574505984
engadget;2016-10-14 07:20;33;40;"Apple adds SIM-free iPhone 7 and 7 Plus option in the US http://engt.co/2dPrBm9 pic.twitter.com/yGS4R5NEDp";;;;"786934776737435648";https://twitter.com/engadget/status/786934776737435648
mashable;2016-10-14 07:06;35;53;"The Nike+ Apple Watch is coming October 28 http://on.mash.to/2dbZJJP pic.twitter.com/CWivC0IeCc";;;;"786931154750468097";https://twitter.com/mashable/status/786931154750468097
Kambis_Kohansal;2016-10-14 06:55;0;0;"App-Store-Sperre für Dash: Apple wirft Entwickler schweren Betrug vor http://bit.ly/2dknca7";;;;"786928296575524864";https://twitter.com/Kambis_Kohansal/status/786928296575524864
c4t3r;2016-10-14 06:27;0;0;"Apple Pay: Deutschland schon auf Apples Karte markiert http://buff.ly/2elV35d";;;;"786921257489096704";https://twitter.com/c4t3r/status/786921257489096704
mac_and_i;2016-10-14 05:41;1;0;"iPhone 4 und 2010er MacBook Air für Apple bald obsolet https://www.heise.de/mac-and-i/meldung/iPhone-4-und-2010er-MacBook-Air-fuer-Apple-bald-obsolet-3350588.html … # MacBookAir # iPhone";;;# #;"786909692824018944";https://twitter.com/mac_and_i/status/786909692824018944
t3n;2016-10-14 05:23;0;4;"Neue Macbooks und Co.: Apples Upgrade-Politik ist ein Trauerspiel [Analyse] http://t3n.de/news/apple-mac-macbook-absatz-sinkt-726118/ …pic.twitter.com/5EQf1pVefq";;;;"786905341233655808";https://twitter.com/t3n/status/786905341233655808
CHIP_online;2016-10-14 04:40;1;0;"Smartwatch-Hölle für Trypophobiker: An diesem Tag erscheint die Apple Watch Nike Plus http://bit.ly/2dP520L";;;;"786894481282871297";https://twitter.com/CHIP_online/status/786894481282871297
CHIPAndroid;2016-10-14 04:16;1;0;"Apple iPhone 7 Ärger: Ihr 32-GByte-Handy ist viel langsamer: Die Gerüchte kursierten bereits durchs Netz, je... http://bit.ly/2e2sy8W";;;;"786888372451053568";https://twitter.com/CHIPAndroid/status/786888372451053568
mac_and_i;2016-10-14 03:31;1;2;"Spekulationen um E-Ink-Tastatur von Apple https://www.heise.de/mac-and-i/meldung/Spekulationen-um-E-Ink-Tastatur-von-Apple-3350017.html … # Apple # EInk";;;# #;"786876996861263872";https://twitter.com/mac_and_i/status/786876996861263872
leitmedium;2016-10-14 03:30;6;2;"Oh, boy: »Apple-Store-Mitarbeiter sollen Kundinnen Fotos geklaut haben« http://www.golem.de/news/sexismus-apple-store-mitarbeiter-sollen-kundinnen-fotos-geklaut-haben-1610-123818.html …pic.twitter.com/baFy51sXvu";;;;"786876873921945600";https://twitter.com/leitmedium/status/786876873921945600
pf_finanzen;2016-10-14 03:00;0;0;"Apple-Mitarbeiter stehlen Kundenfotos: Angestellte eines Apple-Geschäfts in Australien sollen einen Ta... http://yhoo.it/2dS3rKj # uoiea";;;#;"786869370307739648";https://twitter.com/pf_finanzen/status/786869370307739648
spstrasser;2016-10-14 02:48;0;0;"iOS: iPhone: Diese Tricks sollte jeder Apple-Nutzer kennen: Apples iPhone-System iOS lernt mit jede... http://bit.ly/2eyNJ5y # vorcomde";;;#;"786866220708409344";https://twitter.com/spstrasser/status/786866220708409344
platin611;2016-10-14 00:35;0;1;"Apple Store Mitarbeiter: Angeblich Handy-Fotos geklaut, Kunden bewertet http://www.chip.de/news/Skandal-bei-Apple-Mitarbeiter-sollen-pikante-Fotos-von-Kundinnen-geklaut-haben_101534883.html …";;;;"786832712376127488";https://twitter.com/platin611/status/786832712376127488
WIRED_Germany;2016-10-14 00:28;0;0;"Facebook erhält Support für Apple TV http://bit.ly/2e2t5Kj pic.twitter.com/xkZTv6EujX";;;;"786831035237560320";https://twitter.com/WIRED_Germany/status/786831035237560320
Kleeblatt1977;2016-10-14 00:15;0;0;"Wenn das Apple passiert wäre: Warum Samsungs Fluch jetzt seine Rettung ist http://www.chip.de/news/Wenn-das-Apple-passiert-waere-Warum-Samsungs-Fluch-jetzt-seine-Rettung-ist_101460488.html …";;;;"786827829036089344";https://twitter.com/Kleeblatt1977/status/786827829036089344
pnething;2016-10-13 23:55;0;0;"Den Anschluss verpasst? Warum ist # Siri eigentlich so blöd? via @ t3n # Apple http://j.mp/2e2iqiH pic.twitter.com/Et25ikOzv1";;@;# #;"786822601524076545";https://twitter.com/pnething/status/786822601524076545
Kleeblatt1977;2016-10-13 23:22;0;0;"Apple und Samsung streiten um abgerundete Ecken - und um 399 Millionen Dollar http://www.sueddeutsche.de/digital/patentkrieg-apple-und-samsung-streiten-um-abgerundete-ecken-und-millionen-dollar-1.3201998 …";;;;"786814332944445440";https://twitter.com/Kleeblatt1977/status/786814332944445440
mparbel;2016-10-13 23:03;0;1;"Apple Pay: Deutschland schon auf Apples Karte markiert - Mac & i http://www.heise.de/mac-and-i/meldung/Apple-Pay-Deutschland-schon-auf-Apples-Karte-markiert-3349802.html …";;;;"786809568089116672";https://twitter.com/mparbel/status/786809568089116672
t_okada;2016-10-13 22:39;30;25;"「多くの国、もちろん日本でも、—人がこれ以上さらに働くことは不可能だ。長時間労働は正しい答えではない。正解なのは、テクノロジーで何か手助けになることがないか、見つけ出すことだ。Appleは人の働き方を大きく改善していきたい」 https://www.buzzfeed.com/eimiyamamitsu/walk-with-tim-cook?utm_term=.hckVgqK4 …";;;;"786803634050703362";https://twitter.com/t_okada/status/786803634050703362
iphonejanky;2016-10-13 22:25;0;0;"iPhone 4 - Apple: Warum Siri zum Problemfall werden könnte - STERN http://goo.gl/fb/AzRhCn";;;;"786800055684509696";https://twitter.com/iphonejanky/status/786800055684509696
j17sf;2016-10-13 22:08;38;24;"Apple Pay to Launch in Japan on October 25th, coming with iOS 10.1 update http://news.mynavi.jp/news/2016/10/14/251/ …";;;;"786795734934835200";https://twitter.com/j17sf/status/786795734934835200
mdierker;2016-10-13 22:05;0;0;"# Apple Pay: Deutschland schon auf Apples Karte markiert - Hoffnung? # ApplePayhttps://www.heise.de/mac-and-i/meldung/Apple-Pay-Deutschland-schon-auf-Apples-Karte-markiert-3349802.html?wt_mc=rss.apple.beitrag.atom …";;;# #;"786795048016891908";https://twitter.com/mdierker/status/786795048016891908
news_mynavi_jp;2016-10-13 22:04;67;31;"Apple Payの日本国内サービス開始は10月25日で確定 http://news.mynavi.jp/news/2016/10/14/251/ …";;;;"786794696349618178";https://twitter.com/news_mynavi_jp/status/786794696349618178
Mobilfunkbude;2016-10-13 21:48;1;1;"# Apple gegen # Samsung: Ist das neue iPhone 7 besser als das Galaxy S7?http://www.welt.de/158704656?wtrid=socialmedia.overlay_sharing.iphone.text..twitter …";;;# #;"786790882099933184";https://twitter.com/Mobilfunkbude/status/786790882099933184
BuzzFeedNews;2016-10-13 21:31;87;228;"A Family Of Bears Climbed A Tree In Someone’s Yard To Eat Apples Together https://www.buzzfeed.com/ishmaeldaro/my-apples-bring-all-the-bears-to-the-yard?bftwnews&utm_term=4ldqpgc#4ldqpgc …pic.twitter.com/QADuezZ8UQ";;;#4ldqpgc;"786786359453200384";https://twitter.com/BuzzFeedNews/status/786786359453200384
CNNEE;2016-10-13 21:03;52;54;"Ya está aquí la respuesta de Amazon a Spotify y Apple Music http://cnn.it/2dntnKo";;;;"786779404299042816";https://twitter.com/CNNEE/status/786779404299042816
CNET;2016-10-13 20:45;22;22;"The Apple Watch and your heart are very nearly in sync http://cnet.co/2daXbvk pic.twitter.com/72eJAi2lCg";;;;"786774837557596161";https://twitter.com/CNET/status/786774837557596161
engadget;2016-10-13 20:19;20;24;"Facebook Video now plays nice with Chromecast and Apple TV http://engt.co/2e8YNqK pic.twitter.com/Fo9kdx71sI";;;;"786768418955558912";https://twitter.com/engadget/status/786768418955558912
gizmodojapan;2016-10-13 20:19;64;93;"Appleが「eインク」でキー配置を自由に変えられるキーボードを開発中か http://bit.ly/2e9Adq0 pic.twitter.com/or9aNUAW6l";;;;"786768318497755136";https://twitter.com/gizmodojapan/status/786768318497755136
PCKrankenhaus;2016-10-13 20:17;0;0;"Warten auf neue Macs: Apples Rechnerverkäufe schrumpfen deutlich - Mac & i http://www.heise.de/mac-and-i/meldung/Warten-auf-neue-Macs-Apples-Rechnerverkaeufe-schrumpfen-deutlich-3348213.html …";;;;"786767849406734336";https://twitter.com/PCKrankenhaus/status/786767849406734336
PCKrankenhaus;2016-10-13 20:17;0;0;"Smartphone-Markt: Apple könnte nach Galaxy-Note-7-Debakel noch mehr Profite abräumen - Mac & i http://www.heise.de/mac-and-i/meldung/Smartphone-Markt-Apple-koennte-nach-Galaxy-Note-7-Debakel-noch-mehr-Profite-abraeumen-3348219.html …";;;;"786767804703924225";https://twitter.com/PCKrankenhaus/status/786767804703924225
PCKrankenhaus;2016-10-13 20:16;0;0;"Apple Store: Angeblicher Fotodiebstahl von Kunden-iPhones wird untersucht - Mac & i http://www.heise.de/mac-and-i/meldung/Apple-Store-Angeblicher-Fotodiebstahl-von-Kunden-iPhones-wird-untersucht-3349203.html …";;;;"786767633190424576";https://twitter.com/PCKrankenhaus/status/786767633190424576
TheNextWeb;2016-10-13 19:53;21;24;"Apple in talks with Australian company to bring dynamic keyboard tech to MacBooks http://tnw.me/cgLba67 pic.twitter.com/NWNOizasun";;;;"786761801589489664";https://twitter.com/TheNextWeb/status/786761801589489664
CNET;2016-10-13 19:05;11;24;"Stop the whining! Make Apple EarPods play nice with Xbox One http://cnet.co/2daNXQ3 pic.twitter.com/rpDgUeJ7aZ";;;;"786749673642004480";https://twitter.com/CNET/status/786749673642004480
FouzyNews;2016-10-13 17:49;0;0;"Apple Pay: Deutschland schon auf Apples Karte markiert - Einem Bild auf Apples Support-Seite zufolge zählt nun ... http://ow.ly/dAkv505qwgE";;;;"786730502644531200";https://twitter.com/FouzyNews/status/786730502644531200
planetmoney;2016-10-13 17:47;10;28;"A breeder invented a new, delicious apple, but grocery stores weren’t interested. http://n.pr/2ea8VeY pic.twitter.com/2q9Acc9Rv5";;;;"786730044072857600";https://twitter.com/planetmoney/status/786730044072857600
aatilley;2016-10-13 17:46;2;2;"Apple is hiring up all the talent from its GPU provider. I imagine Apple will start building its own GPU soon http://www.businessinsider.com/apple-poaches-imagination-technologies-coo-2016-10?op=1 …";;;;"786729821380501504";https://twitter.com/aatilley/status/786729821380501504
