username;date;retweets;favorites;text;geo;mentions;hashtags;id;permalink
Gedanken4gut;2016-07-02 15:37;0;0;"Apple Music und Spotify: Zoff hinter den Kulissen - Home Entertainment | STERN.de http://www.stern.de/digital/homeentertainment/apple-music-spotify-abonnement-kosten-zoff-6930148.html …";;;;"749371324477218816";https://twitter.com/Gedanken4gut/status/749371324477218816
CNET;2016-07-02 15:34;59;59;"Will Apple ditch its 16GB entry-level model with the iPhone 7? http://cnet.co/29dS2SE pic.twitter.com/FQCusiSAqC";;;;"749370572589699072";https://twitter.com/CNET/status/749370572589699072
engadget;2016-07-02 15:07;47;39;"Apple says Spotify wants 'preferential treatment' for iOS app http://engt.co/298tDbB pic.twitter.com/bRhi1erLlC";;;;"749363881529774080";https://twitter.com/engadget/status/749363881529774080
NYMag;2016-07-02 14:13;27;44;"Spotify declares war on Apple: http://nym.ag/29bHiEq pic.twitter.com/howXc0XPNc";;;;"749350290655240192";https://twitter.com/NYMag/status/749350290655240192
CNET;2016-07-02 12:40;45;89;"Thin laptops from HP, Apple, Razer and Dell face off here http://cnet.co/29p9fVU pic.twitter.com/SsPScatGX2";;;;"749326782243962880";https://twitter.com/CNET/status/749326782243962880
zeldman;2016-07-02 12:25;15;48;"Dieter Rams: Apple has achieved something I never did | via @ Telegraphhttp://www.telegraph.co.uk/technology/apple/8555503/Dieter-Rams-Apple-has-achieved-something-I-never-did.html …";;@;;"749323057492262912";https://twitter.com/zeldman/status/749323057492262912
tino_rothfuss;2016-07-02 12:12;0;0;"Klingt nach # Schokolade # Android 7 heißt # Nougat http://www.n-tv.de/18093631 # EinfallsreicherName # Android7 # iOS # Apple";;;# # # # # # #;"749319774203678722";https://twitter.com/tino_rothfuss/status/749319774203678722
Recode;2016-07-02 12:00;28;41;"Watch: New drone footage soars above the progress on Apple’s upcoming ‘spaceship’ campus http://www.recode.net/2016/7/2/12086124/drone-apple-spaceship-campus?utm_campaign=recode.net&utm_content=chorus&utm_medium=social&utm_source=twitter …pic.twitter.com/3yu3WXw4vu";;;;"749316746012717056";https://twitter.com/Recode/status/749316746012717056
ABC;2016-07-02 11:14;47;82;"Apple being sued in China over propaganda film more than 20 years old http://abcn.ws/29jQQLB pic.twitter.com/iHeTylB7mC";;;;"749305305457127425";https://twitter.com/ABC/status/749305305457127425
mashable;2016-07-02 11:05;41;54;"Apple buying Tidal would be great for Tidal http://on.mash.to/29zoURp";;;;"749302884559380480";https://twitter.com/mashable/status/749302884559380480
businessinsider;2016-07-02 11:00;24;22;"Here's what Apple's Lightning headphones will be able to do that normal headphones can't http://read.bi/29c95Ez pic.twitter.com/K3oaRmdKQJ";;;;"749301749173751808";https://twitter.com/businessinsider/status/749301749173751808
ForbesTech;2016-07-02 11:00;46;34;"The Pebble Time Round could be a solid, less expensive alternative to the Apple Watch http://www.forbes.com/sites/bradmoon/2016/06/22/apple-watch-vs-pebble-time-round-hands-on-showdown/#770d09194fed …pic.twitter.com/PE7UKudG3R";;;#770d09194fed;"749301618273812480";https://twitter.com/ForbesTech/status/749301618273812480
comram;2016-07-02 10:01;0;0;"Der Underdog ist aber wohl doch eher Big Brother, wohingegen Apple Privatyacht zumindest vermarktet: http://heise.de/-3252902";;;;"749286813131497474";https://twitter.com/comram/status/749286813131497474
Forbes;2016-07-02 09:31;117;108;"Even w/ 15 million paid subscribers by its 1st anniversary, Apple Music won't catch Spotify http://www.forbes.com/sites/bobbyowsinski/2016/06/30/apple-musics-not-catching-spotify-anytime-soon-and-thats-not-good/?utm_source=TWITTER&utm_medium=social&utm_content=506464299&utm_campaign=sprinklrForbes#446d2b6d19e9 …pic.twitter.com/qsCurz6lEn";;;#446d2b6d19e9;"749279217297330176";https://twitter.com/Forbes/status/749279217297330176
Eurosplitter;2016-07-02 09:20;0;0;"iPhone-7-Preis geleakt: Apples Preispolitik überrascht http://fb.me/4Kfe6Jxli";;;;"749276518929629184";https://twitter.com/Eurosplitter/status/749276518929629184
cybersecboardrm;2016-07-02 14:36;2;3;"Meet product chief # Google fighting Apple & Amazon for control of your home # SmartHome # IoT http://www.recode.net/2016/6/29/12055270/google-home-chromecast-mario-queiroz …pic.twitter.com/nsfGL4uLo9";;;# # #;"749355983328022530";https://twitter.com/cybersecboardrm/status/749355983328022530
NYMag;2016-07-02 14:35;12;14;"How this unknown livestreaming app jumped to the top of the Apple charts: http://nym.ag/29bZbzi pic.twitter.com/raGj02RGS6";;;;"749355862255398912";https://twitter.com/NYMag/status/749355862255398912
cnntech;2016-07-02 14:11;36;21;"Apple has patented technology to stop you from recording videos where it's forbidden http://cnnmon.ie/2932LJo $ AAPLpic.twitter.com/jt5HWcnx7l";;;;"749349682871148544";https://twitter.com/cnntech/status/749349682871148544
evankirstel;2016-07-02 14:08;8;5;"# Apple recovered 2,204 pounds of gold from broken # iPhones last year http://money.cnn.com/2016/04/15/technology/apple-gold-recycling/index.html …pic.twitter.com/hkzCQ5NhpP";;;# #;"749348972368523264";https://twitter.com/evankirstel/status/749348972368523264
davepenick;2016-07-02 13:55;4;10;"A tribute to Tekserve, the original Apple store https://news.fastcompany.com/a-tribute-to-tekserve-the-original-apple-store-4012702 …";;;;"749345728959488000";https://twitter.com/davepenick/status/749345728959488000
globeandmail;2016-07-02 12:11;4;5;"ICYMI: Spotify hits out at Apple after updated app for iPhones rejected http://trib.al/yj9fsgw pic.twitter.com/stDYF0Xuo1";;;;"749319561632157696";https://twitter.com/globeandmail/status/749319561632157696
LePoint;2016-07-02 12:02;8;7;"Pour la Gay Pride, une Apple Watch aux couleurs de l'arc-en-ciel http://lpnt.fr/29aifw8 pic.twitter.com/1IVDEuFqIm";;;;"749317350600704000";https://twitter.com/LePoint/status/749317350600704000
jamescovert1;2016-07-02 11:28;8;10;"Apple to Spotify: Get over it $ aapl @ Spotify via @ NYPosthttp://nyp.st/29zDfgF";;@ @;;"749308849014902785";https://twitter.com/jamescovert1/status/749308849014902785
SAI;2016-07-02 11:00;6;12;"Here's what Apple's Lightning headphones will be able to do that normal headphones can't http://read.bi/29c95Ez pic.twitter.com/LiybEEaig2";;;;"749301729959682048";https://twitter.com/SAI/status/749301729959682048
VentureBeat;2016-07-02 10:06;18;9;"Sorry, Apple, but your fix for phone spam isn't good enough https://wp.me/p5hvhT-8mMx pic.twitter.com/vucNXvbQcl";;;;"749288049427746821";https://twitter.com/VentureBeat/status/749288049427746821
calestous;2016-07-02 10:01;9;3;"# Apple wins patent on # technology to stop fans filming gigs http://bit.ly/29dE1k8 pic.twitter.com/oOH9HkyanD";;;# #;"749286874192179201";https://twitter.com/calestous/status/749286874192179201
nationalpost;2016-07-02 09:45;4;13;"Apple’s @ Beats1 radio station is being taken over by Canadians, starting today. http://natpo.st/297T4zn @ fptechdeskpic.twitter.com/SnSce3SkXf";;@ @;;"749282771869237248";https://twitter.com/nationalpost/status/749282771869237248
mic;2016-07-02 09:31;7;8;"Is apple pie REALLY American? Here's a look into the pastry's not so patriotic history http://bit.ly/29f1Pne pic.twitter.com/JidiMuDrfW";;;;"749279246011527168";https://twitter.com/mic/status/749279246011527168
Leonid3r;2016-07-02 08:28;0;0;"Clipfish für Apple TV - heise online http://www.heise.de/mac-and-i/meldung/Clipfish-fuer-Apple-TV-3252899.html … # Clipfish # AppleTV # tvOS # RTL";;;# # # #;"749263570706243584";https://twitter.com/Leonid3r/status/749263570706243584
dw_wirtschaft;2016-07-02 08:17;0;0;"Es gibt einen Mann in Florida, der sagt, er hat das # iPhone erfunden. Nun verklagt er # Apple http://buff.ly/298LbIU pic.twitter.com/IaVDwZZkVa";;;# #;"749260603693363200";https://twitter.com/dw_wirtschaft/status/749260603693363200
WIRED;2016-07-02 07:01;42;48;"Would it really be that bad if Apple ditched its headphone jack? http://wrd.cm/299lk3G pic.twitter.com/aqSo19zfYu";;;;"749241568662589440";https://twitter.com/WIRED/status/749241568662589440
welt;2016-07-02 06:29;11;22;"Fortschritt: So gigantisch sieht der neue Apple Campus aus http://to.welt.de/nhFumoL pic.twitter.com/UQThal3f36";;;;"749233609001820160";https://twitter.com/welt/status/749233609001820160
welt;2016-07-02 06:23;1;4;"Musikstreaming: Apple will Jay-Zs Tidal kaufen und greift Spotify an http://to.welt.de/4gUqxjh pic.twitter.com/n6Of4ynnmO";;;;"749232000314277888";https://twitter.com/welt/status/749232000314277888
businessinsider;2016-07-02 05:01;23;24;"Here's what Apple's Lightning headphones will be able to do that normal headphones can't http://read.bi/29c95Ez pic.twitter.com/n84AKFc6HF";;;;"749211423604109312";https://twitter.com/businessinsider/status/749211423604109312
joachimheng;2016-07-02 00:56;0;1;"# Smartphone Videos: # Apple ermöglicht # Blockade von # iPhone # Kamerashttp://www.welt.de/156737455?wtrid=socialmedia.overlay_sharing.iphone.text..twitter …";;;# # # # #;"749149793503612928";https://twitter.com/joachimheng/status/749149793503612928
businessinsider;2016-07-01 23:22;45;27;"If Apple buys Tidal, then it won't be for the subscribers — it has only 3 million http://read.bi/29bwar8 pic.twitter.com/hdQQRYaD6Q";;;;"749125982355730432";https://twitter.com/businessinsider/status/749125982355730432
CBSNews;2016-07-01 22:30;23;19;"If Apple absorbs Tidal it could prove beneficial for both companies http://cbsn.ws/29mQ2UV pic.twitter.com/ny2oOBIyIt";;;;"749112876057505792";https://twitter.com/CBSNews/status/749112876057505792
businessinsider;2016-07-01 22:24;17;15;"Apple responds to Spotify: 'rumors and half-truths' http://read.bi/29atpUd pic.twitter.com/K2VadeFJsp";;;;"749111364703047680";https://twitter.com/businessinsider/status/749111364703047680
NYMag;2016-07-01 21:53;17;36;"Spotify declares war on Apple: http://nym.ag/299TFvB pic.twitter.com/8c4xbT9dR0";;;;"749103680423473155";https://twitter.com/NYMag/status/749103680423473155
denverpost;2016-07-01 21:00;5;12;"Apple patent could shut down your phone's cameras at concert venues: http://dpo.st/29ia0m7  via @ washingtonpost";;@;;"749090278749777920";https://twitter.com/denverpost/status/749090278749777920
lopezdoriga;2016-07-01 20:30;29;42;"Spotify se lanza en contra de Apple http://goo.gl/SXtrDZ";;;;"749082708597362690";https://twitter.com/lopezdoriga/status/749082708597362690
Forbes;2016-07-01 20:00;100;109;"Buying Tidal would be a waste of money for Apple. Here's why: http://www.forbes.com/sites/bobbyowsinski/2016/07/01/buying-tidal-is-a-terrible-waste-of-apples-money/?utm_source=TWITTER&utm_medium=social&utm_content=507340847&utm_campaign=sprinklrForbes#5d8a94b51b5b …pic.twitter.com/4oUb4r4zlE";;;#5d8a94b51b5b;"749075124335288320";https://twitter.com/Forbes/status/749075124335288320
evankirstel;2016-07-01 19:10;17;11;"# Apple recovered 2,204 pounds of gold from broken # iPhones last year http://buff.ly/29iITWV pic.twitter.com/8EuF77RoGp";;;# #;"749062611447185408";https://twitter.com/evankirstel/status/749062611447185408
latimes;2016-07-01 18:45;29;50;"Apple Music's latest plan to defeat Spotify: Tidal exclusives? http://lat.ms/298NIOC pic.twitter.com/Irh8bCaLsp";;;;"749056287221178369";https://twitter.com/latimes/status/749056287221178369
Reuters;2016-07-01 18:35;62;75;"Apple fires back at Spotify over music streaming claims http://reut.rs/29nfzxn pic.twitter.com/Syrf3gBqxd";;;;"749053748249583617";https://twitter.com/Reuters/status/749053748249583617
Gadgets360;2016-07-01 18:30;2;2;"Spotify Says Apple Rejected Its New iOS App in 'Anticompetitive' Move http://gadgets.ndtv.com/apps/news/spotify-says-apple-rejected-its-new-ios-app-in-anticompetitive-move-855908 …";;;;"749052489480056832";https://twitter.com/Gadgets360/status/749052489480056832
futureshift;2016-07-01 18:05;18;9;"Apple buying Tidal would be great for Tidal http://on.mash.to/298TIeO";;;;"749046202289750019";https://twitter.com/futureshift/status/749046202289750019
InsaneTechUK;2016-07-01 18:02;0;0;"# Apple says # Spotify wants 'preferential treatment' for # iOS # app (via @ Engadget) http://buff.ly/29iAP8L pic.twitter.com/6Q7xEpqOyr";;@;# # # #;"749045627795963904";https://twitter.com/InsaneTechUK/status/749045627795963904
TheSun;2016-07-01 18:02;5;7;"As Apple aims to stop iPhones recording acts, should they be banned completely from gigs? http://thesun.uk/6016BvoUg pic.twitter.com/XxYvho02AJ";;;;"749045427794767872";https://twitter.com/TheSun/status/749045427794767872
SinEmbargoMX;2016-07-01 18:00;27;7;"Apple bloquea a Spotify en iPhone para reforzar su propia plataforma de música http://www.sinembargo.mx/01-07-2016/3061628 …pic.twitter.com/bjs2vvJ3Xl";;;;"749045060440690688";https://twitter.com/SinEmbargoMX/status/749045060440690688
abc_es;2016-07-01 18:00;4;2;"Apple negocia para adquirir @ TIDALHiFi, el servicio de música en streaming de Jay Zhttp://ww.abc.es/GuRI301QBpJ";;@;;"749045048596172800";https://twitter.com/abc_es/status/749045048596172800
POPline;2016-07-01 18:00;10;60;"Negociação milionária pode levar Tidal a integrar empresas da Apple. Saiba mais! --> http://goo.gl/clPmlE pic.twitter.com/yJCFVNVyvL";;;;"749045031315578880";https://twitter.com/POPline/status/749045031315578880
TechCrunch;2016-07-01 17:55;73;44;"Apple fires back at Spotify, calling out ‘rumors and half-truths’ over App Store rejection http://tcrn.ch/29hzOPk";;;;"749043668233912320";https://twitter.com/TechCrunch/status/749043668233912320
PDFelement;2016-07-01 17:30;1;1;"Unbelievable! # Apple Maps will remember where you parked your car. http://tcrn.ch/1PuixvV # WWDCpic.twitter.com/B8bG4rdjNV";;;# #;"749037531782606848";https://twitter.com/PDFelement/status/749037531782606848
ChemistryTimS;2016-07-01 17:07;0;0;"Apple patents # technology to block # iPhone cameras from filiming in "sensitive" locations. http://buff.ly/29fwFyf pic.twitter.com/ngJniUHdZR";;;# #;"749031650978332673";https://twitter.com/ChemistryTimS/status/749031650978332673
ODD1T_OR;2016-07-01 17:06;1;0;"Music Wars http://www.bbc.co.uk/newsbeat/article/36683517/spotify-accuses-apple-of-blocking-app-and-using-store-as-weapon-to-harm-competitors … # Apple # Spotify # infosec # itsec # itaudit # streamingmedia";;;# # # # # #;"749031562637877248";https://twitter.com/ODD1T_OR/status/749031562637877248
mi2cnts4u;2016-07-01 17:05;0;0;"Facebook rolls out Slideshow movie-maker to compete with Google and Apple http://tcrn.ch/298GHl5 # videopic.twitter.com/Nsy1dx6ACO";;;#;"749031115931934720";https://twitter.com/mi2cnts4u/status/749031115931934720
MACSCORPION;2016-07-01 17:02;1;0;"Apple says Spotify’s app already violates App Store rules http://www.recode.net/2016/7/1/12082556/apples-lawyer-letter-spotify …pic.twitter.com/8SmengVxUZ";;;;"749030324793999361";https://twitter.com/MACSCORPION/status/749030324793999361
zesty_tech;2016-07-01 17:00;0;0;"Apple Just Patented a Device to Stop You Recording Live Shows http://www.nbcnews.com/tech/innovation/apple-just-patented-device-stop-you-recording-live-shows-n601861 …pic.twitter.com/p4MnjmuV5N";;;;"749029989090287616";https://twitter.com/zesty_tech/status/749029989090287616
EasyLiveDev;2016-07-01 17:00;0;0;"Apple vs. FBIについて、銃社会のアメリカで考える 09:00 http://rss.rssad.jp/rss/artclk/AXcql.bHq6R1/b4d759d8b4f8d21366ba166d90dd492c?ul=PdgRJ2VoKX1ssKJlKblKBh_3Yq8WNeNNGjUZWCM8hb8kybN3q_O.YMrlK3QH1rywH.iOhSv …";;;;"749029961969725440";https://twitter.com/EasyLiveDev/status/749029961969725440
MMRadio;2016-07-01 17:00;0;0;"# NEWS Apple Music tiene en la mira a Tidal http://goo.gl/Kfy3D9 pic.twitter.com/9l2luqoWLh";;;#;"749029945343639553";https://twitter.com/MMRadio/status/749029945343639553