username;date;retweets;favorites;text;geo;mentions;hashtags;id;permalink
jbormann3;2016-10-13 17:43;0;3;"Why The Apple Watch Isn't Just A Smartwatch, It's A Stress-Reliever http://www.huffingtonpost.co.uk/thomas-tamblyn/apple-watch-series-2-features-mindfulness_b_12454258.html …";;;;"786729109753769984";https://twitter.com/jbormann3/status/786729109753769984
tb_tty;2016-10-13 17:40;1;2;"現実になる日ももうすぐ(◦'︶'◦) # Apple のCEOティム・クックとお散歩。iPhoneで改札を通ってみた # TimInJapan https://www.buzzfeed.com/ryoyamaguchi/go-on-a-walk-with-tim-cook?utm_term=.jkoodd2o2 … @ d_tettu @ BuzzFeedJapanより";;@ @;# #;"786728326698115072";https://twitter.com/tb_tty/status/786728326698115072
NewMindMirror;2016-10-13 17:30;2;0;"How accurate are Fitbit, Apple Watch heart monitors? - @ cbsnews: http://www.cbsnews.com/news/fitbit-apple-watch-heart-monitors-accuracy-tests?utm_campaign=crowdfire&utm_content=crowdfire&utm_medium=social&utm_source=twitter … # wearables # wearabletech";;@;# #;"786725716113158146";https://twitter.com/NewMindMirror/status/786725716113158146
tec_EXAME;2016-10-13 17:30;6;9;"Homem vai a loja da Apple e quebra 12 iPhones; veja vídeo: http://exame.abril.com.br/tecnologia/noticias/homem-vai-a-loja-da-apple-e-quebra-12-iphones-veja-o-video?sr_tw …pic.twitter.com/noOqo3syxy";;;;"786725713856630784";https://twitter.com/tec_EXAME/status/786725713856630784
ffp_sousui;2016-10-13 17:22;2;4;"超いいね！ >長時間労働は正しい答えではない。正解なのは、テクノロジーで何か手助けになることがないか、見つけ出すことだ。 「人の働き方を改善したい」 ティム・クックCEOが語った # Apple と日本 # TimInJapanhttps://www.buzzfeed.com/eimiyamamitsu/walk-with-tim-cook?utm_term=.pe61yaGaz …";;;# #;"786723814683967488";https://twitter.com/ffp_sousui/status/786723814683967488
kir1ca;2016-10-13 17:16;4;5;"「人の働き方を改善したい」 ティム・クックCEOが語ったAppleと日本 https://www.buzzfeed.com/eimiyamamitsu/walk-with-tim-cook … @ eimiyamamitsu @ BuzzFeedJapanさんから";;@ @;;"786722367368228865";https://twitter.com/kir1ca/status/786722367368228865
iphonejanky;2016-10-13 17:09;0;0;"iPhone 4 - Apple: Warum Siri zum Problemfall werden könnte - STERN http://goo.gl/fb/na5STe";;;;"786720617475235840";https://twitter.com/iphonejanky/status/786720617475235840
LukaszukAB;2016-10-13 17:08;10;11;"How about them apples... @ albertaNDP you know you're in trouble when... # ableghttp://www.cbc.ca/beta/news/canada/calgary/provincial-government-too-controlling-argues-nenshi-1.3804174 …";;@;#;"786720218491920384";https://twitter.com/LukaszukAB/status/786720218491920384
turoczy;2016-10-13 17:07;0;3;"Siri is easily this generation's Newton. No Apple product more flies in the face of ease-of-use and elegance. http://www.recode.net/2016/10/12/13251618/mossberg-apple-siri-digital-assistant-dumb …";;;;"786719933753327616";https://twitter.com/turoczy/status/786719933753327616
DrinkingCiders;2016-10-13 17:05;1;9;"Keeping Heirloom Apples Alive Is 'Like A Chain Letter' Over Many Centuries http://n.pr/2d0IUfR pic.twitter.com/dha79lGbUU";;;;"786719430713733122";https://twitter.com/DrinkingCiders/status/786719430713733122
MarketWatch;2016-10-13 17:00;12;2;"Why Samsung’s exploding-phone nightmare should terrify Apple http://on.mktw.net/2e9dtGG";;;;"786718377410691072";https://twitter.com/MarketWatch/status/786718377410691072
AmChamHK;2016-10-13 17:00;0;0;"@ Apple to open # Shenzhen R&D hub # newsflashhttp://buff.ly/2ehLrIG";;@;# #;"786718354044227584";https://twitter.com/AmChamHK/status/786718354044227584
NewsCanadaV;2016-10-13 17:00;0;0;"Apple to set up R&D center in Shenzhen, bolster China ties http://tinyurl.com/hpe9rjc  :Auto pickup by wikyou";;;;"786718175505244161";https://twitter.com/NewsCanadaV/status/786718175505244161