username;date;retweets;favorites;text;geo;mentions;hashtags;id;permalink
ariegoldshlager;2016-05-19 17:07;2;4;"[Customer Experience] Apple Shifts From Genius Bars to Genius Groves, Hoping Patrons Linger: http://nyti.ms/254beE8 # cx # custexp # cem";;;# # #;"733449017343016960";https://twitter.com/ariegoldshlager/status/733449017343016960
FastCompany;2016-05-19 17:05;11;29;"At Apple's new San Francisco store, the indoors feels like outdoors http://buff.ly/25cI09N pic.twitter.com/qbmdPu66Go";;;;"733448504929046529";https://twitter.com/FastCompany/status/733448504929046529
lauramandaro;2016-05-19 17:00;10;14;"20% of Apple’s new extreme-makeover San Francisco store is an open forum area http://www.usatoday.com/story/tech/news/2016/05/19/apple-store-gets-major-makeover/84596138/ …pic.twitter.com/CxV9kDF93U";;;;"733447241659191296";https://twitter.com/lauramandaro/status/733447241659191296
RareDivergent;2016-05-19 17:00;0;0;"Apple's new San Francisco store showcases its new design strategy… http://dlvr.it/LLzCXm  via @ RareDivergentpic.twitter.com/LkxJIVZSDx";;@;;"733447196104744960";https://twitter.com/RareDivergent/status/733447196104744960
RareDivergent;2016-05-19 17:00;0;0;"Donald Trump, Apple basher, declares millions in Apple stock - CNET http://dlvr.it/LLzCNB  via @ RareDivergentpic.twitter.com/aisw72hWOx";;@;;"733447191566553088";https://twitter.com/RareDivergent/status/733447191566553088
picatha;2016-05-19 17:00;0;0;"4 Clues About Apple's Future Hidden In Its New San Francisco Store: At a press event this morning in downtown... http://bit.ly/1WF8BaQ";;;;"733447186109734912";https://twitter.com/picatha/status/733447186109734912
woosungahn;2016-05-19 17:00;0;2;"India is the next China. http://buff.ly/1YGzbh0  Apple CEO Makes First India Trip With Billion Phone Sales at Stake pic.twitter.com/ExlP6klisJ";;;;"733447155868925952";https://twitter.com/woosungahn/status/733447155868925952
HMBangash;2016-05-19 17:00;0;0;"Rhapsody's VR app is a hub for live music videos: The tech world is obsessed with virtual reality. It ... http://engt.co/1TiiuKv # Apple";;;#;"733447154954473472";https://twitter.com/HMBangash/status/733447154954473472