username;date;retweets;favorites;text;geo;mentions;hashtags;id;permalink
CNNMoney;2016-07-16 16:03;101;88;"Apple has patented technology to stop you from recording videos where it's forbidden http://cnnmon.ie/29JfVzk $ AAPLpic.twitter.com/kjLgAVXvty";;;;"754451299689717760";https://twitter.com/CNNMoney/status/754451299689717760
businessinsider;2016-07-16 10:15;16;14;"Sen. John McCain called out Apple CEO Tim Cook during a hearing http://read.bi/29KtCAm pic.twitter.com/fzzywCDg1u";;;;"754363869989048320";https://twitter.com/businessinsider/status/754363869989048320
nytimesbusiness;2016-07-16 10:00;27;39;"It took @ TheHagglerNYT a while to figure out what was happening. Then it all became clear: Apple Music is stoned. http://nyti.ms/29WVlvK";;@;;"754359995710443522";https://twitter.com/nytimesbusiness/status/754359995710443522
TechCrunch;2016-07-16 09:44;77;51;"How to get your photos featured on Apple’s Shot on iPhone billboards http://tcrn.ch/29IREWv pic.twitter.com/xubtgNKUYc";;;;"754356144655794176";https://twitter.com/TechCrunch/status/754356144655794176
QADVICE;2016-07-16 08:05;0;0;"iOS: Apple-ID-Sperrung bei Nutzung der E-Mail-App Spark - heise online http://www.heise.de/mac-and-i/meldung/iOS-Apple-ID-Sperrung-bei-Nutzung-der-E-Mail-App-Spark-3268656.html …";;;;"754331193093582848";https://twitter.com/QADVICE/status/754331193093582848
TIME;2016-07-16 07:15;61;85;"Apple may be planning a big redesign of this major product http://ti.me/2advg9F";;;;"754318443936096258";https://twitter.com/TIME/status/754318443936096258
businessinsider;2016-07-16 06:15;25;36;"This popular clothing brand models its business off tech companies like Apple and Pixar http://read.bi/2agGkCC pic.twitter.com/IhX4WH1MFZ";;;;"754303530769510400";https://twitter.com/businessinsider/status/754303530769510400
SAI;2016-07-16 05:00;5;9;"Here's rare video of Apple design head Jony Ive talking about his favorite Ferrari http://read.bi/29JFqyD pic.twitter.com/RxB9NJ2HkD";;;;"754284572846661632";https://twitter.com/SAI/status/754284572846661632
Recht_Personal;2016-07-16 04:57;0;2;"# Patentrecht - "Samsung vs. Apple: Höchstes US-Gericht verhandelt Patentstreit im Oktober" http://bit.ly/29SZHnF";;;#;"754283691917074432";https://twitter.com/Recht_Personal/status/754283691917074432
DeeCzee;2016-07-16 04:31;0;0;"# SiliconValley gegen # Trump: 145 Prominente, wie # Apple-Gründe Wozniak melden sich zu Wort: http://t3n.de/news/tech-koepfe-warnen-trump-726306 … (via: @ t3n) # Protest";;@;# # # #;"754277166683033600";https://twitter.com/DeeCzee/status/754277166683033600
Techmeme;2016-07-15 22:51;10;7;"Apple's Copyright Royalty Board proposal: 9.1¢ per 100 streams in songwriting royalties http://www.nytimes.com/2016/07/16/business/media/apple-in-seeming-jab-at-spotify-proposes-simpler-songwriting-royalties.html …http://www.techmeme.com/160716/p1#a160716p1 …";;;#a160716p1;"754191681080086528";https://twitter.com/Techmeme/status/754191681080086528
nacho_fariza;2016-07-16 13:03;9;4;"Hacienda investiga las tiendas de Apple en España http://economia.elpais.com/economia/2016/07/14/actualidad/1468526198_841979.html?id_externo_rsoc=TW_CC …";;;;"754406200482168833";https://twitter.com/nacho_fariza/status/754406200482168833
TheSun;2016-07-16 11:22;11;9;"Half of the apples you buy from the supermarket are actually a YEAR old http://thesun.uk/6016Bxs0m pic.twitter.com/wEYYafqKXU";;;;"754380583543902212";https://twitter.com/TheSun/status/754380583543902212
StribSports;2016-07-16 08:08;4;12;"Trent leaving Apple Valley to play basketball next year at Findlay Prep http://strib.mn/29QsgBX pic.twitter.com/smGvuq4n77";;;;"754331856829616128";https://twitter.com/StribSports/status/754331856829616128
SAI;2016-07-16 06:15;3;6;"This popular clothing brand models its business off tech companies like Apple and Pixar http://read.bi/2agGkCC pic.twitter.com/hwBBM38KfH";;;;"754303546066165760";https://twitter.com/SAI/status/754303546066165760
businessinsider;2016-07-16 05:00;8;14;"Here's rare video of Apple design head Jony Ive talking about his favorite Ferrari http://read.bi/29JFqyD pic.twitter.com/tkwQ8lPIBa";;;;"754284563464130560";https://twitter.com/businessinsider/status/754284563464130560
ReFreshfood;2016-07-16 04:57;6;4;"Why supermarkets are full of bad apples. Fresh? Or a year old? # shoplocal @ JoannaBlythman http://buff.ly/29AWMAS # foodnews # freshfood";;@;# # #;"754283698061733889";https://twitter.com/ReFreshfood/status/754283698061733889
Yahoo;2016-07-16 00:25;5;11;"Apple leak reveals massive iPhone 7 upgrade http://yhoo.it/29WLJiQ";;;;"754215255623004160";https://twitter.com/Yahoo/status/754215255623004160
chpurrer;2016-07-16 00:15;2;0;""iOS: Apple-ID-Sperrung bei Nutzung der E-Mail-App Spark" # newmedia news # feedlyhttp://www.heise.de/newsticker/meldung/iOS-Apple-ID-Sperrung-bei-Nutzung-der-E-Mail-App-Spark-3268656.html?wt_mc=rss.ho.beitrag.atom …";;;# #;"754212788248076288";https://twitter.com/chpurrer/status/754212788248076288
CentricDigital;2016-07-15 22:44;4;3;"Apple’s # IoT platform # HomeKit can also run on an # iPad - http://buff.ly/29UTNBl  via @ mjburnsy @ TechCrunchpic.twitter.com/GCgpPEroSn";;@ @;# # #;"754189832537145344";https://twitter.com/CentricDigital/status/754189832537145344
FastCompany;2016-07-15 21:03;25;22;"Samsung's Galaxy 7 is outselling Apple's iPhone 6S—here's by how much http://buff.ly/29TkN4f pic.twitter.com/cf5LSLZYwB";;;;"754164438064832512";https://twitter.com/FastCompany/status/754164438064832512
Weegee;2016-07-15 20:41;6;6;"How to get your photos featured on Apple’s "Shot on iPhone" billboards http://tcrn.ch/29Oj6GA";;;;"754158972161159168";https://twitter.com/Weegee/status/754158972161159168
reachvaibhav;2016-07-15 20:05;0;0;"Apple Bests Samsung, Microsoft And Alphabet https://lnkd.in/fFD8bjY";;;;"754149922769743873";https://twitter.com/reachvaibhav/status/754149922769743873
Recode;2016-07-15 20:00;10;11;"Here’s what Apple really meant to say about its plans to sell web video. http://on.recode.net/29WgGUU";;;;"754148650440282112";https://twitter.com/Recode/status/754148650440282112
engadget;2016-07-15 19:44;47;39;"Apple's idea for music royalties could stick it to Spotify http://engt.co/29JblNT pic.twitter.com/GDxFd6Uh0t";;;;"754144735925833728";https://twitter.com/engadget/status/754144735925833728
nytimesbusiness;2016-07-15 19:42;7;8;"Apple proposed simplifying the way songwriting royalties are paid when it comes to Spotify. http://nyti.ms/29JuvVH pic.twitter.com/XMD6bZOSt2";;;;"754144222123622400";https://twitter.com/nytimesbusiness/status/754144222123622400
snickerfritz04;2016-07-15 19:12;82;138;"THE APPLE DOESN'T FALL FAR FROM THE TREE # DonTheCon & Kids named in $250M tax scam! http://www.thedailybeast.com/articles/2016/07/14/donald-trump-junior-and-ivanka-material-witnesses-in-huge-tax-scam-case.html?via=twitter_page …";;;#;"754136607394041856";https://twitter.com/snickerfritz04/status/754136607394041856
TechCrunch;2016-07-15 19:10;59;36;"BitTorrent Now’s music and video streaming app comes to iOS, Apple TV http://tcrn.ch/29HDuor pic.twitter.com/oHNHUpQJvG";;;;"754135979234062337";https://twitter.com/TechCrunch/status/754135979234062337
Inc;2016-07-15 18:31;27;35;"These pot dispensaries are more profitable per square foot than Apple. @ Willyakowiczhttp://on.inc.com/29HV5zG";;@;;"754126170128543744";https://twitter.com/Inc/status/754126170128543744
Forbes;2016-07-15 18:31;506;589;"Apple beats out Samsung and Microsoft for the title of biggest tech company in the world http://www.forbes.com/sites/samanthasharf/2016/05/26/the-worlds-largest-tech-companies-2016-apple-bests-samsung-microsoft-and-alphabet?utm_source=TWITTER&utm_medium=social&utm_content=517183869&utm_campaign=sprinklrForbes …pic.twitter.com/yFqZz3oKOs";;;;"754126155859501056";https://twitter.com/Forbes/status/754126155859501056
ForbesTech;2016-07-15 18:00;22;23;"Why OPPO-which is virtually unknown outside Asia-could be become Apple's biggest challenger http://spr.ly/6015BxoFB pic.twitter.com/HlppYTYxza";;;;"754118355989258241";https://twitter.com/ForbesTech/status/754118355989258241
TheNextWeb;2016-07-15 17:17;6;7;"Bragi Dash founder talks about going totally wireless (and shades Apple) http://tnw.me/rlSyMCy pic.twitter.com/9Zp8jCOlMi";;;;"754107686493515777";https://twitter.com/TheNextWeb/status/754107686493515777
WebScrapingUSA;2016-07-15 17:12;2;1;"# datamining How to get your photos featured on Apple’s Shot on iPhone… http://tw.eet.link/Lpd2kJ # scraping # businesspic.twitter.com/GaVw08FQ6E";;;# # #;"754106312334508032";https://twitter.com/WebScrapingUSA/status/754106312334508032
horaciog;2016-07-15 17:05;2;4;"Developers consider Apple’s App Store restrictive and anticompetitive, report shows - The Washington Post https://www.washingtonpost.com/news/the-switch/wp/2016/07/15/developers-consider-apples-app-store-restrictive-and-anticompetitive-report-shows/ …";;;;"754104694147018753";https://twitter.com/horaciog/status/754104694147018753
davidclowery;2016-07-15 17:02;2;1;"Still a little low but Progress: Apple, in Seeming Jab at Spotify, Proposes Simpler Songwriting Royalties - NYTimes http://mobile.nytimes.com/2016/07/16/business/media/apple-in-seeming-jab-at-spotify-proposes-simpler-songwriting-royalties.html?referer=https://t.co/cpkHolc3LL …";;;;"754103880795947009";https://twitter.com/davidclowery/status/754103880795947009
setteBIT;2016-07-15 17:00;0;0;"Apple propone pagamenti semplificati agli autori musicali: 9,1 cent ogni 100 stream (ma x i concorrenti, che ridere) http://www.nytimes.com/2016/07/16/business/media/apple-in-seeming-jab-at-spotify-proposes-simpler-songwriting-royalties.html …";;;;"754103413772804096";https://twitter.com/setteBIT/status/754103413772804096