username;date;retweets;favorites;text;geo;mentions;hashtags;id;permalink
Macst3r;2016-11-16 15:55;1;0;"# iFixit: 2016er # MacBookPro mit Touch Bar praktisch nicht zu reparieren - heise online http://www.heise.de/mac-and-i/meldung/iFixit-2016er-MacBook-Pro-mit-Touch-Bar-praktisch-nicht-zu-reparieren-3485935.html … # Apple";;;# # #;"799038183833042944";https://twitter.com/Macst3r/status/799038183833042944
markendoktor;2016-11-16 14:04;0;0;"Perfekte Markenkommunikation: Nährt des Mythos, schafft Begehrlichkeit # apple # book http://www.spiegel.de/fotostrecke/apple-ehrt-steve-jobs-mit-hardcover-fotobuch-fotostrecke-142691-13.html … via @ SPIEGELONLINE";;@;# #;"799010306802548740";https://twitter.com/markendoktor/status/799010306802548740
adrianw11;2016-11-16 12:56;0;0;"Apples große Säuberung: Fast 50.000 Apps aus dem App Store verschwunden. Ergibt aber immer noch 1'950'000 iOS Apps: http://t3n.de/news/apps-app-store-verschwunden-767076/ …";;;;"798993226862501888";https://twitter.com/adrianw11/status/798993226862501888
t3n;2016-11-16 12:41;2;5;"Fitness-Kopfhörer: Apple überlegt Steuerung per Kopfnicken http://t3n.de/news/fitness-kopfhoerer-apple-767323/ …pic.twitter.com/SJaQ062kYz";;;;"798989268173455360";https://twitter.com/t3n/status/798989268173455360
aktionaer;2016-11-16 12:12;0;0;"Apple räumt auf: 50.000 Apps fliegen aus dem App-Store; Aktie zeigt sich erholt und führt Dow Jones an - Halten! http://tiny.li/Lf7e pic.twitter.com/GPHWiIE2ce";;;;"798982109486428160";https://twitter.com/aktionaer/status/798982109486428160
GQ_Germany;2016-11-16 12:00;0;1;"Apple-Jünger können aufatmen: Mit der neuen iOS-Beta-Version kehrt das populäre Emoji in Hinternform zurück. http://bit.ly/2fhBPcF pic.twitter.com/cValLLKqV4";;;;"798979061087371264";https://twitter.com/GQ_Germany/status/798979061087371264
t3n;2016-11-16 11:12;4;6;"Apple mistet aus: Fast 50.000 Apps aus dem App Store gelöscht http://t3n.de/news/apps-app-store-verschwunden-767076/ …";;;;"798966909177708544";https://twitter.com/t3n/status/798966909177708544
MEEDIA;2016-11-16 10:40;2;2;"„Parodie seiner selbst“: So lacht das Netz über Apples 300 Euro teures Fanboy-Designbuch http://meedia.de/2016/11/16/parodie-seiner-selbst-so-lacht-das-netz-ueber-apples-300-dollar-teueres-fanboy-designbuch/ …";;;;"798958910128328705";https://twitter.com/MEEDIA/status/798958910128328705
fashionsnap;2016-11-16 14:54;67;234;"Appleが写真集を発売。過去20年のデザインを450枚の写真で記録 http://www.fashionsnap.com/news/2016-11-16/designed-by-apple/ …pic.twitter.com/FTcTmzc3rO";;;;"799022917874946048";https://twitter.com/fashionsnap/status/799022917874946048
mobile_gis;2016-11-16 14:44;1;3;"Marktforscher: # Apple löscht fast 50.000 # Apps aus dem # App # Store | heise onlinehttp://www.heise.de/newsticker/meldung/Marktforscher-Apple-loescht-fast-50-000-Apps-aus-dem-App-Store-3475781.html …";;;# # # #;"799020275664900096";https://twitter.com/mobile_gis/status/799020275664900096
Forbes;2016-11-16 13:21;79;80;"No, Trump's China tariff wouldn't force Apple to make iPhones in the U.S. http://on.forbes.com/60198H1Rv pic.twitter.com/AJd6zSdxiz";;;;"798999338227822592";https://twitter.com/Forbes/status/798999338227822592
Minderleister;2016-11-16 11:15;0;0;"t3n: Apple mistet aus: Fast 50.000 Apps aus dem App Store gelöscht http://t3n.de/news/apps-app-store-verschwunden-767076/ … # marketing";;;#;"798967835636576257";https://twitter.com/Minderleister/status/798967835636576257
apple_watchapps;2016-11-16 11:04;0;1;"Apple erhält ungewöhnliches Patent: Plante der Smartphone-Gigant das iPhone 8 schon seit 2010? http://fb.me/8l03f0ftv";;;;"798964881512771584";https://twitter.com/apple_watchapps/status/798964881512771584
crackr;2016-11-16 10:45;2;0;"Der Unterschied zwischen Ikea und Apple? Bei # Ikea gibt’s den Produkt-Katalog gratis, # Apple will 300 Euro dafür: http://meedia.de/2016/11/16/parodie-seiner-selbst-so-lacht-das-netz-ueber-apples-300-dollar-teueres-fanboy-designbuch/ …";;;# #;"798960209414782977";https://twitter.com/crackr/status/798960209414782977
mac_and_i;2016-11-16 09:46;1;0;"Apple Pay: Spenden nun zulässig https://www.heise.de/mac-and-i/meldung/Apple-Pay-Spenden-nun-zulaessig-3487265.html … # ApplePay # Apple";;;# #;"798945254758084609";https://twitter.com/mac_and_i/status/798945254758084609
pa5ca1_54k;2016-11-16 09:15;0;0;"Ein Buch für 200$ bzw. 300$? Ist doch noch nicht mal ein # iBuch! http://www.spiegel.de/fotostrecke/apple-ehrt-steve-jobs-mit-hardcover-fotobuch-fotostrecke-142691.html … DAS kann nur Apple!";;;#;"798937606553616386";https://twitter.com/pa5ca1_54k/status/798937606553616386
Hierkaufich;2016-11-16 08:20;0;0;"Super Mario Run: Nintendo verrät, wann Super Mario aufs iPhone kommt – und was es kostet: Als Apple im… https://goo.gl/fb/ZvJztl # Stern";;;#;"798923707385348096";https://twitter.com/Hierkaufich/status/798923707385348096
buchamade;2016-11-16 08:11;0;0;"Apples neues Produkt ist ein Buch mit iPhone-Fotos - für 300 Euro - STERN http://dlvr.it/MgklYF # Buchpic.twitter.com/GqOVjkpUxZ";;;#;"798921513122414594";https://twitter.com/buchamade/status/798921513122414594
rponline;2016-11-16 07:22;0;1;"In Gedenken an # SteveJobs - # Apple verkauft jetzt auch ein Buch – für 300 Dollar. (via @ t3n / @ AndreasWeck) http://rp-online.de/1.6399829 pic.twitter.com/5ZsfCGR5jJ";;@ @;# #;"798908993619959809";https://twitter.com/rponline/status/798908993619959809
Hierkaufich;2016-11-16 07:09;0;0;"Abtasten in Apple-Optik: Entspannter am Airport durch die Sicherheitskontrolle: Was als Erstes auffällt im… https://goo.gl/fb/04QXUE # Stern";;;#;"798905808557842433";https://twitter.com/Hierkaufich/status/798905808557842433
MWerner3000;2016-11-16 06:12;0;1;"Meine Erfahrung mit Service im Apple Store: Überfreundliche Überforderung - http://www.wiwo.de/14846614.html?share=twitter …";;;;"798891483956912129";https://twitter.com/MWerner3000/status/798891483956912129
Ch_Schlesiger;2016-11-16 06:10;0;0;"Wiwo-Kolumnist @ mwerner3000 hat es mal wieder voll erwischt: Service im Apple Store - überfreundliche Überforderung http://www.wiwo.de/14846614.html?share=twitter …";;@;;"798891062588743680";https://twitter.com/Ch_Schlesiger/status/798891062588743680
IW_Medien;2016-11-16 05:29;0;0;"Apple, Goldman, Microsoft : Wie # Konzernchefs sich mit # Trump arrangierenhttp://www.handelsblatt.com/14849022.html?share=twitter …";;;# #;"798880781187813376";https://twitter.com/IW_Medien/status/798880781187813376
MarkusGr1mm;2016-11-16 05:23;0;0;"47.300 Apps gelöscht: Apple macht seine Drohung wahr http://dlvr.it/Mggplt pic.twitter.com/lTZzZB4grq";;;;"798879189139013632";https://twitter.com/MarkusGr1mm/status/798879189139013632
printpraxis;2016-11-16 05:20;3;1;"Elektronikschrott ab Werk: # iFixIt bestätigt die „Unreparierbarkeit“ der neuen # Apple # MBP2016 –http://www.heise.de/newsticker/meldung/iFixit-2016er-MacBook-Pro-mit-Touch-Bar-praktisch-nicht-zu-reparieren-3485935.html …";;;# # #;"798878352383897600";https://twitter.com/printpraxis/status/798878352383897600
t3n;2016-11-16 05:19;1;1;"Apples große Säuberung: Fast 50.000 Apps aus dem App Store verschwunden http://t3n.de/news/apps-app-store-verschwunden-767076/ …pic.twitter.com/Z7DTUTpg2m";;;;"798878064163876864";https://twitter.com/t3n/status/798878064163876864
BILD_Digital;2016-11-16 04:50;0;1;"Herbstputz im Store - Apple löscht fast 50 000 Apps http://www.bild.de/digital/smartphone-und-tablet/apple-apps/apple-app-loeschung-48785502.bild.html?utm_source=dlvr.it&utm_medium=twitter …pic.twitter.com/C8u5V3znYv";;;;"798870752493641728";https://twitter.com/BILD_Digital/status/798870752493641728
MarkusGr1mm;2016-11-16 04:46;0;0;"iPhone 8: Apple plant drei Versionen - und eine enttäuscht http://dlvr.it/Mgg90X pic.twitter.com/B5SaA64fQG";;;;"798869767733944320";https://twitter.com/MarkusGr1mm/status/798869767733944320
morgenpost;2016-11-16 04:44;0;2;"iCal-App von Apple: Nicht auf unbekannte Kalender-Einladungen in iCal reagieren http://dlvr.it/Mgg7cK pic.twitter.com/3go5o8roOL";;;;"798869253034098689";https://twitter.com/morgenpost/status/798869253034098689
amuehl;2016-11-16 04:20;0;0;"Apple will mich wirklich als Kunden verlieren. https://www.heise.de/mac-and-i/meldung/Anzeichen-fuer-ein-Ende-von-iTunes-Match-3475526.html …";;;;"798863197327466496";https://twitter.com/amuehl/status/798863197327466496
de_engadget;2016-11-16 03:45;0;0;"Apple bringt Popo-Pfirsich zurück - http://de.engadget.com/2016/11/16/apple-bringt-popo-pfirsich-zuruck/ …pic.twitter.com/KFjTdZA2zq";;;;"798854393290309632";https://twitter.com/de_engadget/status/798854393290309632
MEEDIA;2016-11-16 03:43;0;0;"Amazing: Apple verkauft Fanboy-Buch mit Produktbildern für bis zu 300 Dollar: http://meedia.de/2016/11/16/amazing-apple-verkauft-fanboy-buch-mit-produktbildern-fuer-bis-zu-300-dollar/ …";;;;"798854008056123392";https://twitter.com/MEEDIA/status/798854008056123392
WIRED_Germany;2016-11-16 03:20;0;1;"300 Euro für Fotos von iPhones: Apple bringt ein Buch raus → http://bit.ly/AppleBuch pic.twitter.com/9PLCFGQbqX";;;;"798848133006376962";https://twitter.com/WIRED_Germany/status/798848133006376962
Top_iPad_Apps;2016-11-16 02:51;0;0;"iPhone 7 im Detail: Was Apple an Stelle der Ohrhörerbuchse eingebaut hat, wird vielen nicht gefallen http://fb.me/8s7vGSnJd";;;;"798840812356255745";https://twitter.com/Top_iPad_Apps/status/798840812356255745
BILD_Digital;2016-11-16 02:34;0;0;"Infos & Hilfe - Alle Fakten zur BILD App für Apple TV http://www.bild.de/digital/mobil/bild-apps/die-bild-app-fuer-ihren-apple-tv-47944132.bild.html?utm_source=dlvr.it&utm_medium=twitter …pic.twitter.com/f0ntCeRMA4";;;;"798836532530417664";https://twitter.com/BILD_Digital/status/798836532530417664
mac_and_i;2016-11-16 02:11;9;6;"Marktforscher: Apple löscht fast 50.000 Apps aus dem App Store https://www.heise.de/mac-and-i/meldung/Marktforscher-Apple-loescht-fast-50-000-Apps-aus-dem-App-Store-3475781.html … # iOS # iPad";;;# #;"798830827354193922";https://twitter.com/mac_and_i/status/798830827354193922
AndyBaldauf;2016-11-15 23:30;0;0;"Heute erscheint das wohl kreativste # apple Produkt zur Ehre von # SteveJobs http://t3n.de/news/apples-neuestes-produkt-buch-766745/ … @ t3n # iphone # mac # AppleWatch # ipad";;@;# # # # # #;"798790209894813696";https://twitter.com/AndyBaldauf/status/798790209894813696
mac_and_i;2016-11-15 23:06;9;5;"Nutzerberichte: SSD im MacBook Pro mit Touch Bar nicht entnehmbar https://www.heise.de/mac-and-i/meldung/Nutzerberichte-SSD-im-MacBook-Pro-mit-Touch-Bar-nicht-entnehmbar-3475519.html … # MacBookPro # Apple";;;# #;"798784186068799488";https://twitter.com/mac_and_i/status/798784186068799488
ITMService;2016-11-15 23:00;0;0;"MUSIC UNLIMITED Spotify und Apple Music bekommen weitere Konkurrenz: Mit über 40 Millionen Songs startet der... http://fb.me/VHE7Aum5";;;;"798782680724713472";https://twitter.com/ITMService/status/798782680724713472
tmaxi;2016-11-15 22:40;0;0;"Entdeckt:>> Apple veröffentlicht Design-Buch http://ift.tt/2fcuMSV # GuckMal";;;#;"798777640949673984";https://twitter.com/tmaxi/status/798777640949673984
Optimierer;2016-11-15 22:31;0;0;"Wie Google Glass oder Hololens?. Apple soll AR-Brille fürs iPhone bauen http://n-tv.de/technik/Apple-soll-AR-Brille-fuers-iPhone-bauen-article19094821.html …";;;;"798775501905006592";https://twitter.com/Optimierer/status/798775501905006592
wiwo;2016-11-15 22:31;1;0;"Werner knallhart: Service im Apple Store: Überfreundliche Überforderung http://ow.ly/utbS506yib0";;;;"798775450658947072";https://twitter.com/wiwo/status/798775450658947072
egghat;2016-11-15 22:07;0;0;"Handelsblatt: Strafzölle gefordert: # Apple, # Trump und der # China-Fluchhttp://buff.ly/2fW9ZnX";;;# # #;"798769321774227456";https://twitter.com/egghat/status/798769321774227456
wiwo;2016-11-15 21:51;4;5;"Die Premium-Versicherung von # Apple bringt nichts als Frust, findet unser Kolumnist @ MWerner3000http://ow.ly/tW1P306dtPM";;@;#;"798765353937473536";https://twitter.com/wiwo/status/798765353937473536
tola0809;2016-11-15 20:22;0;0;"Digital Glasses - diesmal von Apple? https://goo.gl/XNeauN";;;;"798743040219353088";https://twitter.com/tola0809/status/798743040219353088
mashable;2016-11-15 19:44;41;82;"Wow, Apple didn't have an archive of its own products http://on.mash.to/2fvQ9l4";;;;"798733433266720768";https://twitter.com/mashable/status/798733433266720768
TIME;2016-11-15 18:15;34;66;"This could be Apple's next big product http://ti.me/2f26s8i";;;;"798710966875721729";https://twitter.com/TIME/status/798710966875721729
aktionaer;2016-11-15 17:48;1;2;"Apple wird wohl Alphabet Alphabete glass Brille bereits 2018 bringen. Würde gefühlt passen! Schade Google. http://tiny.li/1c7e pic.twitter.com/qRUsDjkKeR";;;;"798704277011230720";https://twitter.com/aktionaer/status/798704277011230720
gizmodojapan;2016-11-15 17:43;54;108;"Apple最新作は、20年のデザイン史が詰まった写真集でした『Designed by Apple in California』 http://bit.ly/2eYmZXG pic.twitter.com/Z5pAKooxLv";;;;"798702952533884929";https://twitter.com/gizmodojapan/status/798702952533884929
Gadgets360;2016-11-15 17:30;6;5;"# Samsung's pressure-sensitive display tech may work same as # Apple http://gadgets.ndtv.com/mobiles/news/samsung-galaxy-s8-tipped-to-sport-pressure-sensitive-display-1625565 …";;;# #;"798699615570841602";https://twitter.com/Gadgets360/status/798699615570841602
weeklyascii;2016-11-15 17:03;5;9;"どのカードが使える？　なぜこのカードは使えない？　Apple Payスタート講座 http://ascii.jp/limit/group/ida/elem/000/001/262/1262234/ …";;;;"798692908295536640";https://twitter.com/weeklyascii/status/798692908295536640
GuyKawasaki;2016-11-15 17:00;25;36;"Apple will reportedly drop the price of its new MacBook next year http://read.bi/2f9oBju";;;;"798692058357702656";https://twitter.com/GuyKawasaki/status/798692058357702656
TheNextWeb;2016-11-15 16:58;16;11;"Apple finally killed upgradability in its MacBook Pro line http://tnw.me/lrH3a6A pic.twitter.com/ivcEBwQWgm";;;;"798691761602392066";https://twitter.com/TheNextWeb/status/798691761602392066
terminaltraces;2016-11-15 16:40;2;2;"If this isn't the coolest thing: "The woman featured in Apple's accessibility video also edited it." # accessibilityhttp://buff.ly/2fLgZ6U";;;#;"798687028544159744";https://twitter.com/terminaltraces/status/798687028544159744
GordonKelly;2016-11-15 16:32;1;4;"Apple Leak Reveals Massive New iPhone - the biggest iPhone shake up in years? http://www.forbes.com/sites/gordonkelly/2016/11/15/apple-leak-reveals-new-iphone-oled …";;;;"798685055593889792";https://twitter.com/GordonKelly/status/798685055593889792
CNET;2016-11-15 16:31;17;33;"How far does your Apple love go? Here's the perfect Christmas gift. It's beautifully designed. http://cnet.co/2f1XDM2 pic.twitter.com/JjLD9m7gEL";;;;"798684764068835329";https://twitter.com/CNET/status/798684764068835329
TechCrunch;2016-11-15 16:30;28;51;"Apple is releasing a coffee table book about how awesome it is http://tcrn.ch/2fVlXhG pic.twitter.com/LlMSPpi0NX";;;;"798684563878924289";https://twitter.com/TechCrunch/status/798684563878924289
Ittousai_ej;2016-11-15 16:24;99;46;"誰も並んでねえ。 2万円・3万円の豪華写真集 Designed by Apple in California発売日のアップル銀座。開店まで1時間を切った9時過ぎ時点。実際は様子見してカフェなどに退避中の方もいそうではあります http://japanese.engadget.com/2016/11/15/designed-by-apple-in-california-2-3/ …pic.twitter.com/scgm5Vkogd";;;;"798683096727945216";https://twitter.com/Ittousai_ej/status/798683096727945216
jptechcrunch;2016-11-15 16:24;5;3;"14shares: AppleのApp Storeで大掃除が開始されていた http://jp.techcrunch.com/2016/11/16/20161115apples-big-app-store-purge-is-now-underway/ …";;;;"798683023675772928";https://twitter.com/jptechcrunch/status/798683023675772928
business;2016-11-15 16:09;13;19;"Apple glasses are another sign the pioneering days are over, @ ShiraOvide writes http://bloom.bg/2f2krLw pic.twitter.com/a4FWgudyld";;@;;"798679337687990272";https://twitter.com/business/status/798679337687990272
Ittousai_ej;2016-11-15 16:07;18;13;"アップルの豪華写真集 Designed by Apple in Californiaの撮影は、アップルと縁深い写真家アンドリュー・ザッカーマン。動物や花を実物よりも「リアル」に捉えた写真集Creature等で著名です。 http://japanese.engadget.com/2016/11/15/designed-by-apple-in-california-2-3/ …pic.twitter.com/5XWZWyidGR";;;;"798678919998119936";https://twitter.com/Ittousai_ej/status/798678919998119936
jimcramer;2016-11-15 16:06;6;8;"Smart glasses from Apple—better hurry! –Jhonsa https://www.thestreet.com/story/13894883/1/apple-s-smart-glasses-can-succeed-but-it-has-to-move-fast-to-beat-microsoft-and-facebook.html?tstmem=1400197&utm_source=alert&utm_medium=email&utm_campaign=TSC&utm_term=Apple%27s+Smart+Glasses+Can+Succeed%2C+But+It+Has+to+Move+Fast+to+Beat+Microsoft+and+Facebook …";;;;"798678532423634945";https://twitter.com/jimcramer/status/798678532423634945
Lisafurer;2016-11-15 16:05;0;0;"Apple's newest product is, gasp, a book. Yes, on paper. And it's $300. http://usat.ly/2fuhYtO  via @ usatoday";;@;;"798678374969266177";https://twitter.com/Lisafurer/status/798678374969266177
ProActiveinc;2016-11-15 16:05;0;0;"Apple Considers Wearables Expansion With Digital Glasses - Bloomberg # tech # newshttp://ow.ly/ZY6D306cQYa";;;# #;"798678248930603009";https://twitter.com/ProActiveinc/status/798678248930603009
dorkwebsites;2016-11-15 16:04;0;0;"Apple Music to exclusively stream documentary about iconic 808 drum machine - CNET http://ow.ly/hO9c506xK5x";;;;"798678025281961984";https://twitter.com/dorkwebsites/status/798678025281961984
AlarmSystemRevs;2016-11-15 16:02;2;0;"4 # smarthome devices that work with your iphone. # apple # iot # homeautomationhttp://www.businessinsider.com/smart-home-devices-that-work-with-iphone-2016-11/#a-smart-lock-2 …";;;# # # # #a;"798677633080979456";https://twitter.com/AlarmSystemRevs/status/798677633080979456
yaociela;2016-11-15 16:02;0;0;"Apple Designの20年を振り返る写真集「Designed by Apple in California」発売 ～スティーブ・ジョブズの思い出に捧げる - PC Watch http://pc.watch.impress.co.jp/docs/news/1030151.html …";;;;"798677464524304384";https://twitter.com/yaociela/status/798677464524304384
CapOversight;2016-11-15 16:00;0;0;"The world’s top Apple analyst thinks there will be three iPhones in 2017 http://read.bi/2gejoK5 pic.twitter.com/dv22BNeNJa";;;;"798677084688171008";https://twitter.com/CapOversight/status/798677084688171008
Metrics_Digital;2016-11-15 16:00;0;1;"Apple pone el foco en un dispositivo de realidad aumentada.http://www.sdpnoticias.com/tecnologia/2016/11/15/apple-desarrolla-unas-gafas-de-realidad-aumentada …pic.twitter.com/RBUNl6hobT";;;;"798676965339189250";https://twitter.com/Metrics_Digital/status/798676965339189250