username;date;retweets;favorites;text;geo;mentions;hashtags;id;permalink
mashable;2016-08-01 16:54;70;127;"Apple is replacing the pistol emoji with a bright green squirt gun http://on.mash.to/2aKEaiE";;;;"760262431868329984";https://twitter.com/mashable/status/760262431868329984
business;2016-08-01 16:46;38;24;"Apple's stock drop isn't deterring one of Australia's top equity funds from a tech spree http://bloom.bg/2aNiZK5 pic.twitter.com/ieB5e2lYTP";;;;"760260407173013505";https://twitter.com/business/status/760260407173013505
BuzzFeedNews;2016-08-01 16:36;41;133;"Apple released new emojis that now include women playing sports and men getting haircuts https://www.buzzfeed.com/josephbernstein/redesigned-ios-emoji-show-women-athletes-and-men-pampering-t?utm_term=.seLxLEr0Pm#.evAdqQPLMr …pic.twitter.com/XyouTuLV8v";;;#;"760257881874628608";https://twitter.com/BuzzFeedNews/status/760257881874628608
BuzzFeedJapan;2016-08-01 16:33;1;2;"【New!】Apple、日本に71万以上の雇用をもたらしていた。アプリ市場はこんなに大きくなってた https://www.buzzfeed.com/buzzfeed/yuikashima/apple-work …pic.twitter.com/nKmNYV418p";;;;"760257069777756161";https://twitter.com/BuzzFeedJapan/status/760257069777756161
TheNextWeb;2016-08-01 16:16;22;27;"Apple gives iOS 100+ new emoji with a focus on women http://tnw.me/rG7uWdb pic.twitter.com/mJwSQMU5H0";;;;"760253007002992640";https://twitter.com/TheNextWeb/status/760253007002992640
arstechnica;2016-08-01 16:16;20;27;"Apple makes a really good ad for Microsoft’s Surface Pro http://arstechnica.com/apple/2016/08/apple-makes-a-really-good-ad-for-microsofts-surface-pro/ … by @ AndrewWrites";;@;;"760252861943058432";https://twitter.com/arstechnica/status/760252861943058432
futureshift;2016-08-01 16:16;26;23;"No more pistol emoji: Apple to replace it with a green squirt gun http://on.mash.to/2aNdmeP";;;;"760252776949620738";https://twitter.com/futureshift/status/760252776949620738
NRATV;2016-08-01 16:12;100;70;"Apple replaces the pistol emoji with a water gun - http://money.cnn.com/2016/08/01/technology/apple-pistol-emoji/index.html?sr=twCNN080116apple-pistol-emoji0903PMStoryPhoto&linkId=27172570 … # NRA # 2A (via @ CNNMoney)pic.twitter.com/Ka0AwlgAcf";;@;# #;"760251843171655681";https://twitter.com/NRATV/status/760251843171655681
DrinkingCiders;2016-08-01 16:11;1;7;"Turning Apples into Hard Cider @ AngryOrchard http://bit.ly/2aeG21W pic.twitter.com/dQlGh1jTs7";;@;;"760251548563890177";https://twitter.com/DrinkingCiders/status/760251548563890177
LanceUlanoff;2016-08-01 16:07;8;15;"Apple's iOS 10 update will add new rainbow flag and women emoji http://mashable.com/2016/08/01/apple-women-emoji-ios-10/ …";;;;"760250705093558273";https://twitter.com/LanceUlanoff/status/760250705093558273
Milenio;2016-08-01 15:54;11;10;"¿Qué te parecen los nuevos # emojis de Apple en favor de la equidad de género? http://mile.io/2aKUPmP pic.twitter.com/I5yOSGHTGK";;;#;"760247264644259841";https://twitter.com/Milenio/status/760247264644259841
applestreem;2016-08-01 16:49;1;1;"Frank Ocean's long-awaited album is an Apple Music exclusive: Fans of Frank Ocean have been waiting for the s... http://j.mp/2avnojo";;;;"760261297132875776";https://twitter.com/applestreem/status/760261297132875776
CBS6;2016-08-01 16:36;11;18;"Apple replaces the pistol emoji with a water gun http://via.wtvr.com/uRmf4 pic.twitter.com/ex74CeJ60K";;;;"760257830008004609";https://twitter.com/CBS6/status/760257830008004609
BloombergAU;2016-08-01 16:30;2;0;"Apple's stock drop isn't deterring one of Australia's top equity funds from a tech spree http://bloom.bg/2aIf3NO pic.twitter.com/bHj8sN5vEa";;;;"760256495934140416";https://twitter.com/BloombergAU/status/760256495934140416
gloripondia;2016-08-01 16:25;2;2;"Fiona Apple y la marea alta, por @ hualgami http://share.mile.io/c8fgVJS pic.twitter.com/Sl0Nf85MBN";;@;;"760255045589868544";https://twitter.com/gloripondia/status/760255045589868544
Vapenkontroll;2016-08-01 16:17;12;2;"Pistolskytte i motvind, så känsligt att Apple byter ut emoji-pistolen mot en vattenpistol. http://money.cnn.com/2016/08/01/technology/apple-pistol-emoji/index.html?sr=twCNN080116apple-pistol-emoji0903PMStoryPhoto&linkId=27172570 …pic.twitter.com/6CK5nfIDei";;;;"760253028637237248";https://twitter.com/Vapenkontroll/status/760253028637237248
ArsInfiniteLoop;2016-08-01 16:16;2;6;"Apple makes a really good ad for Microsoft’s Surface Pro http://arstechnica.com/apple/2016/08/apple-makes-a-really-good-ad-for-microsofts-surface-pro/ … by @ AndrewWrites";;@;;"760252864199524352";https://twitter.com/ArsInfiniteLoop/status/760252864199524352
ICTAfrica1;2016-08-01 16:06;1;2;"Apple Confirms Problem Around iOS 9.3.3 http://dlvr.it/Lx9Bdz # ictafricapic.twitter.com/SYUJDLtoHF";;;#;"760250483646664704";https://twitter.com/ICTAfrica1/status/760250483646664704
mileniotv;2016-08-01 15:52;3;5;"¿Qué te parecen los nuevos emojis de Apple en favor de la equidad de género? http://mile.io/2aL7SVe pic.twitter.com/jnFtnqwwbG";;;;"760246748895784960";https://twitter.com/mileniotv/status/760246748895784960
jimcramer;2016-08-01 15:44;9;15;"Is Apple the winner in Uber’s Chinese descent? https://www.thestreet.com/story/13660235/1/didi-uber-deal-is-good-news-for-apple-alibaba-and-others.html …";;;;"760244731888668672";https://twitter.com/jimcramer/status/760244731888668672
engadget;2016-08-01 15:42;52;48;"Apple drops the gun emoji for a friendlier water pistol http://engt.co/2aHsCvT pic.twitter.com/6tBVxYWkLe";;;;"760244226215055360";https://twitter.com/engadget/status/760244226215055360
WIREDCulture;2016-08-01 15:31;7;6;"Apple Music is releasing Frank Ocean’s new album — ‘Boys Don’t Cry’ — on Friday. http://bit.ly/2aN95YV";;;;"760241470209073157";https://twitter.com/WIREDCulture/status/760241470209073157
NYCSchools;2016-08-01 15:30;3;7;"ICYMI: Big Apple students made significant gains on state reading and math exams in 2016 http://nydn.us/2aBJnbd";;;;"760241297210896385";https://twitter.com/NYCSchools/status/760241297210896385
engadget;2016-08-01 15:21;34;15;"Frank Ocean's long-awaited album is an Apple Music exclusive http://engt.co/2avcR80 pic.twitter.com/hSCYJ7BQXM";;;;"760239168182190080";https://twitter.com/engadget/status/760239168182190080
cnntech;2016-08-01 15:12;86;99;"Bullets are out, water is in—Apple replaces pistol emoji with something a little more fun: http://cnnmon.ie/2asYS4M pic.twitter.com/OPvul6VGpA";;;;"760236670818086912";https://twitter.com/cnntech/status/760236670818086912
marshawright;2016-08-01 14:57;3;4;"Apple drops a new iOS 10 beta with a hundred new emojis http://tcrn.ch/2auYH6m # tech # money # icymipic.twitter.com/v5UHtRGJEG";;;# # #;"760232981684363264";https://twitter.com/marshawright/status/760232981684363264
dgo1252;2016-08-01 14:50;1;0;"Old Economy? # Back2theRoots is # StateOfTheArt. Bringt # iOS # Apple mehr an der # Börse?Kein Herdentrieb. @ e_Message_DEhttp://n-tv.de/wirtschaft/Das-Geheimnis-von-Adidas-Aufstieg-article18316091.html …";;@;# # # # #;"760231149260181504";https://twitter.com/dgo1252/status/760231149260181504
ABC;2016-08-01 14:47;176;319;"Apple says it will be adding or redesigning over 100 emoji characters. http://abcn.ws/2aXSHEe pic.twitter.com/95YqvGoozN";;;;"760230533544763397";https://twitter.com/ABC/status/760230533544763397
Milenio;2016-08-01 14:46;11;21;"¿Qué te parecen los nuevos emojis de Apple en favor de la equidad de género? http://mile.io/2aKUPmP pic.twitter.com/Y6zHlZWaL0";;;;"760230182451982336";https://twitter.com/Milenio/status/760230182451982336
FastCompany;2016-08-01 14:39;59;77;"Apple brings more diversity to iOS 10 emoji, and a squirtgun instead of a handgun http://buff.ly/2auSsiZ pic.twitter.com/jYZIaKp977";;;;"760228380721766400";https://twitter.com/FastCompany/status/760228380721766400
marshawright;2016-08-01 14:27;2;3;"Apple Maps adds more transit and parking data ahead of iOS 10 redesign http://tcrn.ch/2aHK17c # tech # moneypic.twitter.com/IvDRrvYs01";;;# #;"760225430662029312";https://twitter.com/marshawright/status/760225430662029312
GMA;2016-08-01 14:20;24;108;"Apple to add more diverse emojis, adding or redesigning over 100 characters for fall: http://abcn.ws/2aMVJvO pic.twitter.com/L7pe7A34Pe";;;;"760223596639838208";https://twitter.com/GMA/status/760223596639838208
jjones9;2016-08-01 14:13;15;46;"Devin Funchess and Cam Newton got closer last year on the way to McDonalds to get a parfait and two apple pies http://www.charlotteobserver.com/sports/nfl/carolina-panthers/article93122222.html#navlink=SecList …";;;#navlink;"760221838031130624";https://twitter.com/jjones9/status/760221838031130624
businessinsider;2016-08-01 14:13;34;33;"The new Frank Ocean album everyone's been waiting on is going to be an Apple Music exclusive http://read.bi/2aE2Mad pic.twitter.com/wlsOD3vUtk";;;;"760221829667627009";https://twitter.com/businessinsider/status/760221829667627009
business;2016-08-01 14:10;52;67;"Apple just released an iPhone app to control Apple TV using Siri http://bloom.bg/2auXYCq pic.twitter.com/GKXyBdvR4a";;;;"760221159690498048";https://twitter.com/business/status/760221159690498048
CNN;2016-08-01 14:03;8918;11538;"Apple is replacing the pistol emoji with a green water gun in the next version of iOS 10 http://cnn.it/2agyQ1j pic.twitter.com/CSonJbhsNj";;;;"760219306537979904";https://twitter.com/CNN/status/760219306537979904
gigazine;2016-08-01 14:00;20;51;"Appleが10秒間で何を行っているのかがわかる「Apple - Every Second」 http://gigaz.in/2aKo08R pic.twitter.com/nExojhzwoH";;;;"760218569011400706";https://twitter.com/gigazine/status/760218569011400706
sisario;2016-08-01 13:58;2316;1784;"Frank Ocean's new album is coming Friday from Apple Music. http://www.nytimes.com/2016/08/02/arts/music/frank-ocean-boys-dont-cry-apple-release-date.html …";;;;"760218232087318532";https://twitter.com/sisario/status/760218232087318532
MarketWatch;2016-08-01 13:43;24;12;"Apple, it’s time to license the operating system and undo the mistake of 30 years ago http://on.mktw.net/2apkTny pic.twitter.com/rTU71qt1qO";;;;"760214279521984512";https://twitter.com/MarketWatch/status/760214279521984512
businessinsider;2016-08-01 13:32;21;12;"'Pokémon GO' players are getting refunds from Apple and Google for in-game purchases http://read.bi/2aqRuqo pic.twitter.com/gle2F9PgE9";;;;"760211745965244416";https://twitter.com/businessinsider/status/760211745965244416
ryanfitzgibbon;2016-08-01 13:27;15;56;"My petition worked! Apple to replace pistol emoji with a toy squirt gun!! Hashtag influencer. http://www.businessinsider.com/apple-is-replacing-the-pistol-emoji-with-a-squirt-gun-2016-8?r=UK&IR=T …";;;;"760210280483852288";https://twitter.com/ryanfitzgibbon/status/760210280483852288
TheNextWeb;2016-08-01 13:23;9;16;"Apple's new Instagram page is digital heaven for those who live and die by quotes http://tnw.me/nodTfp4 pic.twitter.com/VF2jVDdZwh";;;;"760209268926738433";https://twitter.com/TheNextWeb/status/760209268926738433
faznet;2016-08-01 12:37;1;1;". @ kanyewest macht Apple eine klare Ansage, berichtet @ RolLindner:http://www.faz.net/-gqe-8jxt5#GEPC;s30 …";;@ @;#GEPC;"760197689204101120";https://twitter.com/faznet/status/760197689204101120
TIME;2016-08-01 12:15;28;54;"Kanye West is demanding that Apple buy Tidal already: "Let the kids have the music" http://ti.me/2aDBDV7";;;;"760192144967688192";https://twitter.com/TIME/status/760192144967688192
Monitoring_IT;2016-08-01 10:28;0;0;"Nach Milliarden-Investment durch Apple: Fahrdienst Didi schließt sich mit chinesischem Uber zusammen http://buff.ly/2aLhFXU";;;;"760165224544608256";https://twitter.com/Monitoring_IT/status/760165224544608256
pcwelt;2016-08-01 10:00;2;1;"Ehemalige Apple-Store-Mitarbeiter verraten Interna http://ebx.sh/2ap3QC7 pic.twitter.com/vrZSKPb8SW";;;;"760158372624818181";https://twitter.com/pcwelt/status/760158372624818181
praemandatum;2016-08-01 07:58;1;1;""400 Experten [..sollen] die raffinierten Codes von Anbietern wie Telegram oder auch Herstellern wie Apple knacken" http://www.spiegel.de/politik/deutschland/bundesregierung-sucht-verzweifelt-nerds-a-1105653.html …";;;;"760127533773942784";https://twitter.com/praemandatum/status/760127533773942784
mac_and_i;2016-08-01 07:06;4;2;"Kanye West hofft auf Tidal-Aufkauf durch Apple http://www.heise.de/mac-and-i/meldung/Kanye-West-hofft-auf-Tidal-Aufkauf-durch-Apple-3283009.html … # AppleMusic # Apple";;;# #;"760114387193593860";https://twitter.com/mac_and_i/status/760114387193593860
crackr;2016-08-01 05:50;0;0;"„ # Apple, gib Jay jetzt den Scheck!" # KanyeWest fordert # TimCook zur Übernahme von # Tidal auf $ AAPLhttp://fb.me/1qQgHxmTt";;;# # # #;"760095291471114240";https://twitter.com/crackr/status/760095291471114240
t3n;2016-08-01 04:11;0;3;"„For you“: Apple soll seinem Online-Shop eine Empfehlungsfunktion spendieren http://t3n.de/news/apple-online-shop-empfehlung-730779/ …pic.twitter.com/oYWHGJZUzR";;;;"760070554812579840";https://twitter.com/t3n/status/760070554812579840
mac_and_i;2016-08-01 03:26;6;2;"Nach Milliarden-Investment durch Apple: Fahrdienst Didi schließt sich mit chinesischem Uber zusammen http://www.heise.de/mac-and-i/meldung/Nach-Milliarden-Investment-durch-Apple-Fahrdienst-Didi-schliesst-sich-mit-chinesischem-Uber-zusammen-3282611.html … # Uber # Apple";;;# #;"760059027049050112";https://twitter.com/mac_and_i/status/760059027049050112
WebhodNetworks;2016-08-01 03:24;0;0;"Pangu-Jailbreak für iOS 9.3.3: Berichte über angebliche Hacks: Nutze des jüngsten Pangu-Entsperrers für Apple... http://bit.ly/2atirHA";;;;"760058556850724865";https://twitter.com/WebhodNetworks/status/760058556850724865
mac_and_i;2016-08-01 02:21;2;3;"Bericht: Apple Watch 2 mit dünnerem Display http://www.heise.de/mac-and-i/meldung/Bericht-Apple-Watch-2-mit-duennerem-Display-3282278.html … # AppleWatch # Smartwatch";;;# #;"760042664012181504";https://twitter.com/mac_and_i/status/760042664012181504
welt;2016-08-01 02:10;12;7;"Apple und Co.: Die unheimliche Macht der Tech-Giganten http://to.welt.de/XcIxHPX pic.twitter.com/4MASvcnSd1";;;;"760040114475130880";https://twitter.com/welt/status/760040114475130880
net_seo;2016-08-01 01:44;0;1;"Kayne West an Tim Cook: "Kauft endlich Tidal!": Kanye West hatte zuletzt aus allen Rohren… http://dlvr.it/Lwv8x7 # apple # applemusic # jayz";;;# # #;"760033465572007936";https://twitter.com/net_seo/status/760033465572007936
mac_and_i;2016-08-01 01:01;7;3;"Apple macht weitere sieben Milliarden US-Dollar Schulden http://www.heise.de/mac-and-i/meldung/Apple-macht-weitere-sieben-Milliarden-US-Dollar-Schulden-3282292.html … # Apple";;;#;"760022530853830660";https://twitter.com/mac_and_i/status/760022530853830660
CNN;2016-07-31 18:00;489;905;"Apple has sold its billionth iPhone http://cnn.it/2a9uMjB pic.twitter.com/ctxJumaMwX";;;;"759916564422328320";https://twitter.com/CNN/status/759916564422328320
EdGrapeNutZimm;2016-07-31 17:59;3;3;"Trump Rescued in Stalled Elevator by firefighters; criticizes Fire Marshall. Next he'll attack apple pie&motherhood http://www.nytimes.com/2016/07/31/us/donald-trump-rescued-from-stalled-elevator-in-colorado-springs.html?smid=nytcore-ipad-share&smprod=nytcore-ipad …";;;;"759916463046086657";https://twitter.com/EdGrapeNutZimm/status/759916463046086657
jasoncreation;2016-07-31 17:45;5;6;"Levitating Apple Watch charger turns smartwatch into futuristic art http://on.mash.to/2aFsHzz # techpic.twitter.com/IQuMDbgZqE";;;#;"759912801238261766";https://twitter.com/jasoncreation/status/759912801238261766
hikyaku;2016-07-31 17:44;0;1;"Apple begins wrapping up Swift 3 and lays out plans for Swift 4 | Ars Technica http://arstechnica.com/apple/2016/07/apple-begins-wrapping-up-swift-3-and-lays-out-plans-for-swift-4/ …";;;;"759912656274804740";https://twitter.com/hikyaku/status/759912656274804740
bitcoinagile;2016-07-31 17:43;2;0;"Australia embraces tap and go cards, but not mobile wallets # tapandgo # apple # applepay http://www.abc.net.au/news/2016-08-01/australia-embraces-tap-and-go/7676816 …pic.twitter.com/API7xmi7dX";;;# # #;"759912391106670592";https://twitter.com/bitcoinagile/status/759912391106670592
futureshift;2016-07-31 17:35;21;13;"This hovering Apple Watch charger transforms tech into art http://on.mash.to/2ak1Sip pic.twitter.com/j9IFljlWL7";;;;"759910285649911808";https://twitter.com/futureshift/status/759910285649911808
triplej;2016-07-31 17:27;3;12;". @ kanyewest reckons this 'Tidal Apple beef is f**king up the music game' http://ab.co/2aaboYe pic.twitter.com/HIWDpv0J7X";;@;;"759908501082615812";https://twitter.com/triplej/status/759908501082615812
evilgeek;2016-07-31 17:19;0;0;"Kanye West tells Apple CEO Tim Cook to give Jay Z 'his check for Tidal now' - Boston Herald http://bit.ly/2artoti";;;;"759906345529126914";https://twitter.com/evilgeek/status/759906345529126914
pjpsullivan;2016-07-31 17:14;3;0;"BBC News - Father told by Apple to get court order for dead son's data http://www.bbc.co.uk/news/uk-england-coventry-warwickshire-36926812 …";;;;"759905024075980800";https://twitter.com/pjpsullivan/status/759905024075980800
nytimeses;2016-07-31 17:00;23;26;"Spotify vs. Apple Music: el melómano gótico contra el marihuanero. http://nyti.ms/2axvw4h pic.twitter.com/v1Ox62qubD";;;;"759901493445193729";https://twitter.com/nytimeses/status/759901493445193729
on6musicnow;2016-07-31 17:00;0;0;"Fiona Apple - Sullen Girl # bbc6music # nowplayinghttp://www.bbc.co.uk/music/artists/a9ee533f-8871-4f62-a6bb-91eb264abc90 …";;;# #;"759901492635500545";https://twitter.com/on6musicnow/status/759901492635500545
mlrockwell;2016-07-31 17:00;1;0;"Levitating Apple Watch charger turns smartwatch into futuristic art http://mashable.com/2016/07/31/levitating-apple-watch-charger/ …pic.twitter.com/IEsi3ZU5iz";;;;"759901486708953089";https://twitter.com/mlrockwell/status/759901486708953089