username;date;retweets;favorites;text;geo;mentions;hashtags;id;permalink
Forbes;2017-10-27 16:41;144;140;"Apple iPhone X pre-orders sold out in minutes, and there won't be any in stock until December http://on.forbes.com/60108Caiy pic.twitter.com/XB3l7HpRxx";;;;"924058383296188416";https://twitter.com/Forbes/status/924058383296188416
TechCrunch;2017-10-27 15:41;32;66;"Apple has never made its own laptop/MacBook sleeve, until today http://tcrn.ch/2yQKCQ4 pic.twitter.com/KSt2dgZn1E";;;;"924043293905883137";https://twitter.com/TechCrunch/status/924043293905883137
TheRegister;2017-10-27 15:08;17;12;"Hey, you know why it's called the iPhone X? It's because when you see Apple's repair bill, your response will be X-… http://reg.cx/2vgq";;;;"924035101251522560";https://twitter.com/TheRegister/status/924035101251522560
mashable;2017-10-27 14:35;17;11;"Surprise! Apple claims iPhone X demand is 'off the charts' http://on.mash.to/2zcRjwa pic.twitter.com/2sRxcNhUPa";;;;"924026696533200907";https://twitter.com/mashable/status/924026696533200907
jowens510;2017-10-27 14:20;18;25;"Google is first to join Apple in the $700 billion club, and got there in less than half the time. http://on.mktw.net/2yaHDT6 $ GOOGL $ GOOG $ AAPLpic.twitter.com/WRVZ3MbjV2";;;;"924023124307382273";https://twitter.com/jowens510/status/924023124307382273
t3n;2017-10-27 14:09;1;3;"iPhone X: Apple lässt Smartphone-Käufer warten http://t3n.de/news/iphone-x-vorbestellung-lange-wartezeiten-870888/ …";;;;"924020297271070720";https://twitter.com/t3n/status/924020297271070720
FAZ_NET;2017-10-27 13:29;1;3;"Große Nachfrage: Vorbestellungen für das iPhone X gehen bei Apple „durch die Decke“ http://www.faz.net/aktuell/wirtschaft/unternehmen/apple-meldet-grosse-nachfrage-nach-iphone-x-15267239.html …";;;;"924010136703832064";https://twitter.com/FAZ_NET/status/924010136703832064
Reuters;2017-10-27 13:20;36;43;"Apple says iPhone X pre-orders are 'off the charts' http://reut.rs/2yQQaKj";;;;"924007832302833665";https://twitter.com/Reuters/status/924007832302833665
EconBizFin;2017-10-27 13:13;34;55;"Apple has $262bn of assets, $108bn of debt and traded $1.6trn of securities since 2011 http://econ.st/2ze5q4o";;;;"924006181210935296";https://twitter.com/EconBizFin/status/924006181210935296
blueoceankc;2017-10-27 12:05;0;0;"RT @ INC Apple Co-Founder Steve Wozniak Launches Digital School ‘Woz U’ http://on.inc.com/2yI5Yzi";;@;;"923988924963442688";https://twitter.com/blueoceankc/status/923988924963442688
DtvWirtschaft;2017-10-27 11:35;0;0;"Apple: Mehr Vorbestellungen für iPhone X als erwartet http://ift.tt/2hgPIuR";;;;"923981450659205126";https://twitter.com/DtvWirtschaft/status/923981450659205126
KaiMicha;2017-10-27 11:32;0;1;"Apple will 2018 das iPhone 9 auf den Markt bringen. http://m.focus.de/digital/videos/iphone-9-im-naechsten-jahr-apple-will-2018-abgespeckte-version-des-iphone-x-auf-den-markt-bringen_id_7759446.html …";;;;"923980695235649541";https://twitter.com/KaiMicha/status/923980695235649541
FORAIM;2017-10-27 11:20;1;0;"Apple einmal nicht als Technik-Unternehmen sondern als Finanzunternehmen betrachtet. Vergleich mit Goldman Sachs http://ow.ly/ln7830gbd1d";;;;"923977830052106245";https://twitter.com/FORAIM/status/923977830052106245
stshank;2017-10-27 11:17;33;74;"I wanted to believe in Apple's Touch Bar revolution, but right now it just slows me down & inflicts serious errors. https://www.cnet.com/news/apple-macbook-pro-touch-problems-commentary/ …pic.twitter.com/PqLRYbHY7s";;;;"923976844109418497";https://twitter.com/stshank/status/923976844109418497
business;2017-10-27 16:36;21;25;"# iPhoneX wait times rise as Apple's new device sells out in Hong Kong https://bloom.bg/2ibIFDh pic.twitter.com/19puW5MuLO";;;#;"924057135750746112";https://twitter.com/business/status/924057135750746112
FNI_INC;2017-10-27 15:58;2;12;"More on the # Apple # iPhone # privacy # exploit discovered by a # Google guy https://www.msn.com/en-us/news/technology/googler-proves-any-iphone-app-with-camera-permission-can-secretly-record-you/ar-AAu4hsw … # security # espionage # infosec # CIO # CSO";;;# # # # # # # # # #;"924047709706731520";https://twitter.com/FNI_INC/status/924047709706731520
YahooFinance;2017-10-27 15:15;4;4;"First-day preorders for the iPhone X sold out on Apple dot com in minutes $ AAPL https://yhoo.it/2zbFPsO pic.twitter.com/6OkZlKnf2t";;;;"924036764939046912";https://twitter.com/YahooFinance/status/924036764939046912
arstechnica;2017-10-27 14:34;4;7;"Well, Apple seems to have definitely zagged as others are happily zigging https://arstechnica.com/gaming/2017/10/apple-will-invest-1-billion-in-tv-but-dont-expect-game-of-thrones/ …";;;;"924026649439604736";https://twitter.com/arstechnica/status/924026649439604736
FT;2017-10-27 14:30;22;21;"Apple says demand for the iPhone X is 'off the charts' http://on.ft.com/2zd9H8s";;;;"924025440750178306";https://twitter.com/FT/status/924025440750178306
ALX_BLOG;2017-10-27 14:22;0;0;"iPhone X: Apple lässt Smartphone-Käufer warten http://t3n.de/news/iphone-x-vorbestellung-lange-wartezeiten-870888/ …";;;;"924023507981406209";https://twitter.com/ALX_BLOG/status/924023507981406209
MarketWatch;2017-10-27 14:04;5;6;"Demand for Apple’s iPhone X leaves fans frustrated, as delivery gets pushed out 5 weeks http://on.mktw.net/2i8KZel pic.twitter.com/xK0X62Sgbh";;;;"924019017530183680";https://twitter.com/MarketWatch/status/924019017530183680
bbcbrasil;2017-10-27 13:36;11;16;"Começa a pré-venda do iPhone X: conheça as novidades e críticas ao novo aparelho da Apple http://bbc.in/2z9Nd88 pic.twitter.com/3tF3aqpJIE";;;;"924011845513568256";https://twitter.com/bbcbrasil/status/924011845513568256
arstechnica;2017-10-27 13:20;3;5;"Is X > 8? Solving Apple’s iPhone sales equation http://arstechnica.com/gadgets/2017/10/is-the-iphone-x-outselling-the-iphone-8-its-more-complicated-than-that/ … by @ SamuelAxon";;@;;"924008020417417216";https://twitter.com/arstechnica/status/924008020417417216
20Minutes;2017-10-27 12:05;8;9;"VIDEO. «20 Minutes» en 1984: Présenté comme une révolution, le nouveau Macintosh d'Apple fait un bide http://bit.ly/2gJGIOn pic.twitter.com/KhWZhoYTAM";;;;"923988986217009152";https://twitter.com/20Minutes/status/923988986217009152
technology;2017-10-27 11:46;11;23;"Apple iPhone X pre-orders for November 3 sell out within minutes https://bloom.bg/2yOWL86 pic.twitter.com/t250IIgPJK";;;;"923984155246866433";https://twitter.com/technology/status/923984155246866433
LesEchos;2017-10-27 10:15;6;7;"# iPhone X, iPhone 8 : y a-t-il péril en la demeure Apple ? >> https://trib.al/E9lzekO pic.twitter.com/YrVRTlT6ux";;;#;"923961303261212672";https://twitter.com/LesEchos/status/923961303261212672
Inc;2017-10-27 09:38;8;12;"An Apple iPhone X Opening Flop May Kill the Quarter http://on.inc.com/2zLbfTs";;;;"923951968191643649";https://twitter.com/Inc/status/923951968191643649
mac_and_i;2017-10-27 09:31;9;5;"iPhone X: Reparatur wird richtig teuer https://www.heise.de/mac-and-i/meldung/iPhone-X-Reparatur-wird-richtig-teuer-3875132.html … # iPhoneX # Apple";;;# #;"923950195402072064";https://twitter.com/mac_and_i/status/923950195402072064
Variety;2017-10-27 09:20;18;28;"Apple Sells Out of iPhone X Pre-Orders, Says Demand Is ‘Off the Charts’ http://bit.ly/2gG7GX4";;;;"923947587689951232";https://twitter.com/Variety/status/923947587689951232
ReutersBiz;2017-10-27 09:14;12;12;"Solid tech earnings, Apple lift Nasdaq higher http://reut.rs/2llL0AB";;;;"923945953169629184";https://twitter.com/ReutersBiz/status/923945953169629184
CHIP_online;2017-10-27 08:57;0;2;"Apple iPhone X mit Vertrag kaufen: So teuer sind die Tarife fürs neue Apple Handy http://dlvr.it/PxvH85 pic.twitter.com/1uc5m01pGk";;;;"923941712031916032";https://twitter.com/CHIP_online/status/923941712031916032
franclavir;2017-10-27 08:53;0;0;"Ja ! Die Zeit vient de publier iPhone X: Geduldsspiele mit Apple http://ift.tt/2yWdPZk";;;;"923940731508621312";https://twitter.com/franclavir/status/923940731508621312
businessinsider;2017-10-27 08:53;7;11;". @ Apple has made it content strategy clearer http://read.bi/2iE9cxa pic.twitter.com/0BP8x7UPjJ";;@;;"923940709216014336";https://twitter.com/businessinsider/status/923940709216014336
hanssteup;2017-10-27 08:52;0;0;"iPhone X: Geduldsspiele mit Apple http://bit.ly/2ia5W8U  / zeitonline";;;;"923940399563137025";https://twitter.com/hanssteup/status/923940399563137025
netana_80;2017-10-27 08:45;0;70;"SoundShare’s new app lets you create playlists with friends, stream them to Apple TV http://tcrn.ch/2y6JS9Y # digitalization # apple";;;# #;"923938673124696064";https://twitter.com/netana_80/status/923938673124696064
zeitonline;2017-10-27 08:44;7;11;"Süßer die Kassen nie klingeln: Apple wird von Vorbestellern des bis zu 1.319 Euro teuren # iPhoneX quasi überrannt.http://www.zeit.de/digital/mobil/2017-10/iphone-x-apple-vorbestellung-wartezeit …";;;#;"923938575103811584";https://twitter.com/zeitonline/status/923938575103811584
lemondefr;2017-10-27 08:10;229;340;"«La vraie révolution serait qu’Apple produise des smartphones socialement, écologiquement & fiscalement soutenables» http://lemde.fr/2xrK7rJ";;;;"923929973135675397";https://twitter.com/lemondefr/status/923929973135675397
HAZ;2017-10-27 08:06;0;0;"Lange Wartezeiten: @ Apple ist vom Kundenansturm auf das # iPhoneX überrumpelt.http://haz.li/sv9";;@;#;"923928972504829952";https://twitter.com/HAZ/status/923928972504829952
hamster44;2017-10-27 08:06;0;2;"Freundin schenkt mir Dänischen Strand, Apple die App Plotagraph+ via APPLE Store. Wie es geht https://www.heise.de/mac-and-i/meldung/Apple-verschenkt-Foto-Animations-App-Plotagraph-3874363.html … Mein 1.Versuch:pic.twitter.com/JlkykHPtwO";;;;"923928776060305408";https://twitter.com/hamster44/status/923928776060305408
NYDNFlashback;2017-10-27 08:04;20;16;"New York City’s subway system, the heart and pulse of the Big Apple, opened # onthisday in 1904 http://nydn.us/2zVkXDp pic.twitter.com/TVMhKqGc2U";;;#;"923928291203014657";https://twitter.com/NYDNFlashback/status/923928291203014657
TIME;2017-10-27 08:00;28;43;"Forget the iPhone X, Apple's best product is something you can't buy http://ti.me/2zHYxom";;;;"923927370356142081";https://twitter.com/TIME/status/923927370356142081
iDeviceHelpus;2017-10-27 07:53;22;143;"Apple iOS 11.1 Release, It's A Big One via @ forbeshttps://www.forbes.com/sites/gordonkelly/2017/10/25/apple-ios-11-1-release-iphone-battery-life-problem-iphone-x/ …";;@;;"923925520777203712";https://twitter.com/iDeviceHelpus/status/923925520777203712
wichtigeupdates;2017-10-27 06:17;0;1;"Neues Apple-Zubehör: Lederkleid fürs MacBook und Hüllen für das iPhone X http://ift.tt/2yPa0Db";;;;"923901498404298752";https://twitter.com/wichtigeupdates/status/923901498404298752
mac_and_i;2017-10-27 06:16;1;3;"Neues Apple-Zubehör: Lederkleid fürs MacBook und Hüllen für das iPhone X https://www.heise.de/mac-and-i/meldung/Neues-Apple-Zubehoer-Lederkleid-fuers-MacBook-und-Huellen-fuer-das-iPhone-X-3874951.html … # iPhoneX # Macbook";;;# #;"923901124532490241";https://twitter.com/mac_and_i/status/923901124532490241
micgeb;2017-10-27 06:15;0;0;"iPhone X: Alles ausverkauft – oder eBay - Wer nun noch Apples Top-Smartphone ergattern möchte, muss mindestens ... http://ow.ly/LOLB50eQBzg";;;;"923900997893853185";https://twitter.com/micgeb/status/923900997893853185
StZ_NEWS;2017-10-27 06:01;0;1;"Vorbestellung # Apple # iPhoneX: So lange muss man jetzt schon warten http://www.stuttgarter-zeitung.de/inhalt.vorbestellung-apple-iphone-x-so-lange-muss-man-jetzt-schon-warten.7f787e1a-7f93-41d9-88a4-afeb873cf4ff.html?utm_term=Autofeed&utm_campaign=Echobox&utm_medium=Social&utm_source=Twitter …pic.twitter.com/PUsE3DOfn9";;;# #;"923897412632154113";https://twitter.com/StZ_NEWS/status/923897412632154113
mac_and_i;2017-10-27 05:46;5;3;"iPhone X: Alles ausverkauft – oder eBay https://www.heise.de/mac-and-i/meldung/iPhone-X-Alles-ausverkauft-oder-eBay-3874935.html … # iPhoneX # Apple";;;# #;"923893575955476483";https://twitter.com/mac_and_i/status/923893575955476483
WIRED_Germany;2017-10-27 04:42;0;1;"Hondas Gold Wing fährt jetzt mit Apples CarPlay → http://bit.ly/goldcarplay pic.twitter.com/iCZcVYXsc5";;;;"923877435741032448";https://twitter.com/WIRED_Germany/status/923877435741032448
StrangeX74;2017-10-27 04:05;1;0;"iPhone X mit Produktionsproblemen: Apple reduzierte angeblich Face-ID-Genauigkeitsvorgaben https://heise.de/-3872086 pic.twitter.com/LPIQhZFsi0";;;;"923868268351418368";https://twitter.com/StrangeX74/status/923868268351418368
TaliterQualiter;2017-10-27 03:49;0;0;"Streit über Diversität: Apple will Aktionärsantrag blockieren http://dlvr.it/PxryDP";;;;"923864238900240389";https://twitter.com/TaliterQualiter/status/923864238900240389
docgoy;2017-10-27 03:47;0;0;"iPhone X - So kann das neue iPhone X vorbestellt werden Nur noch wenige Tage, dann halten Apple-Fans das neue iPh… http://ift.tt/2zJtFnd";;;;"923863629656739841";https://twitter.com/docgoy/status/923863629656739841
docgoy;2017-10-27 03:03;0;0;"Vorbestellungen für iPhone X - Kundenansturm auf neues iPhone führt zu wochenlangen Lieferzeiten Apple hat bei se… http://ift.tt/2zUpKoQ";;;;"923852539191316480";https://twitter.com/docgoy/status/923852539191316480
ArnulfS1993;2017-10-27 02:54;1;1;"# iPhoneX: # Apple lässt Käufer warten. 2,5 Stunden nach Vorbestellstart liegt Lieferzeit bei 5 - 6 Wochen | http://www.handelsblatt.com/20512784.html?share=twitter …";;;# #;"923850460523622400";https://twitter.com/ArnulfS1993/status/923850460523622400
Hierkaufich;2017-10-27 02:20;0;0;"News des Tages: Apple lässt Nutzer zum Start des iPhone X warten: Die Nachrichten des Tages im Überblick. +++ 11… https://goo.gl/fb/eHLB3X";;;;"923841776280064007";https://twitter.com/Hierkaufich/status/923841776280064007
hb_unternehmen;2017-10-27 02:15;0;0;"iPhone X: Apple lässt Smartphone-Käufer warten http://ow.ly/FkZ050eQn2A";;;;"923840585693319168";https://twitter.com/hb_unternehmen/status/923840585693319168
HamburgNext;2017-10-27 01:58;0;0;"RT abendblatt "Wer macht Apple Konkurrenz? Fünf Alternativen zum iPhone X https://www.abendblatt.de/ratgeber/article212364975/Wer-macht-Apple-Konkurrenz-Fuenf-Alternativen-zum-iPhone-X.html?utm_term=Autofeed&utm_campaign=Echobox&utm_medium=Social&utm_source=Twitter#link_time=1509077541 … pic.twitter.com/r9jQtQOmPy"";;;#link_time;"923836252020977664";https://twitter.com/HamburgNext/status/923836252020977664
iphonejanky;2017-10-27 01:53;0;0;"iPhone 4 - Apple lässt Nutzer zum Start des iPhone X warten - Augsburger Allgemeine https://goo.gl/fb/vJM1sw";;;;"923835046863228928";https://twitter.com/iphonejanky/status/923835046863228928
medienrot;2017-10-27 01:30;0;0;"Apple setzt den Fokus weiterhin auf eigene TV-Inhalte und stellt die ehemalige Channel 4-Kreativchefin Jay Hunt ein. http://ow.ly/qsx730gaabd";;;;"923829211810410496";https://twitter.com/medienrot/status/923829211810410496
StZ_NEWS;2017-10-27 01:20;1;1;"iPhone X: Apple nimmt jetzt Vorbestellungen an http://www.stuttgarter-zeitung.de/inhalt.iphone-x-apple-nimmt-jetzt-vorbestellungen-an.f1bbad51-c5a4-40d7-a38d-eaa23a8ce77c.html?utm_term=Autofeed&utm_campaign=Echobox&utm_medium=Social&utm_source=Twitter#link_time=1509092229 …pic.twitter.com/mhBPXHSr9U";;;#link_time;"923826651393347584";https://twitter.com/StZ_NEWS/status/923826651393347584
SWPde;2017-10-27 01:01;0;1;"# Apple startet Vorbestellungen für # iPhoneX http://ebx.sh/2yRgZvF pic.twitter.com/b43THrO1uD";;;# #;"923821850995712000";https://twitter.com/SWPde/status/923821850995712000
Monitoring_IT;2017-10-26 23:56;0;0;"Für mehr AirPower: Apple kauft Hersteller induktiver Lademodule https://buff.ly/2xoBsWY";;;;"923805463665348608";https://twitter.com/Monitoring_IT/status/923805463665348608
handelsblatt;2017-10-26 23:38;0;0;"@ Google, @ facebook, @ amazon und @ Apple sind das neue Kapital. Mehr dazu im # MorningBriefing. # Börse http://fal.cn/tmQJ pic.twitter.com/4HjEd21mBg";;@ @ @ @;# #;"923801122225184768";https://twitter.com/handelsblatt/status/923801122225184768
net_seo;2017-10-26 23:31;0;0;"Telekom, O2 und Vodafone haben schon die iPhone X Vorbestellungen gestartet: Das war… http://dlvr.it/PxqF7Z # apple # gadgets # iphonex";;;# # #;"923799195600896001";https://twitter.com/net_seo/status/923799195600896001
omproof;2017-10-26 23:29;0;0;"neuer Artikel von t3n : iPhone X: Apples Neuinterpretation des iPhones ab heute vorbestellbar http://ift.tt/2zaIyTu # onlinemarketing # so…";;;# #;"923798812275171328";https://twitter.com/omproof/status/923798812275171328
web_designerin;2017-10-26 23:27;0;0;"t3n News: iPhone X: Apples Neuinterpretation des iPhones ab heute vorbestellbar http://dlvr.it/PxqDD6  powered by web-designerin.chpic.twitter.com/WNxdKSztE6";;;;"923798185750945792";https://twitter.com/web_designerin/status/923798185750945792
docgoy;2017-10-26 23:01;0;0;"iPhone 8 und iPhone X - So läuft die Vorbestellung der neuen Apple-iPhones Mit dem iPhone X, iPhone 8 und iPhone … http://ift.tt/2wV72i9";;;;"923791651088359424";https://twitter.com/docgoy/status/923791651088359424
experts_network;2017-10-26 22:43;0;0;"Erstes große Update für watchOS 4: Apples Betriebssystem für die Apple Watch macht im Moment noch an einigen... http://fb.me/1FN6pN3pJ";;;;"923787299682471936";https://twitter.com/experts_network/status/923787299682471936
teezeh;2017-10-26 22:40;0;0;"Heute ist ein wichtiger Tag für das iPhone X von Apple https://www.bloomberg.com/news/articles/2017-10-26/apple-seen-clearing-supply-chain-hurdles-with-growing-pre-orders … via @ technology";;@;;"923786575523270657";https://twitter.com/teezeh/status/923786575523270657
t3n;2017-10-26 22:37;0;3;"iPhone X: Apple Neuinterpretation des iPhones ab heute vorbestellbar http://t3n.de/news/iphone-x-vorbestellbar-870570/ …";;;;"923785745885569024";https://twitter.com/t3n/status/923785745885569024
nytimes;2017-10-26 22:21;96;319;"The red in beets is unlike any other shade of red you'll find in fall foliage, cranberries or apples http://nyti.ms/2zH0aT9";;;;"923781694959902720";https://twitter.com/nytimes/status/923781694959902720
FouzyNews;2017-10-26 17:47;0;0;"watchOS 4.1 soll viele Fehler beheben - Aktuell macht das Apple-Watch-Betriebssystem noch an diversen Ecken Pro... http://ow.ly/bp0T50eQ3qQ";;;;"923712743642943493";https://twitter.com/FouzyNews/status/923712743642943493
WarriorMgwv;2017-10-26 17:38;4;2;"Bitcoin to hit $50,000, surpassing Apple’s market cap in next 5 yrs - analyst https://www.rt.com/business/407829-bitcoin-fifty-thousand-decade-moas/ …pic.twitter.com/HWJ2puP27S";;;;"923710383528886273";https://twitter.com/WarriorMgwv/status/923710383528886273
RudoApps;2017-10-26 17:34;1;3;"La china OPPO reta a Apple y Samsung con el F5, su primer móvil de pantalla ‘infinita’ http://ow.ly/1PH850eQ2cZ";;;;"923709346688598016";https://twitter.com/RudoApps/status/923709346688598016
business;2017-10-26 17:33;4;13;"Friday's iPhone X pre-orders will be crucial for Apple https://bloom.bg/2yOZsE7 pic.twitter.com/8CrV3rvcRS";;;;"923709284730277889";https://twitter.com/business/status/923709284730277889
GiddyXP;2017-10-26 17:25;0;1;"RT @ MESAlliance: . @ Apple Sees its # MobileDevices as Platform for # ArtificialIntelligence ( @ Reuters) - http://ow.ly/6z3a30g9S55 # BusinessNew…";;@ @ @;# # #;"923707250488643584";https://twitter.com/GiddyXP/status/923707250488643584
brandongeren;2017-10-26 17:25;0;5;"https://mobile.nytimes.com/2017/05/10/technology/techs-frightful-five-theyve-got-us.html … Great article about how Google, Facebook, Amazon, Microsoft, and Apple are all very scary and shouldn't be embraced";;;;"923707205374828544";https://twitter.com/brandongeren/status/923707205374828544
BW;2017-10-26 17:21;2;6;"Why Apple’s billion-dollar bet on Hollywood is the opposite of edgy https://bloom.bg/2i7H0yH pic.twitter.com/AvKgNiw1FY";;;;"923706108400754688";https://twitter.com/BW/status/923706108400754688
business;2017-10-26 17:18;19;19;"Apple asks to exclude proposal tying diversity to executive pay https://bloom.bg/2yPPqCJ pic.twitter.com/3VFycEA004";;;;"923705332873904128";https://twitter.com/business/status/923705332873904128
TheStreet;2017-10-26 17:18;4;5;"Apple Co-Founder Steve Wozniak usually buys the new iPhone model as soon as it is available https://buff.ly/2xoPQhP";;;;"923705314813210624";https://twitter.com/TheStreet/status/923705314813210624
TechNewsTWS;2017-10-26 17:17;0;1;"This Robot Will Handle Your Divorce Free of Charge - … Apple Podcasts, iHeartRadio, Stitcher, Spotify, Google P... http://ht.ly/cVWB50ePY9a";;;;"923705294244286464";https://twitter.com/TechNewsTWS/status/923705294244286464
StrategicSec;2017-10-26 17:16;2;1;"Apple, Salesforce and PayPal join LGBT cause in Supreme Court wedding cake case http://ow.ly/yId550ePXfC";;;;"923705048835678208";https://twitter.com/StrategicSec/status/923705048835678208
drnic1;2017-10-26 17:16;2;1;"Latest Apple Watch shows potential as very sweet medical device # health http://lat.ms/2yMJe0R pic.twitter.com/DL6IEkCPUG";;;#;"923704854282825728";https://twitter.com/drnic1/status/923704854282825728
moonshotexec;2017-10-26 17:16;1;0;"# Apple’s Core ML # AI engine is cool, but may let app developers find out more about you than you’re willing to sharehttps://lnkd.in/gdBq69Q";;;# #;"923704829322522624";https://twitter.com/moonshotexec/status/923704829322522624
EnableMart;2017-10-26 17:15;1;3;"Kids and adults with visual impairments can use Apple's Swift Playgrounds to learn to program on their iPads! http://ow.ly/pEHX30fG5aX";;;;"923704595485933568";https://twitter.com/EnableMart/status/923704595485933568
tono_yome;2017-10-26 17:06;0;1;"「注文のキャンセル」を促すAppleのフィッシングメール出回る -INTERNET Watch https://internet.watch.impress.co.jp/docs/news/1063937.html … @ internet_watchより";;@;;"923702348127408128";https://twitter.com/tono_yome/status/923702348127408128
netcookies;2017-10-26 17:06;0;0;"Apple has Netflix and Amazon in sight as it hires British TV executive http://crwd.fr/2zDD1kJ";;;;"923702312077467649";https://twitter.com/netcookies/status/923702312077467649
weeklyascii;2017-10-26 17:03;21;22;"まもなく開始のiPhone Xの予約。SIMフリー版を狙っているなら、iOS向けのApple Storeアプリを用いるのが最善。ただし、3つの落とし穴があるので再確認してほしい。 http://ascii.jp/elem/000/001/576/1576805/ …pic.twitter.com/OahCgGMgLI";;;;"923701696609398784";https://twitter.com/weeklyascii/status/923701696609398784
milo5714900;2017-10-26 17:01;0;0;"Apple denied motions in VirnetX patent infringement case, slapped with a $440M final judgement http://dlvr.it/PxnJFC # technewspic.twitter.com/u5EYrmLryH";;;#;"923701083637272577";https://twitter.com/milo5714900/status/923701083637272577
MStanlick;2017-10-26 17:00;0;0;"Honda&#039;s Gold Wing is the world&#039;s first motorcycle with Apple CarPlay seo http://feeds.mashable.com/~r/Mashable/~3/NIASNr38vgQ/ …";;;#039 #039;"923700952707641344";https://twitter.com/MStanlick/status/923700952707641344
Bethanieah60;2017-10-26 17:00;1;0;"Apple, Salesforce and PayPal join LGBT cause in Supreme Court wedding cake case https://techcrunch.com/2017/10/26/apple-yelp-paypal-masterpiece-cakeshop-v-colorado/?ncid=rss …";;;;"923700786520920064";https://twitter.com/Bethanieah60/status/923700786520920064