username;date;retweets;favorites;text;geo;mentions;hashtags;id;permalink
CNBC;2017-01-10 15:52;31;31;"Key Apple engineer is leaving for Tesla http://cnb.cx/2igEBDb";;;;"818968780571312130";https://twitter.com/CNBC/status/818968780571312130
MEEDIA;2017-01-10 15:51;1;0;"iPhone 8: Apple plant Rückkehr zum ikonischen Design aus Glas und Edelstahl http://meedia.de/2017/01/11/iphone-8-die-rueckkehr-des-ikonischen-designs-aus-edelstahl-und-glas/ …";;;;"818968508381990912";https://twitter.com/MEEDIA/status/818968508381990912
paschoff;2017-01-10 15:43;0;0;"Erneuerbare Energie: Grüne Schafe Apple und Facebook, schwarzes Schaf Amazon - heise online https://www.heise.de/mac-and-i/meldung/Erneuerbare-Energie-Gruene-Schafe-Apple-und-Facebook-schwarzes-Schaf-Amazon-3592471.html …";;;;"818966533380653057";https://twitter.com/paschoff/status/818966533380653057
Techmeme;2017-01-10 15:26;6;5;"Greenpeace clean energy report: Apple, Facebook, Google are leaders, Baidu, Tencent laggards http://techcrunch.com/2017/01/10/apple-facebook-and-google-top-greenpeaces-clean-energy-report/ …http://www.techmeme.com/170110/p21#a170110p21 …";;;#a170110p21;"818962169869930496";https://twitter.com/Techmeme/status/818962169869930496
topitmedia;2017-01-10 15:20;10;6;"［http://www.itmedia.co.jp ］Tesla、AppleのSwift責任者を引き抜き、自動運転ソフト担当幹部に指名 http://bit.ly/2igwAxZ";;;;"818960746264436736";https://twitter.com/topitmedia/status/818960746264436736
arstechnica;2017-01-10 15:07;33;47;"Longtime Apple programmer and Swift creator leaves Apple for Tesla http://arstechnica.com/apple/2017/01/longtime-apple-programmer-and-swift-creator-leaves-apple-for-tesla/ … by @ AndrewWrites";;@;;"818957352795836416";https://twitter.com/arstechnica/status/818957352795836416
engadget;2017-01-10 15:00;12;30;"Next up in our iPhone review retrospective: Our thoughts on Apple's iPhone SE http://engt.co/2iZgpUE  (by @ chrisvelazco)";;@;;"818955657005113346";https://twitter.com/engadget/status/818955657005113346
itmedia_news;2017-01-10 14:56;73;41;"Tesla、AppleのSwift責任者を引き抜き、自動運転ソフト担当幹部に指名 http://bit.ly/2iZiy2r pic.twitter.com/yE7eO4hwb1";;;;"818954820878942208";https://twitter.com/itmedia_news/status/818954820878942208
BenedictEvans;2017-01-10 14:47;7;16;"Apple plans 'high-tech manufacturing' of data-center gear in Arizona - Business Insider http://www.businessinsider.com/apple-high-tech-manufacturing-data-center-gear-arizona-2017-1?utm_source=feedly&utm_medium=referral …";;;;"818952558341287936";https://twitter.com/BenedictEvans/status/818952558341287936
mims;2017-01-10 14:38;9;11;"Apple isn't just building its own cloud services, it's building its own cloud *hardware* http://www.businessinsider.com/apple-high-tech-manufacturing-data-center-gear-arizona-2017-1?utm_source=feedly&utm_medium=referral …";;;;"818950085660778496";https://twitter.com/mims/status/818950085660778496
engadget;2017-01-10 14:37;63;80;"Tesla hires the creator of Apple's Swift programming language http://engt.co/2igdUhW pic.twitter.com/fwPKR8saQX";;;;"818949995260968961";https://twitter.com/engadget/status/818949995260968961
TechCrunch;2017-01-10 14:30;110;123;"Tesla hires Apple's creator of Swift as new VP of Autopilot Software http://tcrn.ch/2igh5WS  by @ etheringtonpic.twitter.com/z7QgGbGWm8";;@;;"818948278041608192";https://twitter.com/TechCrunch/status/818948278041608192
jmuelbert;2017-01-10 14:30;0;0;"Die unsicherste Software 2016: Mit dabei Adobe, Microsoft und Apple http://t3n.de/news/unsicherste-software-2016-783253/?utm_source=twitter.com&utm_medium=social&utm_campaign=social-buttons … via @ t3n";;@;;"818948073963589633";https://twitter.com/jmuelbert/status/818948073963589633
ForbesTech;2017-01-10 14:00;29;29;"Nokia's new Android phone could represent a fresh challenge to Apple, Google and Microsoft http://on.forbes.com/60158Pw2B pic.twitter.com/cOtpvQtmvd";;;;"818940488027926529";https://twitter.com/ForbesTech/status/818940488027926529
omelete;2017-01-10 13:32;7;45;"Carpool Karaoke: Metallica e Ariana Grande participarão da série da Apple Music http://bit.ly/2jfU70H pic.twitter.com/stX4hdkUXS";;;;"818933538364018691";https://twitter.com/omelete/status/818933538364018691
DigiBuzz_de;2017-01-10 13:31;0;0;"Apple soll mit Carl Zeiss an einer Augmented Reality-Brille arbeiten http://ift.tt/2j2szxU";;;;"818933281437741056";https://twitter.com/DigiBuzz_de/status/818933281437741056
crackr;2017-01-10 15:48;0;0;"# iPhone8: # Apple plant Rückkehr zum ikonischen Design aus Edelstahl und Glas $ AAPLhttp://fb.me/4iJdklqop";;;# #;"818967754946572292";https://twitter.com/crackr/status/818967754946572292
itmedia_news;2017-01-10 15:45;13;6;"50RT Tesla、AppleのSwift責任者を引き抜き、自動運転ソフト担当幹部に指名 http://www.itmedia.co.jp/news/articles/1701/11/news058.html …";;;;"818967112538472449";https://twitter.com/itmedia_news/status/818967112538472449
nhtanner;2017-01-10 15:39;0;5;"10 years ago I sold my @ Apple stock because I thought the iPhone was a dumb idea... http://www.abc.net.au/news/2017-01-10/iphone-turns-10-years-old/8171750 …";;@;;"818965610088411137";https://twitter.com/nhtanner/status/818965610088411137
BIUK;2017-01-10 15:20;2;2;"Apple pulled a perfectly good and useful app that helps you find your lost AirPods, and it's unclear why http://buff.ly/2j3iHUU pic.twitter.com/xDEsm8VJ9W";;;;"818960616945778688";https://twitter.com/BIUK/status/818960616945778688
ArsInfiniteLoop;2017-01-10 15:07;0;5;"Longtime Apple programmer and Swift creator leaves Apple for Tesla http://arstechnica.com/apple/2017/01/longtime-apple-programmer-and-swift-creator-leaves-apple-for-tesla/ … by @ AndrewWrites";;@;;"818957354251251714";https://twitter.com/ArsInfiniteLoop/status/818957354251251714
newsycombinator;2017-01-10 15:02;10;7;"Daniel Gross of Apple leaves to become Y Combinator’s newest partner https://techcrunch.com/2017/01/10/daniel-gross-of-apple-leaves-to-become-y-combinators-newest-partner/ …";;;;"818956121323016192";https://twitter.com/newsycombinator/status/818956121323016192
01net;2017-01-10 14:47;9;9;"Il y a 20 ans, Steve Jobs faisait son grand retour dans une keynote d’Apple http://ebx.sh/2igprh9 pic.twitter.com/J1xJHYTnsv";;;;"818952440821272576";https://twitter.com/01net/status/818952440821272576
MarketWatch;2017-01-10 14:41;4;5;"Tesla hires Apple vet to lead 'Autopilot' software efforts: http://on.mktw.net/2ige34U";;;;"818951014128750592";https://twitter.com/MarketWatch/status/818951014128750592
fromedome;2017-01-10 14:40;3;7;"The creator of Swift, Apple’s newish programming language, is leaving for Tesla: http://www.recode.net/2017/1/10/14229364/apple-swift-chris-lattner-leaving … Wow.";;;;"818950668996251649";https://twitter.com/fromedome/status/818950668996251649
MorningMashUp;2017-01-10 14:32;1;4;"# CarpoolKaraoke is becoming a series on Apple Music! But don't worry, you'll still get your fix on late night too. http://bit.ly/2j0mRgc pic.twitter.com/fqJ5QFS7Wu";;;#;"818948534837780482";https://twitter.com/MorningMashUp/status/818948534837780482
MirrorTech;2017-01-10 14:23;7;8;"Apple's next product could be a pair of HoloLens-style augmented reality specs http://www.mirror.co.uk/tech/apples-next-product-could-pair-9598045 …pic.twitter.com/9NsWW5J2K9";;;;"818946424440311808";https://twitter.com/MirrorTech/status/818946424440311808
VCRebecca;2017-01-10 14:21;3;6;"16 # iPhone apps that are better than # apps Apple made http://www.businessinsider.com/iphone-apps-better-than-apple-2017-1/#instead-of-mail-use-microsoft-outlook-1 … by @ redletterdavepic.twitter.com/45l0BJpHoH";;@;# # #instead;"818945767117234176";https://twitter.com/VCRebecca/status/818945767117234176
businessinsider;2017-01-10 14:17;9;16;"Apple's App Store had a monster 2016 http://read.bi/2jAuyKV pic.twitter.com/G2MEL7kUkb";;;;"818944825236013059";https://twitter.com/businessinsider/status/818944825236013059
VentureBeat;2017-01-10 14:05;17;22;"Update: Tesla has hired the creator of Apple's Swift programming language as its new VP of Autopilot software http://venturebeat.com/2017/01/10/the-creator-of-apples-swift-programming-language-is-leaving-the-company/ …pic.twitter.com/xmJoLiAr23";;;;"818941933275885568";https://twitter.com/VentureBeat/status/818941933275885568
WojcikTomas;2017-01-10 13:59;0;5;"How Amazon innovates in ways that Google and Apple can't https://goo.gl/gzuN2A  via @ voxdotcom # startup # innovation";;@;# #;"818940351637585921";https://twitter.com/WojcikTomas/status/818940351637585921
adolfoplasencia;2017-01-10 13:35;4;1;"Otra pista: Apple dijo que están ya trabajando en unas Gafas AR con Carl Zeiss http://cnet.co/2iClwZT";;;;"818934365950476288";https://twitter.com/adolfoplasencia/status/818934365950476288
t3n;2017-01-10 13:32;4;7;"Apple: Mac-Nutzung fällt auf Fünf-Jahres-Tief http://t3n.de/news/mac-marktanteil-nutzerzahlen-784254/ …";;;;"818933473733988359";https://twitter.com/t3n/status/818933473733988359
MEEDIA;2017-01-10 13:30;1;2;"Apple soll mit Carl Zeiss an einer Augmented Reality-Brille arbeiten: http://meedia.de/2017/01/10/apple-soll-mit-carl-zeiss-an-einer-augmented-reality-brille-arbeiten/ …";;;;"818932991850401792";https://twitter.com/MEEDIA/status/818932991850401792
crackr;2017-01-10 13:27;0;0;"# Apple soll mit # CarlZeiss an einer # AugmentedReality-Brille arbeiten $ AAPL # ARhttp://fb.me/70DXGqaM6";;;# # # #;"818932363837263872";https://twitter.com/crackr/status/818932363837263872
dw_wirtschaft;2017-01-10 13:06;0;0;"Zum wiederholten Mal nennt # Greenpeace # Apple vorbildlich bei grüner Energie http://dw.com/p/2VY14 # BigDatapic.twitter.com/LJ8k2z5ebQ";;;# # #;"818926912588357632";https://twitter.com/dw_wirtschaft/status/818926912588357632
Newsweek;2017-01-10 13:05;22;20;"Apple may be working with Carl Zeiss to produce smart glasses http://bit.ly/2jAa44V pic.twitter.com/r6tYGvwNfG";;;;"818926642189963266";https://twitter.com/Newsweek/status/818926642189963266
jptechcrunch;2017-01-10 13:01;8;11;"Apple、MacBook Proのバッテリー問題を解明―Consumer ReportsのベンチマークとSafari双方に問題 http://tcrn.ch/2iZ43f8";;;;"818925835067543552";https://twitter.com/jptechcrunch/status/818925835067543552
thoost;2017-01-10 12:51;0;0;"Erneuerbare Energie: Gute Noten für Apple, Facebook & Google, schwarzes Schaf: Alibaba und Oracle - heise online https://www.heise.de/mac-and-i/meldung/Erneuerbare-Energie-Gruene-Schafe-Apple-und-Facebook-schwarzes-Schaf-Amazon-3592471.html …";;;;"818923122334134272";https://twitter.com/thoost/status/818923122334134272
engadget;2017-01-10 12:45;16;10;"ESPN brings Apple's handy single sign-on tool to its iOS apps http://engt.co/2ifS0LH pic.twitter.com/bXjxZ8iM1v";;;;"818921676540940289";https://twitter.com/engadget/status/818921676540940289
CNNMoney;2017-01-10 12:35;18;30;"# Apple might finally be back on track. http://cnnmon.ie/2jAtG97 $ AAPL";;;#;"818919089817186309";https://twitter.com/CNNMoney/status/818919089817186309
Hierkaufich;2017-01-10 12:32;0;0;"iPhone 8: Es wird aus rostfreiem Stahl geschmiedet: 2017 wird für Apple ein… https://goo.gl/fb/QSDOZk # ChipTop";;;#;"818918463003643906";https://twitter.com/Hierkaufich/status/818918463003643906
danielgross;2017-01-10 12:29;15;148;"I'm leaving Apple and am joining YC as a partner. To celebrate, I've included a giant photo of my face in your feed: https://techcrunch.com/2017/01/10/daniel-gross-of-apple-leaves-to-become-y-combinators-newest-partner/ …";;;;"818917637916766208";https://twitter.com/danielgross/status/818917637916766208
lopezdoriga;2017-01-10 12:22;13;21;"Castigan a Tim Cook porque Apple no llegó a sus objetivos en el 2016 http://goo.gl/hypc4Z";;;;"818915821258940419";https://twitter.com/lopezdoriga/status/818915821258940419
LanceUlanoff;2017-01-10 12:16;4;9;"Sorry, @ Scobleizer, Apple is not delivering AR glasses in 2017 http://mashable.com/2017/01/10/apple-ar-glasses-rumor-analysis/ … # mytakepic.twitter.com/fnDZXrvpUV";;@;#;"818914548820406272";https://twitter.com/LanceUlanoff/status/818914548820406272
Arbeitsrecht1;2017-01-10 12:10;0;0;"Google, Apple, Microsoft: EU-Kommission will Datenschutz bei Online-Werbung stärken http://bit.ly/2iC4Pxw";;;;"818912846574657536";https://twitter.com/Arbeitsrecht1/status/818912846574657536
TheNextWeb;2017-01-10 12:09;16;15;"Apple to play its Trump card and boost its ‘Made in America’ credentials http://tnw.me/82udtF2 pic.twitter.com/sGQ643ec0t";;;;"818912664676167680";https://twitter.com/TheNextWeb/status/818912664676167680
TechCrunch;2017-01-10 12:05;30;68;"Daniel Gross of Apple leaves to become Y Combinator's newest partner http://tcrn.ch/2jAfvB7  by @ JohnMannes";;@;;"818911609519149057";https://twitter.com/TechCrunch/status/818911609519149057
g1;2017-01-10 11:33;29;54;"Cantor de 'Pen-pineapple-apple-pen' volta com hit sobre suco de laranja http://glo.bo/2j0S5DC # G1pic.twitter.com/DyVJwKHRYz";;;#;"818903490177077249";https://twitter.com/g1/status/818903490177077249
GermanyNetwork;2017-01-10 11:30;0;0;"Apple will Hardware für Rechenzentren in USA fertigen http://heise.de/-3592934";;;;"818902770409422848";https://twitter.com/GermanyNetwork/status/818902770409422848
Top_iPad_Apps;2017-01-10 11:04;0;0;"10 Jahre iPhone: Apples nostalgische Verklärung in Zeiten des Abschwungs http://fb.me/1TzjB7YBj";;;;"818896207598784513";https://twitter.com/Top_iPad_Apps/status/818896207598784513
apple_watchapps;2017-01-10 11:04;0;0;"Jetzt auch für iPhone & iPad: Dieses Gadget macht Apple keine Angst http://fb.me/56DMaza7N";;;;"818896199394742273";https://twitter.com/apple_watchapps/status/818896199394742273
g1;2017-01-10 10:39;8;49;"Após Trump, Apple planeja aumentar produção nos EUA, mas deixa iPhone de fora http://glo.bo/2ic8t09 # G1pic.twitter.com/q17EGp6wth";;;#;"818889899105320960";https://twitter.com/g1/status/818889899105320960
dw_deutsch;2017-01-10 10:18;1;1;"Greenpeace lobt Apple für grüne Energie # greenpeace # apple http://dw.com/p/2VYTL?maca=de-tco-dw …pic.twitter.com/Skq19S6bR0";;;# #;"818884617486954496";https://twitter.com/dw_deutsch/status/818884617486954496
businessinsider;2017-01-10 10:17;12;15;"The guy that created one of Apple's most beloved technologies is leaving Apple http://read.bi/2iBE50b pic.twitter.com/7DREvCzWI6";;;;"818884379283955713";https://twitter.com/businessinsider/status/818884379283955713
dsteinkopf;2017-01-10 10:12;0;0;"Erneuerbare Energie: Grüne Schafe Apple und Facebook, schwarzes Schaf Amazon http://bit.ly/2j4vtTp";;;;"818883310202056704";https://twitter.com/dsteinkopf/status/818883310202056704
ARMRVR;2017-01-10 10:12;10;13;"Apple's augmented reality future may be coming into focus in partnership with Carl Zeiss AG http://www.forbes.com/sites/markrogowsky/2017/01/10/new-rumor-suggests-apples-augmented-reality-future-may-be-coming-into-focus/#4bc5efe61b33 … # AR # VR # Apple # Zeiss";;;#4bc5efe61b33 # # # #;"818883178056257536";https://twitter.com/ARMRVR/status/818883178056257536
CNET;2017-01-10 10:12;16;19;". @ ConsumerReports is re-testing MacBook Pro battery life after Apple identified a developer mode bug in Safari http://cnet.co/2ia7XVt pic.twitter.com/VJNKqdKJts";;@;;"818883107474522112";https://twitter.com/CNET/status/818883107474522112
Recode;2017-01-10 10:08;20;20;"Apple convinced Consumer Reports to retest the MacBook Pro’s battery life after uncovering an ‘obscure’ bug http://www.recode.net/2017/1/10/14227448/apple-consumer-reports-retest-macbook?utm_campaign=recode.net&utm_content=chorus&utm_medium=social&utm_source=twitter …";;;;"818882133359988736";https://twitter.com/Recode/status/818882133359988736
mashable;2017-01-10 10:04;11;18;"Apple says a bug messed up Consumer Reports' MacBook Pro battery tests http://on.mash.to/2iYlGvv";;;;"818881102584672256";https://twitter.com/mashable/status/818881102584672256
FT;2017-01-10 10:00;25;25;"Opinion: Why Apple’s Orwellian surrender in China is so disappointing. http://on.ft.com/2icATHz";;;;"818880102570270721";https://twitter.com/FT/status/818880102570270721
michaeljohns;2017-01-10 09:46;19;20;"The # Trump effect: @ Apple suddenly seeks to expand U.S.-based manufacturing: http://www.cnbc.com/2017/01/09/apple-seeks-to-expand-manufacturing-in-arizona.html … # TeaParty # TrumpTrain # Apple";;@;# # # #;"818876716064133121";https://twitter.com/michaeljohns/status/818876716064133121
engadget;2017-01-10 09:24;14;25;"Apple Music's 'Carpool Karaoke' features Alicia Keys and Metallica http://engt.co/2ifgdC0 pic.twitter.com/pjY1jrMsOi";;;;"818871254988029952";https://twitter.com/engadget/status/818871254988029952
hstubner;2017-01-10 09:24;1;3;"FAZ/dpa: Greenpeace-Studie - Apple bezieht besonders viel Strom aus erneuerbaren Energien http://www.faz.net/aktuell/wirtschaft/netzwirtschaft/greenpeace-studie-apple-bezieht-besonders-viel-strom-aus-erneuerbaren-energien-14612658.html …";;;;"818871231055273984";https://twitter.com/hstubner/status/818871231055273984
koelnkomm;2017-01-10 09:05;0;1;"iPhone 8: # Apple deutet Großes an http://ow.ly/vL3Y307PH2F";;;#;"818866346989527041";https://twitter.com/koelnkomm/status/818866346989527041
DirkLindgens;2017-01-10 09:02;0;2;"10 Jahre iPhone: Apple und der magische Moment, in dem Steve Jobs die Smartphone-Revolution verkündete http://meedia.de/2017/01/09/10-jahre-iphone-apples-nostalgische-verklaerung-in-zeiten-des-abschwungs/ … via @ meedia";;@;;"818865703457529856";https://twitter.com/DirkLindgens/status/818865703457529856
e_mobility;2017-01-10 09:02;0;3;"Audi orientiert sich an Apple - Umsatz/Kunde bzw. km/Kunde wichtig nicht Stückzahlen - neue Mobilitätswelt https://www.welt.de/print/welt_kompakt/webwelt/article161020120/Audi-orientiert-sich-an-Apple.html&wtmc=socialmedia.twitter.shared.web … via @ welt";;@;;"818865563296563200";https://twitter.com/e_mobility/status/818865563296563200
lisa_brack;2017-01-10 08:59;0;0;"Apple AirPod Alternativen: 15 Hörer, die schneller da sind als Apples In-Ears http://ift.tt/2i9X1Hd";;;;"818864965692100608";https://twitter.com/lisa_brack/status/818864965692100608
t3n;2017-01-10 08:33;8;12;"Apple arbeitet mit Carl Zeiss an AR-Brille – Vorstellung dieses Jahr möglich http://t3n.de/news/apple-carl-zeiss-smart-glass-784007/ …";;;;"818858194470653953";https://twitter.com/t3n/status/818858194470653953
lisa_brack;2017-01-10 08:29;0;0;"Apple AirPod Alternativen: Diese Hörer kommen noch vor Weihnachten bei Ihnen an http://ift.tt/2hEVR66";;;;"818857305236246528";https://twitter.com/lisa_brack/status/818857305236246528
t3n;2017-01-10 08:10;0;1;"t3n-Podcast: 10 Jahre iPhone und jetzt? Das sind die aktuellen Herausforderungen für Apple. # filterblase # techcasthttp://t3n.de/news/t3n-podcast-10-jahre-iphone-783944 …";;;# #;"818852518256136193";https://twitter.com/t3n/status/818852518256136193
heidelbergmobil;2017-01-10 08:00;0;0;"Apple Glass: Anstehende Vorstellung von Augmented-Reality-Brille indirekt bestätigt... http://fb.me/2NtLsGj5I";;;;"818849911009591300";https://twitter.com/heidelbergmobil/status/818849911009591300
printpraxis;2017-01-10 07:52;1;1;"Apple, der Serverschrank und die Außenhandelszone: https://www.heise.de/newsticker/meldung/Apple-will-Hardware-fuer-Rechenzentren-in-USA-fertigen-3592934.html …";;;;"818848009115070464";https://twitter.com/printpraxis/status/818848009115070464
ReporterOG;2017-01-10 07:39;4;2;"# Russland fordert Löschung der @ LinkedIn-App von @ Android- & @ Apple-Smartphones. http://www.spiegel.de/netzwelt/netzpolitik/linkedin-app-in-russland-aus-angebot-von-google-und-apple-entfernt-a-1129059.html …";;@ @ @;#;"818844608180449285";https://twitter.com/ReporterOG/status/818844608180449285
t3n;2017-01-10 06:59;3;7;"Erneuerbare Energien: Apple, Facebook und Google bekommen Bestnote von Greenpeace http://t3n.de/news/greenpeace-energiecheck-apple-google-aws-783973/ …";;;;"818834652391735296";https://twitter.com/t3n/status/818834652391735296
mac_and_i;2017-01-10 06:56;4;4;"Apple will Hardware für Rechenzentren in USA fertigen https://www.heise.de/mac-and-i/meldung/Apple-will-Hardware-fuer-Rechenzentren-in-USA-fertigen-3592934.html … # Apple # Rechenzentrum";;;# #;"818833806014709760";https://twitter.com/mac_and_i/status/818833806014709760
AndreasFloemer;2017-01-10 06:28;1;2;"iPhone 8: Apple deutet Großes an http://ift.tt/2ivlKlr";;;;"818826850269089794";https://twitter.com/AndreasFloemer/status/818826850269089794
t3n;2017-01-10 06:20;1;0;"t3n- # Podcast: 10 Jahre iPhone und jetzt? @ doener und @ papierjunge sprechen über die Herausforderungen für # Apple http://t3n.de/news/t3n-podcast-10-jahre-iphone-783944/ …";;@ @;# #;"818824724604223488";https://twitter.com/t3n/status/818824724604223488
1Feedom;2017-01-10 06:08;1;2;"Unser aktuelles Thema: # Apple - Hierzu im Archiv: http://www.stern.de/wirtschaft/news/apple-schlaegt-facebook-im-greenpeace-ranking-7275116.html?utm_campaign=wirtschaft&utm_medium=rssfeed&utm_source=standard … für # IN4M";;;# #;"818821860662120448";https://twitter.com/1Feedom/status/818821860662120448
dw_deutsch;2017-01-10 05:58;2;0;"Greenpeace lobt Apple für grüne Energie # greenpeace # apple http://dw.com/p/2VYTL?maca=de-tco-dw …pic.twitter.com/WPLoij8SXF";;;# #;"818819210814095362";https://twitter.com/dw_deutsch/status/818819210814095362
fabian_kern;2017-01-10 05:46;0;1;"Futter für die Gerüchteküche: Arbeiten Apple und Zeiss zusammen an einer AR-Brille? Wir werden sehen... http://t3n.de/news/apple-carl-zeiss-smart-glass-784007/ …";;;;"818816390564024323";https://twitter.com/fabian_kern/status/818816390564024323
Quis_Leget_Haec;2017-01-10 05:44;0;0;"Google, Apple, Microsoft: EU-Kommission will Datenschutz bei Online-Werbung stärken http://bit.ly/2jyTEda";;;;"818815697350365185";https://twitter.com/Quis_Leget_Haec/status/818815697350365185
Hierkaufich;2017-01-10 05:27;0;0;"iPhone 8: Tim Cook kündigt das "Beste" an: 2017 wird für Apple ein entscheidendes… https://goo.gl/fb/CPjGR6 # ChipTop";;;#;"818811616867262464";https://twitter.com/Hierkaufich/status/818811616867262464
DigiSocietyAt;2017-01-10 05:04;0;0;"Grünes Schaf Apple, schwarzes Schaf Amazon - saubere Energie bei den IT Konzernen: https://www.heise.de/newsticker/meldung/Erneuerbare-Energie-Gruene-Schafe-Apple-und-Facebook-schwarzes-Schaf-Amazon-3592471.html?view=zoom;zoom=1 …";;;;"818805626285522944";https://twitter.com/DigiSocietyAt/status/818805626285522944
holimuk;2017-01-10 05:01;0;4;"Apple-Manager: Alexa fehlt der Bildschirm http://www.heise.de/mac-and-i/meldung/Apple-Manager-Alexa-fehlt-der-Bildschirm-3592445.html … Phil Schiller hatte sich bereits bei der Bedeutung von NFC geirrt!";;;;"818805056220856320";https://twitter.com/holimuk/status/818805056220856320
Hierkaufich;2017-01-10 04:52;0;0;"Wechsel zu Apple Music: James Corden verkündet Neuerungen beim Carpool-Karaoke: Er hatte sie alle: Adele… https://goo.gl/fb/vFO8d6 # Stern";;;#;"818802672165855236";https://twitter.com/Hierkaufich/status/818802672165855236
wiwo_green;2017-01-10 04:46;5;4;"Greenpeace: Apple Spitzenreiter bei Nutzung erneuerbarer Energien http://ow.ly/Q6Dg508pPjj";;;;"818801246710747136";https://twitter.com/wiwo_green/status/818801246710747136
steffenmeier;2017-01-10 04:20;0;2;"Die unsicherste Software 2016: Mit dabei Adobe, Microsoft und Apple | t3n http://ow.ly/jYAA307R4pq";;;;"818794560935624704";https://twitter.com/steffenmeier/status/818794560935624704
Hierkaufich;2017-01-10 04:19;0;0;"Ausgerechnet Samsung! Hersteller öffnet sich für Apple: Samsung öffnet seine… https://goo.gl/fb/L1X0wd # ChipTop";;;#;"818794467327086593";https://twitter.com/Hierkaufich/status/818794467327086593
wiwo;2017-01-10 04:16;1;5;"Greenpeace: Apple Spitzenreiter bei Nutzung erneuerbarer Energien http://ow.ly/z3Im508pKhY";;;;"818793687765413888";https://twitter.com/wiwo/status/818793687765413888
ReporterOG;2017-01-10 04:11;9;5;". @ Apple’s Blockade der @ nytimes-App ist großer Schlag gegen # Meinungsfreiheit – nicht nur in # China. http://www.sueddeutsche.de/kultur/apple-in-china-schlag-gegen-die-meinungsfreiheit-1.3322744 … via @ SZ";;@ @ @;# #;"818792476626616321";https://twitter.com/ReporterOG/status/818792476626616321
suka_hiroaki;2017-01-10 03:49;0;0;"Motto der Branche für 2017: Anbiederung "Apple to play its Trump card and boost its ‘Made in America’ credentials" https://tnw.to/2jpvAp9";;;;"818786939730010112";https://twitter.com/suka_hiroaki/status/818786939730010112
dw_wissenschaft;2017-01-10 03:46;0;0;". @ Greenpeace lobt @ Apple für grüne Energie. Nur bei @ Amazon gibt es Video-Streamen mit 'schmutziger' Energie http://www.dw.com/de/greenpeace-lobt-apple-f%C3%BCr-gr%C3%BCne-energie/a-37073355 …pic.twitter.com/o6uGwx47dX";;@ @ @;;"818786052546633729";https://twitter.com/dw_wissenschaft/status/818786052546633729
loredo;2017-01-10 03:41;0;3;""Apple-Manager: Alexa fehlt der Bildschirm" Ja, und Siri fehlt der Grips https://www.heise.de/newsticker/meldung/Apple-Manager-Alexa-fehlt-der-Bildschirm-3592445.html …";;;;"818784763045670912";https://twitter.com/loredo/status/818784763045670912
sound_wordz;2017-01-10 03:21;0;0;"Headphones - Apple Inc. entfernt Such-App fuer # Airpods Die kabellosen Ohrhoerer Airpods von Apple können... http://fb.me/38CjmXj0q";;;#;"818779709563617280";https://twitter.com/sound_wordz/status/818779709563617280
ntvde;2017-01-10 03:17;2;7;"Greenpeace-Ranking zum Energie-Mix: Apple ist top beim grünen Strom http://n-tv.io/N4Vgx3 pic.twitter.com/fFCgx21CsU";;;;"818778674006589440";https://twitter.com/ntvde/status/818778674006589440
bfchr;2017-01-10 02:58;0;0;"Der Gewinn geht zurück, dafür ist # Apple laut @ greenpeace_de die Nummer eins bei erneuerbaren Energien http://www.faz.net/-gqe-8p776#GEPC;s3 … via @ faznet";;@ @;# #GEPC;"818774091083763712";https://twitter.com/bfchr/status/818774091083763712
