username;date;retweets;favorites;text;geo;mentions;hashtags;id;permalink
business;2017-06-06 17:39;29;49;"Apple taps Jessica Alba and Gwyneth Paltrow for its first original series, “Planet of the Apps" https://bloom.bg/2qZAjGd pic.twitter.com/iODgG8noCI";;;;"872251613322391558";https://twitter.com/business/status/872251613322391558
KissThePaw;2017-06-06 17:36;2;4;"Big Brother is watching you. He knows when you're driving and texting, you naughty iPhone user, you. # Apple https://www.google.com/amp/www.independent.co.uk/life-style/gadgets-and-tech/news/ios-apple-wwdc-driving-do-not-disturb-new-feature-release-date-safety-privacy-a7775231.html%3Famp …";;;#;"872250877775667202";https://twitter.com/KissThePaw/status/872250877775667202
TechCrunch;2017-06-06 17:36;28;57;"An in-depth look at Apple's new HomePod http://tcrn.ch/2sdOnvu pic.twitter.com/8CE9kMLC3w";;;;"872250862025842688";https://twitter.com/TechCrunch/status/872250862025842688
JoinTheDrive;2017-06-06 17:36;12;9;"# Apple announced a new "Do Not Disturb While Driving" feature for the iPhone to help combat driver distraction. http://bit.ly/2ryKVL0 pic.twitter.com/HZP61zVut0";;;#;"872250795424612352";https://twitter.com/JoinTheDrive/status/872250795424612352
shiver_tweet;2017-06-06 17:35;0;0;"WWDC 2017: iMac Pro, iPad Pro und HomePod im Video - iMac Pro, iPad Pro 10,5, HomePod, iOS 11 und mehr: Apple h... http://ht.ly/O9In50bZlJk";;;;"872250720296284160";https://twitter.com/shiver_tweet/status/872250720296284160
Gadgets360;2017-06-06 17:34;15;34;"Revealed: India Price of All New Products Apple Announced at # WWDC2017 http://gadgets.ndtv.com/tablets/news/ipad-pro-macbook-air-pro-imac-price-in-india-wwdc-2017-1708805 … # wwdc17";;;# #;"872250438942203904";https://twitter.com/Gadgets360/status/872250438942203904
dchou1107;2017-06-06 17:34;5;7;"Michelle Obama tells Apple developers: You're missing out on my money unless you include more women http://buff.ly/2qZpBPS";;;;"872250251419287552";https://twitter.com/dchou1107/status/872250251419287552
evankirstel;2017-06-06 17:30;6;8;"Apple Just Joined Tech’s Great Race to Democratize # AI on @ wired https://www.wired.com/2017/06/apple-siri-ai/ … # wwdc2017pic.twitter.com/QER7ikEdho";;@;# #;"872249349924958210";https://twitter.com/evankirstel/status/872249349924958210
businessinsider;2017-06-06 17:22;25;47;"Apple announced the future this week, and you probably didn't even notice http://read.bi/2ryZ8as pic.twitter.com/3Hd03fgTHe";;;;"872247426224197632";https://twitter.com/businessinsider/status/872247426224197632
beserezukunft;2017-06-06 17:20;0;0;"Apple unter Tim Cook: nicht so cool, aber erfolgreich - Alle erwarten Revolutionäres von dem Konzern, wenn er n... http://owl.li/8v1I50bZiIS";;;;"872246831249575936";https://twitter.com/beserezukunft/status/872246831249575936
jptechcrunch;2017-06-06 17:19;7;5;"FacebookやTwitterを追随、AppleのiMessageもカスタマーサポートの窓口を目指す http://tcrn.ch/2rSJMy6";;;;"872246664463081477";https://twitter.com/jptechcrunch/status/872246664463081477
WIRED;2017-06-06 17:19;30;94;"Apple may have once again won over its most loyal users—the creative class http://wrd.cm/2qZF5nc";;;;"872246568321265665";https://twitter.com/WIRED/status/872246568321265665
ReutersBiz;2017-06-06 17:18;9;9;"Apple's first TV series shows what it takes to build an app http://reut.rs/2qUYn96";;;;"872246325320048640";https://twitter.com/ReutersBiz/status/872246325320048640
TechCrunch;2017-06-06 17:10;35;60;"Apple doubles its $10/month iCloud storage plan to 2TB, adds family sharing http://tcrn.ch/2sd75mV # WWDC17";;;#;"872244227639578624";https://twitter.com/TechCrunch/status/872244227639578624
unterderkuppel;2017-06-06 17:05;0;0;"Apple WWDC: Aus allen Wolken - Apple und Google beginnen, künstliche Intelligenz aus der Cloud zu holen. Künfti... http://htl.li/S0z050bZeKR";;;;"872243176450523137";https://twitter.com/unterderkuppel/status/872243176450523137
nytimesbusiness;2017-06-06 17:00;3;7;"Apple needs to reinvent itself to compete with Amazon, says @ fmanjoo. There are signs it just might be doing so. http://nyti.ms/2rSoUr8 pic.twitter.com/MPEKGZaq8L";;@;;"872241783891218432";https://twitter.com/nytimesbusiness/status/872241783891218432
WSJ;2017-06-06 17:00;41;69;"Apple has set its sights on a new target: becoming the world’s largest platform for augmented reality http://on.wsj.com/2sdMmiZ";;;;"872241718128672768";https://twitter.com/WSJ/status/872241718128672768
RNDrive;2017-06-06 17:00;3;1;"Meet Yuma Soerianto,10 from Melbourne. He builds apps and just met Apple CEO Tim Cook http://ab.co/2rw0EKO pic.twitter.com/qri5wlwwrM";;;;"872241707873468416";https://twitter.com/RNDrive/status/872241707873468416
GT_Business;2017-06-06 17:00;0;0;"Apple Launches 'HomePod,' Its First New Product in (Almost) 3 Years https://www.inc.com/associated-press/apple-new-product-smart-home-spaker-homepod-developer-conference-2017.html … # Tech # TechNews";;;# #;"872241707131129856";https://twitter.com/GT_Business/status/872241707131129856
muneyakecirno;2017-06-06 17:00;1;0;"“Appleが認めた日本人の開発者は、82歳。「インターネットは翼を与えてくれた」と語る深い理由” http://htn.to/eUeaVC";;;;"872241706665562113";https://twitter.com/muneyakecirno/status/872241706665562113
testmonki;2017-06-06 17:00;0;0;"Everything # Apple announced at its # WWDC keynote via @ TechCrunch http://mnki.es/2sdg47A # iOS # Macpic.twitter.com/m9AiPZkF33";;@;# # # #;"872241702005854209";https://twitter.com/testmonki/status/872241702005854209