username;date;retweets;favorites;text;geo;mentions;hashtags;id;permalink
HannahElliott;2013-10-05 08:46;35;10;"Elon Musk: Tesla S Fire Would Have Been Worse In A Regular Car http://onforb.es/1byXlpt @ elonmusk @TeslaMotors";;@ @TeslaMotors;;"386517729668112384";https://twitter.com/HannahElliott/status/386517729668112384
UrbanSunChimp;2013-10-05 07:21;0;0;"“ @ wiwo_green: Ein # Tesla brennt... http://green.wiwo.de/model-s-von-tesla-in-flammen-wie-sicher-ist-technologie-wirklich/ …”";;@;#;"386496435094835200";https://twitter.com/UrbanSunChimp/status/386496435094835200
Forbes;2013-10-05 00:36;19;14;"The Tesla fire is a textbook PR problem - and they should fix it http://bit.ly/1bxna9z";;;;"386394501755174912";https://twitter.com/Forbes/status/386394501755174912
engadget;2013-10-04 19:59;35;15;"Tesla Model S catches fire after battery puncture, Musk responds http://engt.co/190UqQU";;;;"386324625283899392";https://twitter.com/engadget/status/386324625283899392
businessinsider;2013-10-05 08:46;11;4;"Despite his Tesla catching fire, the guy who owned it said it "performed very well" and he'll buy again http://read.bi/1bICyfU";;;;"386517757883604994";https://twitter.com/businessinsider/status/386517757883604994
revesjef;2013-10-05 04:20;2;1;"Tesla Model S is the best selling car in Norway with 5,1 % of the market in September. http://on.wsj.com/1g3kXC7  via @ WSJ";;@;;"386450793974358017";https://twitter.com/revesjef/status/386450793974358017
manuel_c;2013-10-05 04:06;4;0;"Woot! @ ElonMusk defends Tesla electric car after fire http://buff.ly/1ceqxl7 # innovation # startup # research # brand # automotive # pr # image";;@;# # # # # # #;"386447218171183104";https://twitter.com/manuel_c/status/386447218171183104
es_engadget;2013-10-05 00:10;24;7;"Tesla Model S se incendia en plena autopista tras impactar su batería con una pieza metálica - http://engt.co/15bv57v";;;;"386387790134779904";https://twitter.com/es_engadget/status/386387790134779904