username;date;retweets;favorites;text;geo;mentions;hashtags;id;permalink
lorakolodny;2013-10-10 15:54;6;3;"Tesla Co-Founder Eberhard Joins Advisory Board of EV Racing Bike Startup, BRD Motorcycles http://on.wsj.com/1gu1Ilo  via @ WSJ";;@;;"388437492103254017";https://twitter.com/lorakolodny/status/388437492103254017
Cinemathon;2013-10-10 15:04;0;0;"Mel Gibson apes Tesla's Elon Musk in 'Machete Kills' http://usat.ly/1an3csG  via @ USATODAY";;@;;"388424745336979456";https://twitter.com/Cinemathon/status/388424745336979456
MarketSmith;2013-10-10 12:13;1;1;"How Facebook, LinkedIn, Netflix And Tesla Are Running The Rally: http://ow.ly/pHmpw $ FB $ LNKD $ NFLX $ TSLA";;;;"388381885204025344";https://twitter.com/MarketSmith/status/388381885204025344
1389;2013-10-10 09:10;1;1;"Pittsburgh filmmaker uncovers some truths about Nikola Tesla | TribLIVE http://triblive.com/aande/somanyquestions/4689147-74/tesla-edison-really#axzz2hIf0mylB …";;;#axzz2hIf0mylB;"388335632138776576";https://twitter.com/1389/status/388335632138776576
LaTribune;2013-10-10 03:30;6;3;"# Tesla, la limousine électrique pour milliardaires "écolos", prend la tête des ventes en Norvège http://bit.ly/1eat8L2";;;#;"388250204665024512";https://twitter.com/LaTribune/status/388250204665024512
EVehicular;2013-10-10 10:06;1;1;"Mel Gibson apes Tesla's Elon Musk in 'Machete Kills' - USA TODAY http://usat.ly/17hSeCR # ev";;;#;"388349734332948480";https://twitter.com/EVehicular/status/388349734332948480