username;date;retweets;favorites;text;geo;mentions;hashtags;id;permalink
kriegs_recht;2015-10-29 14:53;5;11;"Sehr, sehr, sehr interessanter Artikel auf Mashable über Zustand und Zukunft von Tesla: http://mashable.com/2015/10/28/tesla-hype/#MPCor6f.XgqF …";;;#MPCor6f;"659850561811046401";https://twitter.com/kriegs_recht/status/659850561811046401
Slate;2015-10-29 11:32;19;21;"How is Tesla different from regular cars for long-distance driving? Via @ quora: http://slate.me/1HdwpGN pic.twitter.com/n17PyX9nkt";;@;;"659800033550802944";https://twitter.com/Slate/status/659800033550802944
martinhering;2015-10-29 11:09;0;0;"Besser man kauft einfach kein Verbrennungsauto mehr. Meines muss durchhalten bis Tesla was Erschwingliches bringt. http://www.spiegel.de/auto/aktuell/neue-eu-abgasvorschrift-ein-herz-fuer-stinker-kommentar-a-1060197.html …";;;;"659794098501603329";https://twitter.com/martinhering/status/659794098501603329
CBCTheNational;2015-10-28 17:34;12;11;""Look ma, no hands!" @ cbcsaltzman tests Tesla's new autopilot feature. Full report tonight. http://www.cbc.ca/1.3291201 https://amp.twimg.com/v/043eeb01-a9eb-436c-9932-1b9799720d70 …";;@;;"659528823860412416";https://twitter.com/CBCTheNational/status/659528823860412416
bigbangtheory;2015-10-28 17:07;281;561;"EXCLUSIVE: Tesla CEO @ elonmusk to appear on an upcoming # BigBangTheory episode. Get details: http://ow.ly/TYrpH pic.twitter.com/1MoNvJER27";;@;#;"659521863765356544";https://twitter.com/bigbangtheory/status/659521863765356544
SAI;2015-10-29 12:37;4;7;"A legendary car exec thinks Tesla is facing the 'trifecta of doom' http://read.bi/1Wkj7EK";;;;"659816404280066048";https://twitter.com/SAI/status/659816404280066048
LinnaneCiara;2015-10-29 10:57;6;11;"Coming next Tuesday: What to look for in Tesla’s earnings $ TSLA http://on.mktw.net/1Hemhxp pic.twitter.com/MZLulgnL9C";;;;"659791187952406528";https://twitter.com/LinnaneCiara/status/659791187952406528
MSNAutos;2015-10-29 10:44;6;15;"@ MotorTrend takes the Tesla Model S P90D (and its ludicrous mode) out for a spin: http://bit.ly/1jUDUgW pic.twitter.com/WA1aeUoKhG";;@;;"659788018807541760";https://twitter.com/MSNAutos/status/659788018807541760