username;date;retweets;favorites;text;geo;mentions;hashtags;id;permalink
engadget;2015-09-29 16:10;35;43;"Here's how to watch Tesla's Model X launch event http://engt.co/1h8D3a5 pic.twitter.com/fBbIvatwLP";;;;"648998211781292032";https://twitter.com/engadget/status/648998211781292032
noobde;2015-09-29 16:05;63;308;"The Tesla X has a "Sub-zero Weather Package" That's a sign, right? I HAVE to get one, right? http://www.huffingtonpost.com/entry/tesla-model-x-electric-suv_560abe2fe4b0af3706ddfe60?ncid=tweetlnkushpmg00000067 …pic.twitter.com/fuo4msTvxI";;;;"648997125544476672";https://twitter.com/noobde/status/648997125544476672
NYMag;2015-09-29 14:42;26;25;"How much better a parent will you be if you buy a new Tesla SUV? http://nym.ag/1KPOVpe pic.twitter.com/EoZhO5lhNe";;;;"648976049338847232";https://twitter.com/NYMag/status/648976049338847232
YahooFinance;2015-09-29 14:30;9;5;"Tesla Model X: Right car, wrong time http://yhoo.it/1VlLFNC";;;;"648973207744172032";https://twitter.com/YahooFinance/status/648973207744172032
HuffPost;2015-09-29 14:19;49;72;"Here's everything we know about the new Tesla Model X http://huff.to/1MExA6p pic.twitter.com/rruNGpdJj1";;;;"648970471891968000";https://twitter.com/HuffPost/status/648970471891968000
ulvisaran;2015-09-29 14:06;3;4;"Elon Musk: Bir iki yıl içinde Tesla otomobiller tek defalık dolumla (şarjla) bin km gidebilecek duruma gelecek: http://tcrn.ch/1O60PSJ";;;;"648967056147283972";https://twitter.com/ulvisaran/status/648967056147283972
ForbesTech;2015-09-29 14:00;36;20;"Don’t be surprised if the Tesla Model X shakes things up: http://onforb.es/1JAHzVL pic.twitter.com/3FPMyEdbx7";;;;"648965478828888064";https://twitter.com/ForbesTech/status/648965478828888064
FoxBusiness;2015-09-29 13:59;8;9;"# Tesla will debut its long-awaited Model X crossover tonight. Here’s what we know so far: http://fxn.ws/1jvP4rU pic.twitter.com/t1eXLMzwBj";;;#;"648965461623726080";https://twitter.com/FoxBusiness/status/648965461623726080
TIME;2015-09-29 13:45;45;50;"See the factory where Tesla is building its new SUV http://ti.me/1OEEfRd";;;;"648961711689568256";https://twitter.com/TIME/status/648961711689568256
business;2015-09-29 13:15;24;21;"The first of Tesla's Model X sport utility vehicles is about to be handed over http://bloom.bg/1KH2s5u pic.twitter.com/yenHvgEddl";;;;"648954283149406208";https://twitter.com/business/status/648954283149406208
newsycombinator;2015-09-29 13:02;37;26;"Musk Says Tesla Cars Will Go 620 Miles per Charge in 2 Years, Autonomous in 3 http://techcrunch.com/2015/09/29/elon-musk-says-tesla-cars-will-reach-620-miles-on-a-single-charge-within-a-year-or-two-have-fully-autonomous-cars-in-three-years/#.bc3qki:KVt4 …";;;#;"648950987630211072";https://twitter.com/newsycombinator/status/648950987630211072
handelsblatt;2015-09-29 12:36;10;6;"Das # ModelX soll bei # Tesla die nächste Stufe zünden: Das erste elektrische SUV der Automobilgeschichte. http://www.handelsblatt.com/unternehmen/industrie/tesla-setzt-ein-zeichen-gegen-vw-und-co-model-x-feiert-premiere/12384008.html?social=twitter …";;;# #;"648944357240782848";https://twitter.com/handelsblatt/status/648944357240782848
latimes;2015-09-29 12:05;82;56;"New Tesla finally hits the streets today: 7-seater Model X electric SUV w/“falcon wing” doors http://lat.ms/1O04ZtQ pic.twitter.com/4hRT4fX2Qt";;;;"648936579189374978";https://twitter.com/latimes/status/648936579189374978
mashable;2015-09-29 11:30;110;97;"Elon Musk: Tesla will have 745-mile range, fully autonomous vehicles by 2020 http://on.mash.to/1KPjmMb pic.twitter.com/Hp3NmDraGM";;;;"648927742650679296";https://twitter.com/mashable/status/648927742650679296
HuffPostBiz;2015-09-29 16:11;1;3;"Here's everything we know about the new Tesla Model X http://huff.to/1KPHPBc pic.twitter.com/T8OfxE1fdI";;;;"648998508721250304";https://twitter.com/HuffPostBiz/status/648998508721250304
intelligencer;2015-09-29 14:07;2;2;"How much better a parent will you be if you buy a new Tesla SUV? http://nym.ag/1VlLotP pic.twitter.com/qNfAtaJmUu";;;;"648967340357472258";https://twitter.com/intelligencer/status/648967340357472258
GarrettSmith;2015-09-29 14:04;5;1;"Musk Says Tesla Cars Will Go 620 Miles per Charge in 2 Years, Autonomous in 3 http://dlvr.it/CJKm4v # startups # techpic.twitter.com/3KxamWapyV";;;# #;"648966613144764416";https://twitter.com/GarrettSmith/status/648966613144764416
BloombergTV;2015-09-29 14:01;4;7;"The first of Tesla's Model X sport utility vehicles is about to be handed over http://bloom.bg/1KH2s5u pic.twitter.com/6vNANRiMce";;;;"648965835860668416";https://twitter.com/BloombergTV/status/648965835860668416
TeslaModelSNews;2015-09-29 12:53;3;1;"# Watch # Tesla # launch the # Model # Xhttp://www.marketwatch.com/News/Story/Story.aspx?guid=24204B26-66D9-11E5-B025-4C57C97BC15E&siteid=yhoof2 …";;;# # # # #;"648948672911179780";https://twitter.com/TeslaModelSNews/status/648948672911179780
IDGNow;2015-09-29 12:52;1;3;"Tesla deve lançar modo piloto automático nas próximas semanas http://bit.ly/1jvApNp pic.twitter.com/JnIhACWALD";;;;"648948406480732160";https://twitter.com/IDGNow/status/648948406480732160
grahamflanagan;2015-09-29 12:25;3;3;"This is what it's like inside Elon Musk's futuristic Tesla factory http://www.businessinsider.com/elon-musk-tesla-factory-2015-9 … @ justingmoser @ BI_Videopic.twitter.com/76j2H2hseX";;@ @;;"648941775244038145";https://twitter.com/grahamflanagan/status/648941775244038145
futureshift;2015-09-29 11:30;20;21;"Elon Musk: Tesla will have 745-mile range, fully autonomous vehicles by 2020 http://on.mash.to/1JAqF9B pic.twitter.com/7eI33uoLil";;;;"648927749097279490";https://twitter.com/futureshift/status/648927749097279490
brewhouse;2015-09-29 11:00;4;5;"Report: Tesla's Gigafactories could make $35K Model 3 feasible by 2020 http://mashable.com/2015/09/28/decreased-battery-costs-tesla-model-3/#_mOKDorkjqq7 …pic.twitter.com/dXzi0ufRTJ";;;#_mOKDorkjqq7;"648920233986560002";https://twitter.com/brewhouse/status/648920233986560002
TechCrunch;2015-09-29 10:51;174;153;"Elon Musk Says Tesla Cars Will Reach 620 Miles On A Single Charge “Within A Year Or Two,” Have Fully Auton... http://tcrn.ch/1O60PSJ";;;;"648918081943699456";https://twitter.com/TechCrunch/status/648918081943699456
MenzelZEL;2015-09-29 08:22;8;9;"Supertiming für # Tesla - auf dem Höhepunkt der VW-Krise kommt das neue SUV. http://www.handelsblatt.com/unternehmen/industrie/tesla-setzt-ein-zeichen-gegen-vw-und-co-model-x-feiert-premiere/12384008.html … # Handelsblatt";;;# #;"648880615232774144";https://twitter.com/MenzelZEL/status/648880615232774144
businessinsider;2015-09-29 07:24;26;32;"We took a tour of the factory where Tesla is building its new Model X SUV http://read.bi/1OE8GXy pic.twitter.com/jAuKMYW1zT";;;;"648865967309758466";https://twitter.com/businessinsider/status/648865967309758466
business;2015-09-29 06:30;33;31;"The first of Tesla's Model X sport utility vehicles is to be handed over http://bloom.bg/1KH2s5u pic.twitter.com/vyzHiXzucI";;;;"648852421242961920";https://twitter.com/business/status/648852421242961920
WSJ;2015-09-29 06:01;134;113;"Tesla prepares to launch the Model X electric SUV -Price tag: $132,000 -Reservations: 30,000 http://on.wsj.com/1MD3Ir0";;;;"648844937262407680";https://twitter.com/WSJ/status/648844937262407680
CKemfert;2015-09-29 05:31;4;4;"https://global.handelsblatt.com/edition/271/ressort/companies-markets/article/all-charged-up-in-berlin#.VgjyWymdwJY.twitter … Tesla:"German Car Companys Management too old school" nicht ganz falsch... @ handelsblatt";;@;#;"648837390505779200";https://twitter.com/CKemfert/status/648837390505779200
wiwo;2015-09-29 04:12;4;1;"# Tesla gegen Audi, BMW & Mercedes: @ elonmusk greift Autobauer an. Digitalpass-Kunden gratis http://bit.ly/1RdjuKZ pic.twitter.com/YFQrIgfCRT";;@;#;"648817514395398144";https://twitter.com/wiwo/status/648817514395398144
TheEconomist;2015-09-29 01:57;85;54;"From Espresso: Today Tesla unveils the Model X, its first electric SUV http://econ.st/1Fznvbx pic.twitter.com/z96K3rwxpH";;;;"648783608992411648";https://twitter.com/TheEconomist/status/648783608992411648
autobild;2015-09-29 00:42;1;3;"Tesla Model S P85D: Langstrecken-Test Wie weit kommt der Tesla Model S P85D? http://dlvr.it/CHzjKx pic.twitter.com/O9QPJwKNE1";;;;"648764802764947456";https://twitter.com/autobild/status/648764802764947456
businessinsider;2015-09-28 23:12;35;37;"Meet 'Iceman' and 'Wolverine' — the two coolest robots in Tesla's factory @ BI_Video http://read.bi/1MWETt9 pic.twitter.com/7lBGJbJTFs";;@;;"648742202710052864";https://twitter.com/businessinsider/status/648742202710052864
MarketWatch;2015-09-28 22:54;66;54;"Tesla’s Model X rolls out today! Here are 4 things to know about the much-awaited SUV http://on.mktw.net/1NS4Bxs $ TSLApic.twitter.com/yp8jlzFTGO";;;;"648737704943976448";https://twitter.com/MarketWatch/status/648737704943976448
TeslaClubEU;2015-09-28 22:08;3;3;"It's Game Over, Tesla Wins http://seekingalpha.com/article/3537486-its-game-over-tesla-wins … @TeslaMotors";;@TeslaMotors;;"648726112449773568";https://twitter.com/TeslaClubEU/status/648726112449773568
WSJTech;2015-09-28 18:49;34;23;"Tesla prepares to launch Model X electric SUV http://on.wsj.com/1JzmF9h";;;;"648675820563664900";https://twitter.com/WSJTech/status/648675820563664900
RT_com;2015-09-28 18:33;83;63;"Time’s up for fossil fuels – Tesla CEO Elon Musk on Volkswagen emissions scandal http://on.rt.com/6sha pic.twitter.com/MVhYGYyyWM";;;;"648671816119152640";https://twitter.com/RT_com/status/648671816119152640
ExpEconomia;2015-09-28 18:24;5;5;"Tesla lanzará el Modelo X, su todocamino eléctrico de lujo http://exp.mx/n006S5C";;;;"648669656358608896";https://twitter.com/ExpEconomia/status/648669656358608896
mashable;2015-09-28 18:15;80;79;"Tesla is 'totally cool' with other carmakers using its Supercharger network http://on.mash.to/1FEeqO5 pic.twitter.com/bdEMhqoNdu";;;;"648667297456984065";https://twitter.com/mashable/status/648667297456984065
Kubota_Yoko;2015-09-28 17:57;13;9;"Tesla and its new electric SUV: Model X http://on.wsj.com/1JzmF9h @ WSJさんから";;@;;"648662857526087680";https://twitter.com/Kubota_Yoko/status/648662857526087680
folha;2015-09-28 17:00;39;55;"Tesla abre fábrica na Europa com meta de 500 mil carros elétricos por ano: http://uol.com/bxgbCC pic.twitter.com/B0ythCNOI1";;;;"648648433226543104";https://twitter.com/folha/status/648648433226543104