username;date;retweets;favorites;text;geo;mentions;hashtags;id;permalink
zukunftmobil;2016-07-08 13:26;2;2;"Tesla: Bundesverkehrsministerium lässt Fahrassistenz-System hinsichtlich Konformität mit der Typgenehmigung prüfen - http://www.heise.de/newsticker/meldung/Tesla-Bundesverkehrsministerium-laesst-Fahrassistenz-System-pruefen-3262467.html …";;;;"751512792180686848";https://twitter.com/zukunftmobil/status/751512792180686848
welt;2016-07-08 11:44;3;3;"Kraftfahrt-Bundesamt ermittelt gegen Tesla http://to.welt.de/OwKsHU4 pic.twitter.com/uW6MAgaQx7";;;;"751487186109919233";https://twitter.com/welt/status/751487186109919233
Brinkbaeumer;2016-07-08 11:23;3;2;"Ermittlungen gegen # Tesla: Automatisch in den Tod http://spon.de/aeMRv  via @ SPIEGELONLINE @ DerSPIEGEL # SPIEGELplus";;@ @;# #;"751481804914356225";https://twitter.com/Brinkbaeumer/status/751481804914356225
faznet;2016-07-08 11:02;1;5;"Der Ärger mit autonom fahrenden Autos von Tesla nimmt kein Ende. Nun soll das Verkehrsministerium ermitteln. http://faz.net/-gqe-8j5po#GEPC;s30 …";;;#GEPC;"751476462125887490";https://twitter.com/faznet/status/751476462125887490
jensbest;2016-07-08 10:46;9;9;"Dobrindt: Durch Luftverschmutzung durch # VW-Betrug sind Zehntausende gestorben, aber wg 1 Toten jetzt # Tesla angehen http://www.golem.de/news/autopilot-verkehrsbehoerden-ermitteln-gegen-tesla-motors-1607-122019.html …";;;# #;"751472433362788352";https://twitter.com/jensbest/status/751472433362788352
phogenkamp;2016-07-08 09:47;3;10;"Die Tesla-Gegner wetzen die Messer. Diverse grobe sachliche Fehler schon in den ersten Absätzen. http://spon.de/aeMRv  via @ SPIEGELONLINE";;@;;"751457593940447233";https://twitter.com/phogenkamp/status/751457593940447233
FAZ_Wirtschaft;2016-07-08 03:19;1;0;"Der tödliche Unfall eines Tesla-Fahrers stört das Image der selbstfahrenden Autos. Zu Recht? http://www.faz.net/aktuell/wirtschaft/unternehmen/die-zukunft-des-autofahrens-14329517.html …";;;;"751360032156028928";https://twitter.com/FAZ_Wirtschaft/status/751360032156028928
jensbest;2016-07-08 09:21;7;5;"Wie durchschaubar: # Tesla wird wg. kleinstem Verdacht bedroht, aber beim # VW-Skandal bleiben Dobrindt-Behörden blindhttp://www.golem.de/news/autopilot-verkehrsbehoerden-ermitteln-gegen-tesla-motors-1607-122019.html …";;;# #;"751451085898977280";https://twitter.com/jensbest/status/751451085898977280
FAZ_NET;2016-07-08 03:19;0;0;"Der tödliche Unfall eines Tesla-Fahrers stört das Image der selbstfahrenden Autos. Zu Recht? http://www.faz.net/aktuell/wirtschaft/unternehmen/die-zukunft-des-autofahrens-14329517.html …";;;;"751360033154269184";https://twitter.com/FAZ_NET/status/751360033154269184
amsonline;2016-07-08 03:00;0;2;"# Tesla Model X-Unfall: Geschah der # Crash im Auto-Pilot-Modus? http://goo.gl/fb/nQVgiB # AMuS # autonomesfahrenpic.twitter.com/6hspCf9s3W";;;# # # #;"751355311819141120";https://twitter.com/amsonline/status/751355311819141120
GLobenberg;2016-07-08 01:46;2;1;"Ein Tesla als Taxi - Das gibt's nur einmal in Berlin http://www.morgenpost.de/207802249?__pwh=WzhF5nlUSoTgRWbsUJAmxg== … @ eMObilityBerlin";;@;;"751336661087289344";https://twitter.com/GLobenberg/status/751336661087289344
jhabringer;2016-07-08 01:44;2;0;"Erfolgreicher als Tesla: Batterieentwicklung in AUT http://bit.ly/29Daf91 # emobility";;;#;"751336094671704064";https://twitter.com/jhabringer/status/751336094671704064
ADAC;2016-07-08 01:19;3;0;"ADAC: # Tesla agiert bei # Autopilot "unverantwortlich" http://www.wiwo.de/13844280.html?share=twitter … via @ wiwo";;@;# #;"751329932106760192";https://twitter.com/ADAC/status/751329932106760192
mr_sisel;2016-07-07 18:26;0;0;"# Wirtschaft # News Tesla ist cool - und lebensgefährlich: Ja, das Unternehmen hat das E-Auto populärer gemacht... http://bit.ly/29xOAi3";;;# #;"751225860795932672";https://twitter.com/mr_sisel/status/751225860795932672
PittsburghPG;2016-07-07 17:27;2;1;"U.S. safety agency investigates Tesla crash on Pennsylvania Turnpike http://bit.ly/29s4yw9 pic.twitter.com/LduM3tuIyz";;;;"751211139606966272";https://twitter.com/PittsburghPG/status/751211139606966272
eshona;2016-07-07 17:21;0;2;"'Technology is, after all, becoming more fashionable' Nordstrom Tries A Tesla Showroom In Menswear -- via @ forbeshttp://www.forbes.com/sites/retailwire/2016/06/29/nordstrom-tries-a-tesla-showroom-in-menswear/#1a2d8435385e …";;@;#1a2d8435385e;"751209508450414593";https://twitter.com/eshona/status/751209508450414593
DonaldEtra;2016-07-07 17:18;0;1;"Second Possible Tesla Autopilot Crash Under Investigation via @ forbeshttp://www.forbes.com/sites/briansolomon/2016/07/06/second-possible-tesla-autopilot-crash-under-investigation/#449d626b1d3c …";;@;#449d626b1d3c;"751208906102173696";https://twitter.com/DonaldEtra/status/751208906102173696
matthewshirts;2016-07-07 17:14;2;3;"Why this "bloody" veggie burger may become the Tesla of food http://www.vox.com/2016/7/7/12106708/impossible-foods-ezra-klein-show?utm_campaign=vox&utm_content=article%3Atop&utm_medium=social&utm_source=twitter … via @ voxdotcom";;@;;"751207903818907649";https://twitter.com/matthewshirts/status/751207903818907649
ReutersTech;2016-07-07 17:10;1;1;"Laptop in wreckage of Tesla Autopilot car: Florida investigators http://reut.rs/29qpgy3 pic.twitter.com/AIQcqkCVb9";;;;"751206674153803781";https://twitter.com/ReutersTech/status/751206674153803781
TheMehulPatel;2016-07-07 17:06;8;0;"Three Reasons To Unload Tesla Stock: Tesla Motors -- in which I have no financial interest -- has a hug... http://bit.ly/29T868n # tech";;;#;"751205714731741185";https://twitter.com/TheMehulPatel/status/751205714731741185
MarkDHodgson;2016-07-07 17:05;0;1;"Just in: Lessons From Aviation For Tesla And Self-Driving Cars - Forbes: ForbesLessons From Aviatio... http://bit.ly/29m3m9k # Aviation";;;#;"751205411206733824";https://twitter.com/MarkDHodgson/status/751205411206733824
stevesurf;2016-07-07 17:02;0;0;"Sometimes you go with what works: # Tesla Model S with # Lidar spotted in Palo Alto # autonomousvehicleshttps://apple.news/Af-5dO2PgQXeea6mFrJ5R5g …";;;# # #;"751204774251405313";https://twitter.com/stevesurf/status/751204774251405313
CryptoGrain;2016-07-07 17:01;0;0;"Florida investigators found laptop in Tesla involved in fatal crash: http://reut.rs/29kzbE8 pic.twitter.com/4R2CdTgxKD";;;;"751204581284147200";https://twitter.com/CryptoGrain/status/751204581284147200
mysimplereader;2016-07-07 17:01;0;0;"Lessons From Aviation For Tesla And Self-Driving Cars - Forbes http://goo.gl/fb/nh36UR";;;;"751204558278369280";https://twitter.com/mysimplereader/status/751204558278369280