username;date;retweets;favorites;text;geo;mentions;hashtags;id;permalink
jamescovert1;2016-10-02 16:05;3;3;"Tesla surprises analysts with hottest sales quarter in history $ tsla # nyp http://nyp.st/2dKETy5  via @ nypost";;@;#;"782718127037640704";https://twitter.com/jamescovert1/status/782718127037640704
ForbesLife;2016-10-02 16:00;7;10;". @ Tesla's first Model S hearse will ensure that your last ride ever is emissions-free. http://on.forbes.com/6017Bhp5h pic.twitter.com/Qpn7QYVnrI";;@;;"782716800358375424";https://twitter.com/ForbesLife/status/782716800358375424
Reuters;2016-10-02 15:35;64;122;"Tesla posts 70 percent rise in quarterly deliveries, backs 2016 target http://reut.rs/2cL1Eoh pic.twitter.com/ePN3xeZ5vO";;;;"782710517311954944";https://twitter.com/Reuters/status/782710517311954944
business;2016-10-02 14:39;62;49;"Mercedes plans 10 electric cars to take on Tesla, under its new EQ brand http://bloom.bg/2cKYAbU pic.twitter.com/ojEc2RPiFc";;;;"782696551927967744";https://twitter.com/business/status/782696551927967744
MarketWatch;2016-10-02 14:05;28;27;"Tesla reports its best-ever quarterly vehicle sales: http://on.mktw.net/2dCeHVR";;;;"782687990250373120";https://twitter.com/MarketWatch/status/782687990250373120
weeklyascii;2016-10-02 14:03;8;7;"さくらが大量演算向け「高火力」サーバ正式提供開始、時間課金も ―最新「Tesla P100／P40」GPU搭載モデルの提供予定も発表 http://ascii.jp/elem/000/001/241/1241091/ …pic.twitter.com/wDURIuOkVl";;;;"782687526758731777";https://twitter.com/weeklyascii/status/782687526758731777
engadget;2016-10-02 14:02;30;46;"Tesla's electric car deliveries surge by 70 percent http://engt.co/2dzEL3j pic.twitter.com/DM910g3lGC";;;;"782687285980569600";https://twitter.com/engadget/status/782687285980569600
FinancialTimes;2016-10-02 13:56;35;31;"Tesla deliveries rise 70% in third quarter http://on.ft.com/2dzFm56";;;;"782685657156186112";https://twitter.com/FinancialTimes/status/782685657156186112
CNN;2016-10-02 13:44;187;402;"Tesla is selling twice as many cars as it was a year ago http://cnn.it/2dKw9rZ pic.twitter.com/6oDM7IQtYA";;;;"782682794526961664";https://twitter.com/CNN/status/782682794526961664
Blooweels;2016-10-02 13:27;4;6;"RT @ Twefan: Tesla delivers 24,500 vehicles in Q3, a 111% annual increase https://wp.me/p5hvhT-8GuY  by thekenyeung";;@;;"782678486724911104";https://twitter.com/Blooweels/status/782678486724911104
alanohnsman;2016-10-02 12:58;11;12;"Enough to get into the black? -- Tesla sees best-ever deliveries amid rocky third quarter via @ forbeshttp://www.forbes.com/sites/alanohnsman/2016/10/02/tesla-sees-best-ever-deliveries-amid-rocky-third-quarter/#59c3b58a5247 …";;@;#59c3b58a5247;"782671210391871489";https://twitter.com/alanohnsman/status/782671210391871489
eVehicle;2016-10-02 14:34;2;2;"Tesla's electric car deliveries surge by 70 percent - Engadget http://bit.ly/2dkcz6K";;;;"782695314285219842";https://twitter.com/eVehicle/status/782695314285219842
asciijpeditors;2016-10-02 14:03;7;10;"さくらが大量演算向け「高火力」サーバ正式提供開始、時間課金も ―最新「Tesla P100／P40」GPU搭載モデルの提供予定も発表 http://ascii.jp/elem/000/001/241/1241091/ …pic.twitter.com/8OcB25aqDF";;;;"782687507225862144";https://twitter.com/asciijpeditors/status/782687507225862144
TheFreshMoney;2016-10-02 13:59;4;9;"# Tesla reports its best-ever quarterly # car # sales. $ TSLAhttp://www.marketwatch.com/story/tesla-reports-its-best-ever-quarterly-vehicle-sales-2016-10-02 …";;;# # #;"782686477239001088";https://twitter.com/TheFreshMoney/status/782686477239001088
FT;2016-10-02 13:56;39;50;"Tesla deliveries rise 70% in third quarter http://on.ft.com/2dzDNnB";;;;"782685663200149505";https://twitter.com/FT/status/782685663200149505
ReutersBiz;2016-10-02 13:48;32;47;"Tesla posts 70 percent rise in quarterly deliveries, backs 2016 target http://reut.rs/2dRIEVr";;;;"782683821317754880";https://twitter.com/ReutersBiz/status/782683821317754880
cnni;2016-10-02 13:44;59;62;"Tesla is selling twice as many cars as it was a year ago http://cnn.it/2dKxAGO pic.twitter.com/KjDWDViihr";;;;"782682794615009281";https://twitter.com/cnni/status/782682794615009281
Le_Figaro;2016-10-02 13:34;4;7;"General Motors contre-attaque face à Tesla http://bit.ly/2d6mhYh pic.twitter.com/i3IdgWlim0";;;;"782680254284460032";https://twitter.com/Le_Figaro/status/782680254284460032
tchbytes;2016-10-02 13:28;3;2;"Tesla delivers 24,500 vehicles in Q3, a 111% annual increase http://ln.is/qGJvu  by @ thekenyeung by # VentureBeat via @ c0nvey";;@ @;#;"782678738676899840";https://twitter.com/tchbytes/status/782678738676899840
marshawright;2016-10-02 13:14;1;3;"Tesla Sees Best-Ever Deliveries Amid Rocky Third Quarter http://bit.ly/2dRFOQp # entrepreneur # startuppic.twitter.com/EEVImfbFiE";;;# #;"782675096309641216";https://twitter.com/marshawright/status/782675096309641216
Michael_Kunz;2016-10-02 04:57;0;0;"Unfall mit "Fahrassistent": Tesla fährt auf der Autobahn auf Bus auf - heise online http://www.heise.de/newsticker/meldung/Unfall-mit-Fahrassistent-Tesla-faehrt-auf-der-Autobahn-auf-Bus-auf-3337662.html …";;;;"782550140775239680";https://twitter.com/Michael_Kunz/status/782550140775239680
handelsblatt;2016-10-02 04:46;2;3;"Tesla-Fahrzeuge: Autopilotsystem trotz Unfällen weiterhin gefragt http://ow.ly/9OiH5052AKJ";;;;"782547344420118528";https://twitter.com/handelsblatt/status/782547344420118528
qz;2016-10-02 04:08;5;6;"Historically speaking, the Tesla deaths are not out of the norm http://qz.com/797738";;;;"782537823060684801";https://twitter.com/qz/status/782537823060684801
ActualidadRT;2016-10-01 23:37;24;36;"Mercedes estrena su Generation EQ, todoterreno eléctrico rival del Tesla (VIDEO) http://es.rt.com/4pw9 pic.twitter.com/wwTZaOJM7r";;;;"782469447709757440";https://twitter.com/ActualidadRT/status/782469447709757440
DriverlessNow;2016-10-01 19:42;7;4;"California’s proposed rules for driverless vehicles take aim at Tesla https://www.washingtonpost.com/local/trafficandcommuting/californias-proposed-rules-for-driverless-vehicles-take-aim-at-tesla/2016/10/01/b091d930-87df-11e6-92c2-14b64f3d453f_story.html … @ washingtonpost # driverless # Tesla";;@;# #;"782410402244112384";https://twitter.com/DriverlessNow/status/782410402244112384
VehementReports;2016-10-01 18:03;0;1;"Tesla 'on Autopilot' crashes into tourist bus in Germany http://www.cnbc.com/2016/09/29/tesla-crashes-into-tourist-bus-in-germany.html?utm_campaign=crowdfire&utm_content=crowdfire&utm_medium=social&utm_source=twitter …pic.twitter.com/BckB8W1PDt";;;;"782385371007025152";https://twitter.com/VehementReports/status/782385371007025152
snazzy_scott;2016-10-01 17:23;0;2;"Ooh Model Y # tesla # suvhttp://www.businessinsider.com/tesla-model-y-suv-2016-9?r=DE&IR=T …";;;# #;"782375351452217344";https://twitter.com/snazzy_scott/status/782375351452217344
comolohagoenint;2016-10-01 17:07;0;0;"GLM, el 'Tesla japonés', tiene un impresionante eléctrico llamado G4: Green Lord Motors, más conocida por s... http://engt.co/2dFbIjV";;;;"782371494051491840";https://twitter.com/comolohagoenint/status/782371494051491840
techbusy;2016-10-01 17:01;1;0;"This Tesla Model S hearse offers the dearly departed an emissions-free last ride http://on.forbes.com/6011BChxS pic.twitter.com/X40BSjuiP1";;;;"782370002938789888";https://twitter.com/techbusy/status/782370002938789888
PelaezAndino;2016-10-01 17:00;0;0;"Mercedes estrena su Generation EQ, rival del Tesla Model S (VIDEO) http://es.rt.com/4pw9 pic.twitter.com/3p0EHkPSUH";;;;"782369721442328577";https://twitter.com/PelaezAndino/status/782369721442328577