username;date;retweets;favorites;text;geo;mentions;hashtags;id;permalink
Inc;2017-05-31 16:32;74;107;"Apple's co-founder says Tesla is on the verge of a technological breakthrough @ wheresKRhttp://on.inc.com/2qBl4Pu";;@;;"870060333414658053";https://twitter.com/Inc/status/870060333414658053
ILCtsxv;2017-05-31 13:49;10;8;"# Tesla Is Doubling Its Global Charging Network Ahead Of # Model3 Rollout via @ forbeshttp://www.forbes.com/sites/alanohnsman/2017/04/24/tesla-is-doubling-its-global-charging-network-ahead-of-model-3-rollout/#154506fd74bf …";;@;# # #154506fd74bf;"870019481388564480";https://twitter.com/ILCtsxv/status/870019481388564480
BFMTV;2017-05-31 12:36;33;49;"Accord de Paris: le patron de Tesla lance un ultimatum à Trump http://ebx.sh/2qH6LrU pic.twitter.com/YlFhijT4gR";;;;"870000929470328832";https://twitter.com/BFMTV/status/870000929470328832
GlobalEcoGuy;2017-05-31 12:23;31;39;"Tesla, Apple, Dow and other major business leaders urge Trump to stay in Paris climate deal. Leaving is bad for US. https://www.bloomberg.com/politics/articles/2017-05-31/musk-leads-ceos-full-court-press-on-paris-as-trump-weighs-exit …";;;;"869997761143332864";https://twitter.com/GlobalEcoGuy/status/869997761143332864
KLSouth;2017-05-31 12:07;17;28;"Tesla CEO threatens to quit # Trump biz council if US leaves Paris deal.. Oh okay. Good bye.http://thehill.com/policy/technology/335798-musk-i-will-drop-out-of-white-house-councils-if-trump-leaves-the-paris#.WS8UXI351tw.twitter …";;;# #;"869993741334990848";https://twitter.com/KLSouth/status/869993741334990848
ChristopherNFox;2017-05-31 11:54;12;21;"Tesla CEO Elon Musk just said he would quit Trump's advisory councils if US quits # ParisAgreementhttp://read.bi/2rbUvTF";;;#;"869990609490239488";https://twitter.com/ChristopherNFox/status/869990609490239488
Energiewende1;2017-05-31 11:36;0;0;"One more thing Diesemal vielleicht nicht von Apple sondern von Tesla... http://fb.me/1WbSb9Q1q";;;;"869985852889473024";https://twitter.com/Energiewende1/status/869985852889473024
Inc;2017-05-31 10:10;33;62;"Apple co-founder Steve Wozniak: The next big tech breakthrough will come from Tesla @ wheresKRhttp://on.inc.com/2qBkuRI";;@;;"869964224474345472";https://twitter.com/Inc/status/869964224474345472
EdmundKorres;2017-05-31 09:54;1;0;"Faraday Future in Schwierigkeiten: Tesla-Rivale braucht eine Milliarde Dollar http://t3n.de/news/faraday-future-tesla-rivale-826452/ …";;;;"869960162680942605";https://twitter.com/EdmundKorres/status/869960162680942605
ClimateReality;2017-05-31 09:37;15;25;"“Move Over Tesla, Europe's Building Its Own Battery Gigafactories” https://bloom.bg/2rxKyRp # ClimateHope";;;#;"869955886273495040";https://twitter.com/ClimateReality/status/869955886273495040
businessinsider;2017-05-31 09:24;23;43;"Morgan Stanley thinks Tesla is morphing into an entirely new kind of company http://read.bi/2qGczC8 pic.twitter.com/iVDbXgzOgq";;;;"869952737374556160";https://twitter.com/businessinsider/status/869952737374556160
morgenpost;2017-05-31 07:09;2;1;"Auf A12 gestoppt: Tesla geklaut und zerlegt: Polizei stoppt Transporter http://dlvr.it/PHQyNZ pic.twitter.com/h8I6cOuTeu";;;;"869918821414453248";https://twitter.com/morgenpost/status/869918821414453248
aktionaer;2017-05-31 06:59;0;0;"Forbes nennt 4 Gründe wieso Tesla mehr wert ist als Ford. Darunter die frische Marke und innovative Software-Update http://tiny.li/rTje pic.twitter.com/LGxBfmakf8";;;;"869916202101035008";https://twitter.com/aktionaer/status/869916202101035008
TeslaFlying;2017-05-31 00:19;0;0;"Retweeted Tesla Fan ( @ Teslafenn): Neue # Batterie Fabrik in Deutschland http://t3n.de/news/terrae-gigafactory-deutschland-826726/ … http://fb.me/8LfTldPKD";;@;#;"869815459243339776";https://twitter.com/TeslaFlying/status/869815459243339776
LirimRoci;2017-05-30 23:41;0;0;"Marktdominanz: Tesla zeigt Mercedes, BMW und Porsche nur die Rücklichter 29.05.2017 | http://finanzen.net  http://www.finanzen.net/nachricht/aktien/marktdominanz-tesla-zeigt-mercedes-bmw-und-porsche-nur-die-ruecklichter-5501297 …";;;;"869806053491445760";https://twitter.com/LirimRoci/status/869806053491445760
ClimateCentral;2017-05-30 22:20;34;27;"Will electric cars soon have solar roofs? Toyota and Tesla say yes http://buff.ly/2qvu24U  via @ thinkprogresspic.twitter.com/hupL2WROGW";;@;;"869785558637322240";https://twitter.com/ClimateCentral/status/869785558637322240
markusjennissen;2017-05-30 21:25;0;0;"Meedia: Apple-Mitgründer Steve Wozniak: Das nächste große Ding kommt von Tesla – nicht vom iKonzern. http://meedia.de/2017/05/29/apple-mitgruender-steve-wozniak-das-naechste-grosse-ding-kommt-von-tesla-nicht-vom-ikonzern/ …";;;;"869771890159702016";https://twitter.com/markusjennissen/status/869771890159702016
technology;2017-05-30 19:43;16;15;"Tesla’s solar roof sets Musk’s grand unification into motion https://bloom.bg/2rigarL pic.twitter.com/lQQF5NpiPZ";;;;"869746132188049409";https://twitter.com/technology/status/869746132188049409
clevelanddotcom;2017-05-31 16:02;5;9;"Tesla CEO Elon Musk said he would leave Trump's advisory councils if US withdrew from the Paris Agreement (via BI) http://trib.al/YJM909r";;;;"870052793415020544";https://twitter.com/clevelanddotcom/status/870052793415020544
citizensclimate;2017-05-31 14:24;21;20;"Tesla CEO @ elonmusk threatens to quit Trump biz council if US leaves Paris deal http://buff.ly/2rcouuI # climatepic.twitter.com/nkg6domp4y";;@;#;"870028344716349442";https://twitter.com/citizensclimate/status/870028344716349442
RaquelSansDuran;2017-05-31 13:12;10;9;"El CEO de Tesla i SpaceX amenaça d'abandonar el consell d'assessors de Trump si surt de l'acord climàtic de París. http://cnb.cx/2seCOkQ";;;;"870010062009282561";https://twitter.com/RaquelSansDuran/status/870010062009282561
bfmbusiness;2017-05-31 12:31;27;26;"Accord de Paris: le patron de Tesla lance un ultimatum à Trump http://ebx.sh/2qHbmuc pic.twitter.com/YCn4eJIWB5";;;;"869999698245038080";https://twitter.com/bfmbusiness/status/869999698245038080
SocialMedia411;2017-05-31 12:25;5;2;"Tesla CEO Elon Musk will leave Trump councils if U.S. withdraws from Paris agreement http://ow.ly/36IF30ccttG";;;;"869998180707860481";https://twitter.com/SocialMedia411/status/869998180707860481
ZanderKelly30;2017-05-31 12:24;11;7;"Tesla CEO Prepares To Take Drastic Measures If Trump Leaves Paris Climate Deal http://dailycaller.com/2017/05/31/tesla-ceo-prepares-to-take-drastic-measures-if-trump-leaves-paris-climate-deal/ … via @ dailycaller";;@;;"869997938495242240";https://twitter.com/ZanderKelly30/status/869997938495242240
jendlouhyhc;2017-05-31 12:01;8;4;"Tesla's Elon Musk threatens to stop advising White House if Trump pulls U.S. out of the Paris climate accord: https://bloom.bg/2snAlEb pic.twitter.com/vLoty45fnC";;;;"869992156089503744";https://twitter.com/jendlouhyhc/status/869992156089503744
solar2thepeople;2017-05-31 10:05;5;7;"New solar partners to compete with Tesla in home energy. @ RobertoFerris # solar # renewableshttp://cnb.cx/2ruPsvQ";;@;# #;"869962975662137345";https://twitter.com/solar2thepeople/status/869962975662137345
businessinsider;2017-05-31 09:35;3;10;"There's one question anyone interested in owning Tesla should ask themselves http://read.bi/2qGsVe1 pic.twitter.com/ddBrcdGl4Y";;;;"869955511973793792";https://twitter.com/businessinsider/status/869955511973793792
SAI;2017-05-31 09:24;9;10;"Morgan Stanley thinks Tesla is morphing into an entirely new kind of company http://read.bi/2qGczC8 pic.twitter.com/TX7vpujycR";;;;"869952752721563649";https://twitter.com/SAI/status/869952752721563649
robmccargow;2017-05-31 07:45;13;12;"# Tesla is pushing the # insurance industry to prepare for massive # disruption http://uk.businessinsider.com/how-tesla-self-driving-cars-are-changing-insurance-industry-2017-5 … # InsurTechpic.twitter.com/5kBU0sJkNf";;;# # # #;"869927712298856448";https://twitter.com/robmccargow/status/869927712298856448
ForbesInvestor;2017-05-31 07:31;1;4;"Why is Tesla Motors, which has a tiny fraction of Ford's sales volume, worth more than Ford? http://on.forbes.com/60158Yr1F pic.twitter.com/5war3JADep";;;;"869924179512090624";https://twitter.com/ForbesInvestor/status/869924179512090624
marshawright;2017-05-31 06:39;4;4;"4 Reasons Why Tesla Is Worth More Than Ford http://bit.ly/2qAdSXT  via @ forbes # startup # entrepreneurpic.twitter.com/YCM9C7C07j";;@;# #;"869911148266758144";https://twitter.com/marshawright/status/869911148266758144
SpireworksCo;2017-05-31 02:50;6;3;"Tesla’s former Autopilot head is launching a self-driving-car company — and it could have a big advantage http://ow.ly/DhLr30c9Fpi";;;;"869853500284579840";https://twitter.com/SpireworksCo/status/869853500284579840
technik_jetzt;2017-05-30 23:20;0;0;"Faraday Future in Schwierigkeiten: # Tesla-Rivale braucht eine Milliarde Dollar https://goo.gl/6SHgkk pic.twitter.com/lcXvQRyfxb";;;#;"869800770941702144";https://twitter.com/technik_jetzt/status/869800770941702144
CaraFnParrish;2017-05-30 21:07;4;9;"# Tesla opens preorders for # Solar Roofs, installations start this June in California http://crwd.fr/2pDiWpP pic.twitter.com/xJ4X3JLsul";;;# #;"869767151267328000";https://twitter.com/CaraFnParrish/status/869767151267328000
MetalikCV;2017-05-30 20:51;0;0;"Steve Wozniak Jagokan Tesla Ketimbang Apple: Steve Wozniak memang dikenal terbuka dan tidak… https://goo.gl/fb/eLvHfs";;;;"869763195971526657";https://twitter.com/MetalikCV/status/869763195971526657
nickgerhart;2017-05-30 20:44;0;0;"Tesla owners filed class action lawsuit about Autopilot 2 capabilities - Business Insider http://www.businessinsider.com/tesla-class-action-lawsuit-autopilot-2-2017-4 …";;;;"869761377627496448";https://twitter.com/nickgerhart/status/869761377627496448
FerrariCarsNews;2017-05-30 20:11;0;0;"What Ferrari And Tesla Tell Us About The Winning Formula For Stocks. http://bit.ly/2rijV0l";;;;"869753280695545857";https://twitter.com/FerrariCarsNews/status/869753280695545857
PiggyBankPeople;2017-05-30 19:46;0;0;"Tesla workers were seriously hurt more than twice as often as industry average http://bit.ly/2rhOLGv pic.twitter.com/IQf5uBeq5F";;;;"869746950014459906";https://twitter.com/PiggyBankPeople/status/869746950014459906
simplisticpro;2017-05-30 19:46;0;0;"technology: Tesla’s solar roof sets Musk’s grand unification into motion https://bloom.bg/2rigarL pic.twitter.com/Kl2ZuxVvsY";;;;"869746823501578241";https://twitter.com/simplisticpro/status/869746823501578241
MrVinLee;2017-05-30 19:45;0;0;"Beverly Hills Sports Car: Tesla New Interior, yes or no? https://lnkd.in/eSBcKEh";;;;"869746516205780992";https://twitter.com/MrVinLee/status/869746516205780992
Zicutake;2017-05-30 19:43;0;0;"[http://USAcomment.com ] Woz thinks the next big innovation will come from Tesla, not Apple https://goo.gl/fb/wK5Hai";;;;"869746075170734080";https://twitter.com/Zicutake/status/869746075170734080
JosBullock;2017-05-30 19:10;1;0;"# Battery # Gigafactory: Global capacity to double by 2021 and slash costs # Tesla # Daimler # Cleantech # Futurehttp://ow.ly/kJcy30c6Hyt";;;# # # # # #;"869737726630920192";https://twitter.com/JosBullock/status/869737726630920192
TeslaCarGuy;2017-05-30 18:24;0;0;"Tesla Should Applaud This Extreme 1100 Horsepower Hybrid Mercedes Coming Very Soon - http://TheStreet.com http://dlvr.it/PHBB1P";;;;"869726267116896256";https://twitter.com/TeslaCarGuy/status/869726267116896256
technology;2017-05-30 18:20;1;3;"Tesla is missing out on the American SUV craze https://bloom.bg/2qxKcdR pic.twitter.com/le3Qq3nrCf";;;;"869725362363785216";https://twitter.com/technology/status/869725362363785216
malevolodoctor;2017-05-30 18:00;0;0;"El equipo sigue funcionando con exempleados en su mayoría de Google, Apple y Tesla http://ow.ly/r8Kk30caNb5";;;;"869720166342565889";https://twitter.com/malevolodoctor/status/869720166342565889
SoLaTiDoBlades;2017-05-30 17:59;0;1;"Safety report says Tesla's injury rate is double the industry average http://dailym.ai/2rXLifd  via @ MailOnline";;@;;"869719986746425344";https://twitter.com/SoLaTiDoBlades/status/869719986746425344
jenrhelms;2017-05-30 17:48;0;0;"Hmm @Famanjo not seeing the trend. Tesla not still a startup, doesn't fit as example. - The Rise of the Fat Start-Up https://nyti.ms/2qVjbQx";;@Famanjo;;"869717145491357697";https://twitter.com/jenrhelms/status/869717145491357697
Deepakaraj;2017-05-30 17:20;0;0;"Woz: Tesla, not Apple, will have the next tech moonshot - Commentary: Apple co-founder says he's betting on Tes... http://ow.ly/9Dkf50bPQ3d";;;;"869710038486700033";https://twitter.com/Deepakaraj/status/869710038486700033
Yaerospace;2017-05-30 17:15;0;0;"Tesla Wants You to Know Its Model 3 Isn’t as Good as the Model S : http://fat.ly/L4jz";;;;"869708838437396480";https://twitter.com/Yaerospace/status/869708838437396480
nivcalderon;2017-05-30 17:09;0;0;"Aurora Innovation self-driving-car company to rival Tesla, Google - Business Insider http://uk.businessinsider.com/aurora-innovation-self-driving-car-company-rival-tesla-google-2017-5 … # autonomouscar";;;#;"869707468598849537";https://twitter.com/nivcalderon/status/869707468598849537