username;date;retweets;favorites;text;geo;mentions;hashtags;id;permalink
autselfadvocacy;2016-04-12 16:30;23;22;"Apple promotes Autism Acceptance in new videos focusing on non-speaking teen Dillan # AcceptAllOfUshttp://owl.li/10uoYP";;;#;"720031471302504448";https://twitter.com/autselfadvocacy/status/720031471302504448
bbcmundo;2016-04-12 16:10;41;46;"Las 10 apps fundamentales que todos deberíamos tener en el celular, según Apple http://bbc.in/1Sdv2lU pic.twitter.com/RZFlmnEhtD";;;;"720026290980548608";https://twitter.com/bbcmundo/status/720026290980548608
sasakitoshinao;2016-04-12 16:02;44;61;"今年秋にもアップルのモバイル決済が日本上陸という噂。訪日観光客のニーズに合わせて普及する可能性はあるかも。／Apple Payの日本国内上陸は'16年9～10月か、関係各所の動きを読む http://engt.co/1S35GSj";;;;"720024198031216640";https://twitter.com/sasakitoshinao/status/720024198031216640
summersmela;2016-04-12 15:54;0;0;"Apple-Streit mit FBI: Gericht verdonnert iPhone-Hersteller dazu der Polizei zu helfen - Smartphones | STERN.de http://www.stern.de/digital/smartphones/apple-streit-mit-fbi--gericht-verdonnert-iphone-hersteller-dazu-der-polizei-zu-helfen-6787518.html …";;;;"720022189047554048";https://twitter.com/summersmela/status/720022189047554048
WSJ;2016-04-12 15:47;31;42;"Goldman isn’t worried about Apple’s decline in iPhone sales http://on.wsj.com/1oV9zR1";;;;"720020441998434304";https://twitter.com/WSJ/status/720020441998434304
gizmodojapan;2016-04-12 15:37;18;34;"「Apple Watch 2」は内部アップグレードにとどまり、2017年に大幅デザイン変更？ http://bit.ly/1S8AqUl pic.twitter.com/hMh9ei0Fs8";;;;"720018012074598400";https://twitter.com/gizmodojapan/status/720018012074598400
TheNextWeb;2016-04-12 15:16;24;10;"Apple pulls third-party Reddit apps, causing more problems than it solves http://tnw.me/I4TD8Lf pic.twitter.com/2uZG7zf1wB";;;;"720012644049108992";https://twitter.com/TheNextWeb/status/720012644049108992
Forbes;2016-04-12 14:31;18;31;"Why one of 2016's best large-cap funds finally bought Apple shares http://onforb.es/1MrZiau";;;;"720001294551937026";https://twitter.com/Forbes/status/720001294551937026
el_pais;2016-04-12 14:15;57;49;"Adiós al jack de auriculares http://ow.ly/10yptH  La apuesta de Apple con el # iPhone7. Aquí las claves del nuevo móvil";;;#;"719997313385644032";https://twitter.com/el_pais/status/719997313385644032
businessinsider;2016-04-12 13:50;16;19;"The Apple Watch is winning in the battle of fitness trackers http://read.bi/1VkxN5j pic.twitter.com/YR9Ok5CjPN";;;;"719991072835944448";https://twitter.com/businessinsider/status/719991072835944448
nypost;2016-04-12 13:35;27;17;"67% of men in the Big Apple have facial hair http://nyp.st/1NmPn0C";;;;"719987250914816000";https://twitter.com/nypost/status/719987250914816000
THR;2016-04-12 13:05;4;14;"Does the Big Apple win the L.A. vs. N.Y. food debate? @ MVoltaggio weighs in on pros and cons http://thr.cm/tCqrLW pic.twitter.com/YXP1PjqEBQ";;@;;"719979671098671104";https://twitter.com/THR/status/719979671098671104
TIME;2016-04-12 12:37;50;70;"Facebook, Microsoft, Apple say they offer equal pay http://ti.me/1TPmT6u";;;;"719972619399917569";https://twitter.com/TIME/status/719972619399917569
samwhiteout;2016-04-12 11:05;46;101;"Who tryna split a Apple Music family plan? http://bzfd.it/1Q502Nn";;;;"719949557732401152";https://twitter.com/samwhiteout/status/719949557732401152
eSentire;2016-04-12 16:50;8;7;"Forget Apple vs. the FBI: WhatsApp Just Switched on Encryption for a Billion People - http://ow.ly/10yco8 # security # infosec";;;# #;"720036351954001920";https://twitter.com/eSentire/status/720036351954001920
dmorenochavez;2016-04-12 16:06;4;3;"Les voy a copiar: 7 preguntas extrañas en entrevistas de trabajo de Google, Apple y otros gigantes tecnológicos http://www.animalpolitico.com/2016/04/7-preguntas-extranas-en-entrevistas-de-trabajo-de-google-apple-y-otros-gigantes-tecnologicos/ …";;;;"720025390899593220";https://twitter.com/dmorenochavez/status/720025390899593220
Pajaropolitico;2016-04-12 16:04;9;14;"Si quieres trabajar en @ google Apple, @ Microsoft o @ Dropbox debes contestar alguna de estas 7 raras preguntashttp://bit.ly/1Xu19Mm";;@ @ @;;"720024759765831680";https://twitter.com/Pajaropolitico/status/720024759765831680
Ian_Worrell;2016-04-12 16:02;3;3;"Justice Department keeps pushing Apple to unlock iPhone in New York drug case http://tcrn.ch/1MkvcFF # Entrepreneur # startup # tech";;;# # #;"720024221959761920";https://twitter.com/Ian_Worrell/status/720024221959761920
xdotai;2016-04-12 15:01;9;5;"Why Apple and Google should be worried about Facebook’s new bots store by @ lizzadwoskin https://www.washingtonpost.com/news/the-switch/wp/2016/04/12/why-apple-and-google-should-be-worried-about-facebooks-new-bots-store/ …pic.twitter.com/5Oqhx2stCR";;@;;"720008856991088640";https://twitter.com/xdotai/status/720008856991088640
bbcmundo;2016-04-12 14:33;51;53;"Las 10 apps fundamentales que todos deberíamos tener en el celular, según Apple http://bbc.in/1SwDtCT pic.twitter.com/IRgUg5xuwN";;;;"720001825852825600";https://twitter.com/bbcmundo/status/720001825852825600
Appleshare3;2016-04-12 13:57;4;9;"Why Drake's 'Views From The 6' Is Coming Out On Apple Music - Forbes http://dlvr.it/L2dzGH";;;;"719992772745256960";https://twitter.com/Appleshare3/status/719992772745256960
SAI;2016-04-12 13:50;12;7;"The Apple Watch is winning in the battle of fitness trackers http://read.bi/1VkxN5j pic.twitter.com/RQDNSInuGy";;;;"719991075893547010";https://twitter.com/SAI/status/719991075893547010
ABCPolitics;2016-04-12 12:49;15;11;". @ SpeakerRyan says ruling out 2016 bid not a repeat of Speaker process: "Apples and oranges" http://abcn.ws/1SLkYe7 http://snpy.tv/1qmNhss";;@;;"719975671053688832";https://twitter.com/ABCPolitics/status/719975671053688832
jmarc;2016-04-12 12:35;3;5;"Reportage : Apple craque pour l'enceinte 100 % française de @ DEVIALET http://culturebox.francetvinfo.fr/musique/apple-craque-pour-l-enceinte-100-francaise-de-devialet-237669 … via @ Culturebox # MadeInFrance # frenchtech";;@ @;# #;"719972177039257600";https://twitter.com/jmarc/status/719972177039257600
TechBhurji;2016-04-12 12:23;4;9;"@ counternotions @ asymco @ benthompson Apple offers iPhone SE rentals for Rs999 ($16.65)/month in India. http://timesofindia.indiatimes.com/tech/tech-news/Find-Apple-iPhone-SE-expensive-Rent-it-Rs-999-a-month/articleshow/51792685.cms …";;@ @ @;;"719969131487830016";https://twitter.com/TechBhurji/status/719969131487830016
CNBC;2016-04-12 11:45;6;13;"Goldman bullish on Apple iPhone 7 demand http://cnb.cx/23rFtaQ pic.twitter.com/K4gUaRtMZ7";;;;"719959577236742144";https://twitter.com/CNBC/status/719959577236742144
tangopublishing;2016-04-12 11:40;0;1;"Warum startet die # Apple Watch nicht durch? Marktforscher schätzen, dass in den letzten zwölf Monaten 75... http://fb.me/7NSqieVNf";;;#;"719958314830983168";https://twitter.com/tangopublishing/status/719958314830983168
FastCompany;2016-04-12 10:50;16;17;"Apple and Google better get ready for the coming bot wars http://buff.ly/1qGnSub";;;;"719945768711364608";https://twitter.com/FastCompany/status/719945768711364608
engadget;2016-04-12 10:49;66;57;"In an Android first, the @ HTC 10 will support Apple AirPlay streaming http://engt.co/1SwDmHp pic.twitter.com/J4knnSZFWP";;@;;"719945515157299201";https://twitter.com/engadget/status/719945515157299201
WSJMoneyBeat;2016-04-12 10:22;25;27;"Goldman Sachs isn't worried about Apple's decline in iPhone sales http://on.wsj.com/20yO2LL";;;;"719938863888744449";https://twitter.com/WSJMoneyBeat/status/719938863888744449
ForbesTech;2016-04-12 09:41;38;35;"This Apple iOS 9.3.1 secret feature is actually a handy bug in the software: http://onforb.es/1NmM9KG pic.twitter.com/1ifW7It6xC";;;;"719928318775148545";https://twitter.com/ForbesTech/status/719928318775148545
BuzzFeed;2016-04-12 08:38;175;487;"Google and Apple, we need to talk about your emojis http://bzfd.it/23rN756 pic.twitter.com/kWyZXDb0IE";;;;"719912486942613505";https://twitter.com/BuzzFeed/status/719912486942613505
bbcmundo;2016-04-12 08:36;30;52;"Las 10 apps fundamentales que todos deberíamos tener en el celular, según Apple http://bbc.in/1SvBQoW pic.twitter.com/1MyRALZ9cw";;;;"719911971177566208";https://twitter.com/bbcmundo/status/719911971177566208
businessinsider;2016-04-12 08:31;9;11;"The Apple Watch is a smash hit — in this one field http://read.bi/1qm5ztN pic.twitter.com/uY3Pj6Pvzp";;;;"719910834445660161";https://twitter.com/businessinsider/status/719910834445660161
mashable;2016-04-12 08:14;23;49;"Nick Jonas, Chloe Sevigny embrace Apple Watch in new ads: http://on.mash.to/1SwpSLG pic.twitter.com/TlbIZ5mcsE";;;;"719906627097391104";https://twitter.com/mashable/status/719906627097391104
KOMPAKT_APP;2016-04-12 07:52;1;1;"Und du dachtest, Apple fällt eh nichts mehr ein. http://ift.tt/1qlZzkW pic.twitter.com/UzBTcqUtYz";;;;"719900954729046016";https://twitter.com/KOMPAKT_APP/status/719900954729046016
mac_and_i;2016-04-12 07:41;7;3;"iPhone-Entsperr-Tool: Apple plant wohl keine Klage auf Herausgabe http://www.heise.de/mac-and-i/meldung/iPhone-Entsperr-Tool-Apple-plant-wohl-keine-Klage-auf-Herausgabe-3171022.html … # FBI # iPhone";;;# #;"719898165143543808";https://twitter.com/mac_and_i/status/719898165143543808
BuzzFeed;2016-04-12 07:28;189;568;"Drake’s new album will only be exclusive to Apple Music for the first week http://bzfd.it/1MrHaxv pic.twitter.com/nqqi16iWjq";;;;"719894865333489665";https://twitter.com/BuzzFeed/status/719894865333489665
mac_and_i;2016-04-12 05:51;3;5;"Deutlicher Rückgang bei Apple-Watch-Verkäufen prognostiziert http://www.heise.de/mac-and-i/meldung/Deutlicher-Rueckgang-bei-Apple-Watch-Verkaeufen-prognostiziert-3170089.html … # AppleWatch # Smartwatch";;;# #;"719870461312659457";https://twitter.com/mac_and_i/status/719870461312659457
schlagzeilen;2016-04-12 03:21;0;0;"heise: Wegen NSFW: Apple wirft unabhängige Reddit-Clients aus dem App Store http://bit.ly/1oTlrD8";;;;"719832830759407616";https://twitter.com/schlagzeilen/status/719832830759407616
ntvde;2016-04-12 03:18;9;7;"Düsterer Ausblick auf 2016: Apple Watch wird zum Ladenhüter http://n-tv.io/L2Pw6w pic.twitter.com/OkWLpnArD4";;;;"719832006247317504";https://twitter.com/ntvde/status/719832006247317504
mac_and_i;2016-04-12 02:06;8;2;"Wegen NSFW: Apple wirft unabhängige Reddit-Clients aus dem App Store http://www.heise.de/mac-and-i/meldung/Wegen-NSFW-Apple-wirft-unabhaengige-Reddit-Clients-aus-dem-App-Store-3168219.html … # Reddit # iOS";;;# #;"719813848472109056";https://twitter.com/mac_and_i/status/719813848472109056
ABC;2016-04-12 01:12;45;46;"Apple's latest patent filing re-imagines what the keyboard of the future might look like. http://abcn.ws/1S1W4Y1 pic.twitter.com/7eTDe1mKii";;;;"719800365613477888";https://twitter.com/ABC/status/719800365613477888
hdbaumeister;2016-04-12 00:37;0;0;"Langzeittest: Die Apple Watch lügt! - http://www.wiwo.de/11956890.html";;;;"719791659601567744";https://twitter.com/hdbaumeister/status/719791659601567744
CNET;2016-04-12 00:25;37;46;"Apple enjoys sudden YouTube love for Cookie Monster, releases outtakes http://cnet.co/1TOh4WZ pic.twitter.com/K5dkR69rxa";;;;"719788466926665728";https://twitter.com/CNET/status/719788466926665728
01net;2016-04-12 00:19;12;16;"Test : Apple iPad Pro 9,7 pouces, sans aucun doute l'une des meilleures tablettes. http://www.01net.com/fiche-produit/prise-main-24434/tablettes-apple-ipad-pro-9-7-256-go-wi-fi-plus-4g/ …pic.twitter.com/XMPAKAI1Tv";;;;"719786960362070016";https://twitter.com/01net/status/719786960362070016
wired_jp;2016-04-11 23:58;81;153;"Apple IからiPhone SEまで。アップルの歴代の製品を、すべて1枚に収めたインフォグラフィックが登場した。 http://wired.jp/2016/04/11/apples-products-ever-one-glorious-infographic/ …pic.twitter.com/G40UHLK8lV";;;;"719781743201529856";https://twitter.com/wired_jp/status/719781743201529856
TheNextWeb;2016-04-11 23:48;20;10;"Apple pulls third-party Reddit apps, causing more problems than it solves http://tnw.me/9efujFC pic.twitter.com/DQ3j2ngqQH";;;;"719779308944957440";https://twitter.com/TheNextWeb/status/719779308944957440
Inc;2016-04-11 23:48;18;7;"Stick a fork in the Apple Watch, it's done @ jmbrandonbbhttp://bit.ly/22pMbIE";;@;;"719779215009267712";https://twitter.com/Inc/status/719779215009267712
gigazine;2016-04-11 23:00;16;41;"Apple Watchをどういうシチュエーションで使えばいいのかよくわかるムービーシリーズをAppleが一斉公開 http://bit.ly/1NlV1A5 pic.twitter.com/bEhwiCbfQe";;;;"719767019093041152";https://twitter.com/gigazine/status/719767019093041152
cnet_japan;2016-04-11 22:47;7;19;"Appleファンならマストバイの歴代全製品ポスター発売--「Newton」「Lisa」も掲載 http://japan.cnet.com/news/service/35081031/ …";;;;"719763737679257600";https://twitter.com/cnet_japan/status/719763737679257600
ForbesTech;2016-04-11 22:30;25;16;"Apple hopes to capture a bit more Muppet magic with a behind the scenes look at Cookie Monster’s Siri-loving ads: http://onforb.es/1RP6e1D";;;;"719759451096510464";https://twitter.com/ForbesTech/status/719759451096510464
bbcmundo;2016-04-11 21:18;54;62;"Las 10 apps fundamentales que todos deberíamos tener en el celular, según Apple http://bbc.in/1oStUqc";;;;"719741453178642433";https://twitter.com/bbcmundo/status/719741453178642433
rockinon_com;2016-04-11 20:40;30;131;"「音楽をやっててよかった」――Mrs. GREEN APPLE、ツアーファイナルで思いっきりポップに弾ける！ - 邦楽ニュース http://ro69.jp/news/detail/141608?rtw …pic.twitter.com/twkvRVeAqV";;;;"719731777879715840";https://twitter.com/rockinon_com/status/719731777879715840
CNBC;2016-04-11 20:30;26;14;"Apple Watch shipments to fall by 25%: Report http://cnb.cx/23pnodv pic.twitter.com/dESPaJGDy9";;;;"719729323360579585";https://twitter.com/CNBC/status/719729323360579585
ForbesTech;2016-04-11 20:30;34;29;"The iPhone SE is a win for consumers, but a fail for Apple http://onforb.es/1RPHjej pic.twitter.com/CiFU3mg9eE";;;;"719729255001825280";https://twitter.com/ForbesTech/status/719729255001825280
Pajaropolitico;2016-04-11 20:22;14;34;"Según Apple, estas son las mejores apps para mantener seguros tus passwords, cazar descuentos y tomar mejores fotos http://bit.ly/1ScjkrC";;;;"719727244747223040";https://twitter.com/Pajaropolitico/status/719727244747223040
TIME;2016-04-11 20:00;40;73;"The 7 best Apple Watch apps right now http://ti.me/1qECfPI";;;;"719721724888117249";https://twitter.com/TIME/status/719721724888117249
el_pais;2016-04-11 19:30;44;40;"Adiós al jack de auriculares http://ow.ly/10yptH  La apuesta de Apple con el # iPhone7. Aquí las claves del nuevo móvil";;;#;"719714199866327042";https://twitter.com/el_pais/status/719714199866327042
Forbes;2016-04-11 19:21;101;153;"The new Apple Stores won't have a branded exterior: http://onforb.es/1Q3g7D9 pic.twitter.com/9NFtC7GWMH";;;;"719711890969128960";https://twitter.com/Forbes/status/719711890969128960
Newsweek;2016-04-11 19:15;26;25;"In a survey, more than half of Americans agreed that the Apple Watch is a dud http://bit.ly/23yIumh pic.twitter.com/xQJk0wJvse";;;;"719710384291053568";https://twitter.com/Newsweek/status/719710384291053568
JimPethokoukis;2016-04-11 19:00;33;40;""At $1.55tn, the combined market capitalization of Apple, Google, and Microsoft is greater than the entire CAC 40" http://on.ft.com/1qKga2s";;;;"719706701218377734";https://twitter.com/JimPethokoukis/status/719706701218377734
CRS_One;2016-04-11 18:49;34;13;"" # Views From The Six" Will Only Be Exclusive To @ AppleMusic For The First Week http://www.buzzfeed.com/brendanklinkenberg/drakes-new-album-will-only-be-exclusive-to-apple-music-for-t?utm_term=.vsyGdwDXP … via @ brendan_klink @ buzzfeednews";;@ @ @;#;"719703923167272965";https://twitter.com/CRS_One/status/719703923167272965
BuzzFeedNews;2016-04-11 18:40;51;102;"Drake’s New Album Will Only Be Exclusive To Apple Music For The First Week http://www.buzzfeed.com/brendanklinkenberg/drakes-new-album-will-only-be-exclusive-to-apple-music-for-t#.byDx845WL …pic.twitter.com/1ZoJzPJWxY";;;#;"719701773338824705";https://twitter.com/BuzzFeedNews/status/719701773338824705
businessinsider;2016-04-11 17:20;21;35;"Apple has a bunch of secret buildings named after Greek deities http://read.bi/1YqDdcX pic.twitter.com/zvYcfvH7G2";;;;"719681547226505216";https://twitter.com/businessinsider/status/719681547226505216
kazuph;2016-04-11 17:19;0;1;"試してみる。 / “Microsoftのディープラーニング採用翻訳アプリ、iOS版でもオフライン対応 - ITmedia ニュース” http://htn.to/rbhtsr # iOS # apple # Android # microsoft";;;# # # #;"719681217201745920";https://twitter.com/kazuph/status/719681217201745920
businessinsider;2016-04-11 17:15;10;12;"Here's what top Apple developers think of the Apple Watch, a year later http://read.bi/1N2FQ42 pic.twitter.com/Pf4Un9keek";;;;"719680360276226048";https://twitter.com/businessinsider/status/719680360276226048
mashableapple;2016-04-11 17:07;4;7;"The next Apple Watch won’t change that much, even though it should: http://on.mash.to/1SceVVF";;;;"719678362504048640";https://twitter.com/mashableapple/status/719678362504048640
ArtsandCultures;2016-04-11 17:02;0;0;"Kanye's Billboard No. 1 And Drake's '6' Apple Music Exclusive Show Changing Path To The Top - International… http://dlvr.it/L2CWLk";;;;"719676932393021444";https://twitter.com/ArtsandCultures/status/719676932393021444
garancedore;2016-04-11 17:00;0;6;"Fashion News: Apple to sell @ Hermes_Paris Apple Watch bands separately via @ TechCrunch /http://ow.ly/10x1lQ";;@ @;;"719676636195635201";https://twitter.com/garancedore/status/719676636195635201
AryehsSharings;2016-04-11 17:00;0;0;"More than 400 protestors were arrested at the US Capitol: Associated Press/J. Scott Apple... http://read.bi/1VOMtso  via @ Business Inside";;@;;"719676486802759680";https://twitter.com/AryehsSharings/status/719676486802759680